"No","title","authors","source","published_date","summary","content","url","Sentiment","Penerbit","Tag"
"1","BPJS Kesehatan bayar Rp8,52 triliun biaya layanan di Jateng pada 2025 - ANTARA News Jateng","ANTARA News Agency","jateng.antaranews.com","Wed, 11 Jun 2025 17:13:30 +0700","Badan Penyelenggara Jaminan Sosial (BPJS) Kesehatan mencatat total biaya penjaminan pelayanan kesehatan yang sudah dibayarkan di fasilitas kesehatan tingkat pertama maupun ANTARA News jateng peristiwa ...","Semarang (ANTARA) - Badan Penyelenggara Jaminan Sosial (BPJS) Kesehatan mencatat total biaya penjaminan pelayanan kesehatan yang sudah dibayarkan di fasilitas kesehatan tingkat pertama maupun lanjutan di Jawa Tengah selama 2025 mencapai Rp8,52 triliun. ""Sampai dengan pembebanan April 2025 ini penjaminan biaya yang sudah dibayarkan mencapai Rp8,52 triliun,"" kata Deputi Direksi Wilayah VI BPJS Kesehatan Yessi Kumalasari saat pemberian apresiasi kepatuhan pembayaran iuran JKN kepada pemerintah daerah di Jawa Tengah, di Semarang, Rabu. Sementara, lanjut dia, realisasi penerimaan iuran pada 2025 baru mencapai sekitar Rp2,76 triliun. Ia menyebut masih terdapat celah antara penerimaan yang lebih kecil dibanding dengan penjaminan biaya pelayanan kesehatan yang sudah dibayarkan. Ia menyebut selisih pembiayaan tersebut masih didukung oleh wilayah lain. Oleh karena itu, ia mendorong masyarakat yang belum aktif untuk segera mendaftar mandiri dan membayar iuran tepat waktu. Cakupan kepesertaan BPJS Kesehatan di Jawa Tengah selama 2025 ini, kata dia, sudah mencapai 37,92 juta jiwa atau 98,68 persen dari jumlah penduduk. Meski demikian, lanjut dia, tingkat keaktifannya masih di angka 75,10 persen. Yessi menyebut masih ada kabupaten/ kota di Jawa Tengah yang tingkat keaktifan membayar iurannya di bawah 80 persen. ""Ada 14 kabupaten/ kota yang terus kami dorong agar tingkat keaktifannya lebih dari 80 persen,"" katanya. Dalam kesempatan tersebut, BPJS Kesehatan memberikan apresiasi kepada daerah dengan keaktifan pembayaran iuran terbaik, yakni Kota Surakarta pada peringkat pertama, serta Kabupaten Demak dan Magelang di peringkat berikutnya. Sementara Sekretaris Daerah Provinsi Jawa Tengah Sumarno mengatakan masih ada pekerjaan rumah yang harus diselesaikan berkaitan dengan penonaktifan sekitar 1 juta penerima bantuan iuran jaminan kesehatan di provinsi ini. Ia meminta pemerintah kabupaten/ kota melakukan verifikasi ulang untuk memastikan kebenaran dana penerima yang dinonaktifkan kepesertaannya itu. ""Jangan sampai yang sebetulnya belum layak dinonaktifkan nantinya justru kesulitan saat akan membutuhkan layanan kesehatan,"" katanya. Ia menyebut jika terdapat 1 juta penerima bantuan yang dinonaktifkan kepesertaannya, maka seharusnya angka kemiskinan Jawa Tengah juga harus turun. Pewarta: Immanuel Citra Senjaya Editor: Heru Suyitno COPYRIGHT © ANTARA 2026","https://jateng.antaranews.com/berita/585553/bpjs-kesehatan-bayar-rp852-triliun-biaya-layanan-di-jateng-pada-2025","Netral","jateng.antaranews.com","Ekonomi"
"2","Kepesertaan BPJS Kesehatan di Jateng Capai 98,68 Persen","Muhammad Iqbal Al Fardi","detik.com","2025-09-03T15-58-39Z","Kepesertaan BPJS Kesehatan atau Universal Health Coverage (UHC) penduduk di Jawa Tengah (Jateng) mencapai angka 98,68% per Mei 2025.","Kepesertaan BPJS Kesehatan atau Universal Health Coverage (UHC) penduduk di Jawa Tengah (Jateng) mencapai angka 98,68% per Mei 2025. Gubernur Jateng, Ahmad Luthfi, berharap masyarakat, khususnya yang kurang mampu, mendapatkan layanan BPJS Kesehatan yang paripurna. Angka kepesertaan itu disebut Deputi Direksi Wilayah VI BPJS Kesehatan, Yessi Kumalasari, saat melakukan audiensi dengan Luthfi di Semarang pada Rabu (3/9/2025). Ada tiga aspek sistem kesehatan nasional yang dibahas dalam pertemuan tersebut, yakni kepesertaan, penerimaan, dan pelayanan kesehatan. ""Di Jawa Tengah ini, kepesertaan UHC sudah 98%. Cuma PR-nya di keaktifan peserta, di mana posisi di bulan Agustus kemarin 74-75%. Harapan kami terus bertumbuh dan di akhir tahun ini angka keaktifannya bisa 80%,"" kata Yessi dalam rilis yang diterima detikJateng , hari ini. SCROLL TO CONTINUE WITH CONTENT Pemerintah dan badan usaha telah mendukung untuk meningkatkan aspek kepesertaan dan keaktifan peserta BPJS Kesehatan, terutama kepesertaan informal. Yessi menerangkan, pemerintah tingkat provinsi maupun kabupaten dan kota telah mengalokasikan anggaran yang cukup untuk aspek penerimaan BPJS Kesehatan sehingga hanya perlu mengawal rutinitas pembayaran. Dalam aspek pelayanan kesehatan BPJS Kesehatan, kata Yessi, fasilitas kesehatan tingkat pertama dan lanjut tersedia di kabupaten dan kota. Sementara untuk penambahan fasilitas kesehatan, lanjut Yessi, bakal disesuaikan dengan kebutuhan jumlah peserta aktif di daerah. ""Tadi arahannya (dari Gubernur Jateng) kita lakukan sosialisasi bersama. Tidak hanya di level provinsi namun juga kabupaten/kota, supaya masyarakat yang mampu bisa dengan kesadarannya mendaftarkan dan membayar iuran tepat waktu,"" kata Yessi. Sementara itu, Luthfi menyebutkan BPJS Kesehatan begitu membantu masyarakat dalam mendapatkan layanan kesehatan yang paripurna, terutama bagi yang kurang mampu. Dia menekankan, agar masyarakat kurang mampu dan pekerja informal tidak tercover layanan BPJS Kesehatan. ""Prioritas kita kepada orang yang membutuhkan, jangan sampai mereka tidak memiliki pelayanan paripurna untuk BPJS. Saran saya sosialisasi terus ke mereka, kita harus jemput bola,"" imbuh Luthfi. Selanjutnya, Kepala Dinas Kesehatan Jateng, Yunita Dyah Suminar, mengatakan Dinas Kesehatan tingkat provinsi maupun kabupaten/kota, dan BPJS Kesehatan, terus mendorong pemetaan data. Dia berharap masyarakat Jateng bisa menjangkau layanan kesehatan. Dia menuturkan, peserta BPJS Kesehatan terbagi atas Penerima Bantuan Iuran (PBI) dan non-PBI. Dia menjelaskan, anggaran pemerintah menanggung peserta PBI sehingga keaktifan peserta bisa terjamin. Dia mengatakan, peserta non-PBI perlu didorong lagi, terutama bagi mereka masuk kepesertaan perorangan. Seperti halnya masyarakat mampu yang telah menjadi peserta tetapi tidak pernah menggunakan BPJS, kemudian peserta yang lalai untuk membayar secara rutin.","https://www.detik.com/jateng/jawa-tengah-meriah/d-8094624/kepesertaan-bpjs-kesehatan-di-jateng-capai-98-68-persen","Positif","detik.com","Kebijakan"
"3","BPJS Ketenagakerjaan Jateng-DIY salurkan sembako ke panti asuhan di Semarang - ANTARA News Jateng","ANTARA News Agency","jateng.antaranews.com","Tue, 10 Mar 2026 09:24:11 +0700","BPJS Ketenagakerjaan Kantor Wilayah Jawa Tengah dan DI Yogyakarta menggelar kegiatan sosial bertajuk Employee Volunteering berupa&nbsp;penyaluran bantuan paket sembako kepada ANTARA News jateng peristiwa ...","Semarang (ANTARA) - BPJS Ketenagakerjaan Kantor Wilayah Jawa Tengah dan DI Yogyakarta menggelar kegiatan sosial bertajuk Employee Volunteering berupa penyaluran bantuan paket sembako kepada anak-anak di Panti Asuhan Yatim Piatu Dhuafa Yayasan Tarbiyatul Yatim, Ngemplak, Simongan, Kota Semarang, Senin (9/3). Kegiatan yang dilaksanakan bertepatan dengan momentum bulan suci Ramadhan tersebut merupakan bentuk kepedulian insan BPJS Ketenagakerjaan terhadap masyarakat yang membutuhkan, khususnya anak-anak yatim piatu dan dhuafa. Dalam kegiatan tersebut, BPJS Ketenagakerjaan menyalurkan bantuan paket sembako dengan total nilai sekitar Rp8 juta. Bantuan tersebut diharapkan dapat membantu memenuhi kebutuhan sehari-hari para penghuni panti asuhan selama menjalani ibadah di bulan Ramadhan. Kepala Kantor Wilayah BPJS Ketenagakerjaan Jawa Tengah dan DI Yogyakarta Hesnypita mengatakan kegiatan *Employee Volunteering* merupakan wujud kepedulian sosial sekaligus semangat berbagi dari insan BPJS Ketenagakerjaan kepada masyarakat di sekitar lingkungan kerja. “Melalui kegiatan ini kami ingin berbagi kebahagiaan di bulan Ramadhan sekaligus menumbuhkan semangat kepedulian dan kebersamaan dengan masyarakat, khususnya kepada anak-anak yatim piatu dan dhuafa,” kata Hesnypita. Ia berharap bantuan yang diberikan dapat memberikan manfaat serta membantu memenuhi kebutuhan para penghuni panti asuhan selama menjalankan ibadah di bulan Ramadhan. Selain itu, kegiatan *Employee Volunteering* juga diharapkan dapat terus dilaksanakan secara berkelanjutan sebagai bentuk kontribusi nyata BPJS Ketenagakerjaan dalam memberikan manfaat bagi masyarakat sekaligus mempererat hubungan dengan lingkungan sekitar. Pewarta: Rilis Editor: Teguh Imam Wibowo COPYRIGHT © ANTARA 2026","https://jateng.antaranews.com/berita/624099/bpjs-ketenagakerjaan-jateng-diy-salurkan-sembako-ke-panti-asuhan-di-semarang","Positif","jateng.antaranews.com","Sosial"
"4","Dinkes Ungkap 1,6 Juta PBI BPJS Jateng Bakal Dinonaktifkan","Arina Zulfa Ul Haq","detik.com","2026-02-10T19-19-33Z","Berdasarkan catatan BPJS Kesehatan Jateng, ada total 14,2 juta peserta PBI-JK di Jateng. Sebanyak 1,6 juta di antaranya akan dinonaktifkan.","Dinas Kesehatan Provinsi Jawa Tengah (Jateng) mengungkapkan ada 1,6 juta warga Jateng yang bakal dinonaktifkan dari kepesertaan BPJS Kesehatan segmen Penerima Bantuan Iuran Jaminan Kesehatan (PBI-JK). Pemerintah Provinsi Jateng pun menegaskan tak boleh ada rumah sakit yang menolak pasien. Hal itu disampaikan Kepala Dinkes Jateng, Yunita Dyah Suminar. Ia menjelaskan, berdasarkan catatan BPJS Kesehatan Jateng, ada total 14,2 juta peserta PBI-JK di Jateng. ""Dari total 14,2 juta jiwa peserta PBI-JK di Jawa Tengah, sebanyak 1,6 juta jiwa dinonaktifkan pada 2026. Di antara peserta terdampak, terdapat pasien hemodialisa, kemoterapi, dan thalasemia yang membutuhkan perawatan rutin dan berkelanjutan,"" kata Yunita dalam keterangan tertulisnya, Selasa (10/2/2026). SCROLL TO CONTINUE WITH CONTENT Kendati demikian, ia menegaskan pelayanan kesehatan tetap berjalan, khususnya bagi pasien penyakit kronis yang bergantung pada terapi berkelanjutan. Menurutnya, pemerintah tetap memprioritaskan hak masyarakat untuk memperoleh layanan kesehatan, terlepas adanya kendala administratif kepesertaan jaminan kesehatan. ""Pemprov Jawa Tengah memastikan pelayanan kesehatan tetap berjalan. Tidak boleh ada penolakan pasien, terutama bagi mereka yang sedang menjalani terapi rutin dan berisiko tinggi jika pengobatan terhenti,"" jelas Yunita. Yunita pun mengimbau seluruh bupati dan wali kota agar memastikan Dinas Kesehatan di wilayah mereka untuk berkoordinasi lintas sektor dengan Dinas Sosial, BPJS Kesehatan, dan fasilitas pelayanan kesehatan di wilayah masing-masing. ""Koordinasi ini penting untuk memastikan jaminan pembiayaan dan pelayanan kesehatan bagi pasien hemodialisa, thalasemia, kemoterapi, serta penyakit kronis lainnya tetap terpenuhi selama proses penanganan administrasi berlangsung,"" jelasnya. Selain itu, Pemprov Jateng juga meminta BPJS Jateng untuk mengimbau seluruh cabang BPJS agar tetap menjamin pembiayaan layanan kesehatan bagi pasien terdampak, sembari menunggu proses reaktivasi kepesertaan PBI-JK. ""Pengawasan dan koordinasi lintas sektor akan terus diperkuat agar tidak ada masyarakat yang kehilangan akses layanan kesehatan hanya karena persoalan administratif,"" jelasnya. Deputi Direksi BPJS Kesehatan Wilayah VI, Yessi Kumalasari, pun membenarkan adanya 1,6 juta peserta PBI-JK yang dinonaktifkan di Jateng. Tiga daerah dengan jumlah peserta terdampak tertinggi yakni Kabupaten Brebes, Kota Semarang, dan Kabupaten Pemalang. ""Kalau yang tertinggi, Kabupaten Brebes 100.552 jiwa. Kota Semarang 98.545 jiwa, kemudian Kabupaten Pemalang 83.746 jiwa. Itu tiga terbesar di wilayah Jawa Tengah,"" kata Yessi saat dikonfirmasi. Menurut Yessi, mutasi data PBI JKN dilakukan berdasarkan hasil verifikasi dan validasi Kementerian Sosial (Kemensos). Peserta PBI-JK yang selama ini masih mendapat layanan kesehatan meski masuk desil 6-10 kini otomatis dinonaktifkan ""Peserta yang masih dianggap layak untuk mendapatkan bantuan yaitu dari desil 1-5 dan secara berkala, nanti bertahap desil 6-10 akan dibersihkan,"" tuturnya. Untuk memastikan masyarakat tetap mendapatkan layanan kesehatan, BPJS Kesehatan telah berkoordinasi dengan Dinas Sosial dan fasilitas kesehatan. Ada beberapa opsi yang bisa ditempuh masyarakat terdampak. ""Pertama kembali menjadi peserta PBI-JK, cukup koordinasi dengan Dinas Sosial, ada surat ke keterangan membutuhkan layanan kesehatan, kemudian ada format dari Dinas Sosial yang harus diisi,"" terangnya. ""Dari Dinas Sosial akan dieskalasi ke Pusdatin untuk dilakukan verifikasi dan validasi dan kalau memang berhak nanti akan kembali ke Dinas Sosial untuk diproses bersama BPJS Kesehatan, approval reaktivasi,"" lanjutnya. Namun, tambahnya, yang menjadi kendala yakni proses verifikasi dan validasi di Pusdatin memang tidak semuanya cepat. Bila layanan tidak bisa ditunda, peserta dapat beralih menjadi peserta mandiri. ""Apabila memang tidak memungkinkan menunda layanan, ada opsi kedua untuk diaktifkan kepesertaannya yaitu menjadi jadi peserta mandiri,"" ucapnya. Pendaftaran bisa dilakukan melalui kantor BPJS Kesehatan atau kanal non-tatap muka seperti layanan administrasi via WhatsApp di nomor 08118-165-165 yang beroperasi 24 jam. ""Kalau memang tidak mampu BPI mandiri, di Jawa Tengah masih ada opsi agar ditanggung oleh pemerintah daerah dengan pembiayaan dari anggaran pemerintah kabupaten/kota,"" kata Yessi. Yessi menyebut saat ini terdapat 17 kabupaten/kota di Jawa Tengah yang berstatus non cut off , yakni pemerintah daerah punya cukup anggaran dan komitmen cakupan kepesertaan 98 persen. ""Artinya kalau sudah didaftarkan 1x24 jam melalui pemerintah daerah, bisa langsung aktif di kemudian hari haknya di kelas 3 dan itu bisa terus dimanfaatkan sampai proses verifikasi dan validasi berikutnya,"" jelasnya. ""Memang yang jadi problem itu yang 18 kabupaten/kota yang masih cut off, kalau hari ini didaftarkan oleh pemerintah daerah, maka baru bisa aktif di tanggal 1. Tentu ini tidak ideal buat masyarakat yang membutuhkan layanan dalam waktu dekat,"" sambungnya. Berdasarkan data hingga Selasa (9/2/2026), pukul 02.30 WIB, total usulan reaktivasi dari Dinas Sosial yang masuk ke BPJS Kesehatan mencapai 19 ribu jiwa. ""Total data yang diusulkan oleh Dinas Sosial ke Pusdatin dan masuk ke BPJS Kesehatan, total ada 19 ribu jiwa yang proses reaktivasi, yang sukses 17 ribu, sisa yang lain memang kita berkala untuk melakukan reaktivasi,"" urainya. ""Kami dari BPJS Kesehatan berupaya berkomitmen kalau sudah ada data feedback dari Pusdatin masuk ke BPJS Kesehatan, akan kita aktivasi 1x24 jam. Karena kita paham yang diaktivasi itu masyarakat yang butuh layanan,"" tambahnya.","https://www.detik.com/jateng/berita/d-8350195/dinkes-ungkap-1-6-juta-pbi-bpjs-jateng-bakal-dinonaktifkan","Negatif","detik.com","Kebijakan"
"5","267.000 BPJS PBI Warga Jateng Dinonaktifkan, Ini Penyebab dan Solusinya","Kompas Cyber Media","regional.kompas.com","2025-07-09T22:09:00+00:00","Data terbaru menyebut 267.029 warga dinonaktifkan dari BPJS PBI karena dianggap tak lagi memenuhi syarat.","267.000 BPJS PBI Warga Jateng Dinonaktifkan, Ini Penyebab dan Solusinya SEMARANG, KOMPAS.com – Sebanyak 267.029 warga Jawa Tengah dinonaktifkan dari kepesertaan BPJS Kesehatan Penerima Bantuan Iuran (PBI). Akibatnya, mereka harus membayar sendiri layanan kesehatan, termasuk saat berobat maupun melakukan pemeriksaan kesehatan di fasilitas layanan kesehatan (faskes). Penonaktifan ini merupakan tindak lanjut dari evaluasi Data Terpadu Kesejahteraan Sosial (DTKS) yang kini menggunakan acuan baru, yakni Data Terpadu Sosial Ekonomi Nasional (DTSEN). Kebijakan ini juga merujuk pada surat dari Menteri Sosial tertanggal 3 Juni 2025. Baca juga: Ombudsman Jateng Terima Aduan BPJS PBI Nonaktif, Dorong Penanganan Cepat Awalnya, terdapat 1,1 juta warga Jawa Tengah yang dinonaktifkan dari kepesertaan PBI. Namun setelah dilakukan pendataan ulang, jumlah tersebut berkurang menjadi 267.029 jiwa. “Untuk yang terbaru, penetapan tanggal 25 Juni kemarin, total penghapusan PBI turun menjadi 267.029 jiwa untuk Jawa Tengah,” kata Kepala Dinas Sosial (Dinsos) Jawa Tengah, Imam Maskur, saat dihubungi melalui sambungan telepon, Rabu (9/7/2025). Imam menjelaskan bahwa penonaktifan kepesertaan PBI disebabkan oleh beberapa faktor. Sebanyak 9.900 peserta terdata telah meninggal dunia, sehingga otomatis dihapus. Selain itu, 27.763 orang berpindah segmen, misalnya menjadi peserta mandiri atau beralih ke asuransi kesehatan lain. ""12.890 pekerjaannya tidak sesuai karena PNS atau TNI atau Polri. Lalu 216.476 masuk desil 6 sampai dengan desil 10 pada DTSEN,"" lanjutnya. Menurut Maskur, kriteria desil 6 hingga 10 mengindikasikan bahwa mereka dianggap sudah mampu secara ekonomi, sehingga tidak lagi memenuhi syarat sebagai penerima PBI. Baca juga: Gara-gara DTSEN, 22.450 Warga Lumajang Dihapus dari Daftar PBIJK, Harus Bayar BPJS Mandiri Namun demikian, Dinsos Jateng telah berkoordinasi dengan BPJS Kesehatan dan jajaran Dinsos kabupaten/kota untuk membuka kemungkinan dilakukannya reaktivasi bagi warga Jateng yang mesih membutuhkan layanan BPJS PBI . ""Reaktivasi kembali boleh bagi mereka yang punya kriteria sakitnya kronis, kaya stroke dalam kondisi darurat medis yang mengancam keselamatan jiwa mereka. Ini bisa di direaktivasi kembali oleh Dinas Sosial Kabupaten,"" katanya. Dia menilai, reaktivasi dapat menjalu solusi bagi ratusan ribu warga Jateng yang terdampak penonaktivan peserta BPJS PBI. ""Jadi kami minta data dari BPJS mana sih yang terdelete itu mana saja? Kami tarik datanya. Kemudian kami informasikan kepada (Dinso) Kabupaten/Kota,"" tuturnya. Copyright 2008 - 2026 PT. Kompas Cyber Media (Kompas Gramedia Digital Group). All Rights Reserved.","https://regional.kompas.com/read/2025/07/10/050900378/267.000-bpjs-pbi-warga-jateng-dinonaktifkan-ini-penyebab-dan-solusinya","Negatif","regional.kompas.com","Kebijakan"
"6","Proses Reaktivasi BPJS PBI di Purworejo, 161 Usulan Disetujui, 73 Ditolak","Kompas Cyber Media","regional.kompas.com","2026-03-06T06:34:55+00:00","Pemkab Purworejo mukai memproses reaktivasi BPJS PBI yang dinonaktifkan. Ada 161 usulan yang disetujui dan 73 usulan ditolak.","Proses Reaktivasi BPJS PBI di Purworejo, 161 Usulan Disetujui, 73 Ditolak PURWOREJO, KOMPAS.com — Pemerintah Kabupaten (Pemkab) Purworejo mulai melakukan reaktivasi kepesertaan BPJS Penerima Bantuan Iuran Jaminan Kesehatan Nasional (PBI-JKN) yang sempat dinonaktifkan. Diketahui, total ada 14.441 jiwa yang kepesertaan PBI-JKN dinonaktifkan. Saat ini, sudah ada 529 usulan reaktivasi. Dari jumlah tersebut 161 usulan dinyatakan disetujui, 282 masih dalam proses, dan 73 usulan ditolak. Kepala Dinas Sosial Pengendalian Penduduk dan Keluarga Berencana ( Dinsosdaldukkb ) Kabupaten Purworejo , Andang Nugerahantara Sutrisno mengatakan, bahwa proses reaktivasi menjadi prioritas utama. Khususnya bagi masyarakat yang memiliki kondisi kesehatan serius dan membutuhkan biaya pengobatan besar. Baca juga: RUU PPRT Bakal Atur BPJS Kesehatan dan Ketenagakerjaan Jadi Syarat Rekrut PRT “Berdasarkan data terbaru yang sudah kita kumpulkan, terdapat 14.441 jiwa di Kabupaten Purworejo yang status kepesertaan PBI-JKN-nya dinonaktifkan. Hal ini terjadi karena dinamika perubahan data kemiskinan serta pembaruan sistem di tingkat pusat,” kata Andang, Jumat (6/3/2026). Pihaknya terus melakukan pembaruan data agar warga yang berhak tetap dapat memperoleh layanan kesehatan. Dalam proses reaktivasi, pemerintah menerapkan skala prioritas. Warga yang mengidap penyakit katastropik atau penyakit berat diprioritaskan untuk kembali mendapatkan jaminan kesehatan. Kepala Bidang (Kabid) Pemberdayaan, Perlindungan, dan Jaminan Sosial Dinsosdaldukkb Purworejo, Sarinah menambahkan, hingga saat ini pihaknya telah mengajukan 529 usulan reaktivasi. Dari jumlah tersebut, sebanyak 161 usulan diantaranya sudah disetujui. ""282 masih menunggu proses persetujuan dari Kementerian Sosial, dan 73 usulan ditolak karena alasan sistemis,” ujar Sarinah. Baca juga: Tak Hanya Iuran, BPJS Watch Soroti Pajak Rokok untuk Tambahan Biaya JKN Ia menjelaskan, penolakan biasanya terjadi karena peserta sebelumnya sudah pernah direaktivasi atau karena yang bersangkutan telah masuk kategori ekonomi Desil 6 hingga Desil 10, yang berarti tidak lagi masuk dalam kelompok prioritas penerima bantuan. Untuk proses pengusulan reaktivasi, masyarakat diminta memperhatikan jadwal yang telah ditentukan oleh sistem. Pengajuan hanya dapat dilakukan pada periode tertentu setiap bulan. “Waktu pengusulan dibuka setiap tanggal 1 sampai 10 setiap bulannya. Mekanismenya melalui operator desa yang mengajukan data warga,” jelas Sarinah. Baca juga: Pemprov Kalteng Tanggung BPJS 650.000 Warga, Gubernur: Jangan Kena Efisiensi Adapun kriteria penerima yang dapat diusulkan adalah warga yang terdaftar dalam Data Tunggal Sosial Ekonomi Nasional (DTSEN) dengan tingkat kesejahteraan Desil 1 hingga Desil 5. Meski ada peserta yang dinonaktifkan, Sarinah memastikan masyarakat Purworejo tetap memiliki akses layanan kesehatan. Hal ini karena Kabupaten Purworejo telah mencapai status Universal Health Coverage (UHC) serta memiliki program Jamkesda sebagai jaring pengaman tambahan. Copyright 2008 - 2026 PT. Kompas Cyber Media (Kompas Gramedia Digital Group). All Rights Reserved.","https://regional.kompas.com/read/2026/03/06/133455278/proses-reaktivasi-bpjs-pbi-di-purworejo-161-usulan-disetujui-73-ditolak","Netral","regional.kompas.com","Kebijakan"
"7","BPJS Ketenagakerjaan dan BBPVP Semarang komitmen tingkatkan perlindungan sosial - ANTARA News Jateng","ANTARA News Agency","jateng.antaranews.com","Tue, 10 Mar 2026 10:26:52 +0700","BPJS Ketenagakerjaan&nbsp;Cabang Semarang Majapahit menjalin kerja sama dengan Balai Besar Pelatihan Vokasi dan Produktivitas (BBPVP) Semarang untuk meningkatkan kompetensi dan ANTARA News jateng peristiwa ...","Semarang (ANTARA) - BPJS Ketenagakerjaan Cabang Semarang Majapahit menjalin kerja sama dengan Balai Besar Pelatihan Vokasi dan Produktivitas (BBPVP) Semarang untuk meningkatkan kompetensi dan perlindungan sosial bagi tenaga kerja. Hal itu terlihat dengan adanya penandatangan kerjasama (MoU) antara BPJS Ketenagakerjaan dengan Balai Besar Pelatihan Vokasi dan Produktivitas (BBPVP) Semarang, pada Senin (9/3). MoU yang ditandatangani oleh Kepala BPJS Ketenagakerjaan Semarang Majapahit Farah Diana dan Kepala BBPVP Semarang, Fikri Kurniakiki di kantor BBPVP Semarang, guna melindungi peserta pelatihan kerja yang sementara magang. Salah satu aspek utama dalam kesepakatan ini adalah memastikan para peserta program pelatihan dan pemagangan yang diselenggarakan BBPVP Semarang terdaftar dalam program perlindungan jaminan sosial ketenagakerjaan, meliputi Jaminan Kecelakaan Kerja (JKK) dan Jaminan Kematian (JKM). Kepala BPJS Ketenagakerjaan Cabang Semarang Majapahit, Farah Diana menegaskan, kerja sama ini sangat penting untuk memberikan perlindungan kepada tenaga kerja yang sedang mengikuti pelatihan dan pemagangan, sekaligus meningkatkan kompetensi mereka agar lebih siap menghadapi tantangan di dunia kerja. “Dengan adanya perlindungan jaminan sosial ketenagakerjaan, kami berharap para peserta program ini dapat bekerja dengan lebih tenang dan fokus, tanpa khawatir tentang kemungkinan risiko yang dapat terjadi selama proses pemagangan atau pelatihan,” ujarnya. “Semoga BPJS Ketenagakerjaan bisa terus memberikan manfaat kepada seluruh pekerja Indonesia, baik yang sudah bekerja maupun yang sedang dalam proses pelatihan, agar mereka dapat meraih masa depan yang lebih baik,” katanya. Melalui kolaborasi ini, BPJS Ketenagakerjaan berharap dapat memberikan kontribusi signifikan dalam menciptakan tenaga kerja yang terampil dan terlindungi. Pewarta: Rilis Editor: Teguh Imam Wibowo COPYRIGHT © ANTARA 2026","https://jateng.antaranews.com/berita/624107/bpjs-ketenagakerjaan-dan-bbpvp-semarang-komitmen-tingkatkan-perlindungan-sosial","Positif","jateng.antaranews.com","Kebijakan"
