"No","title","authors","source","published_date","summary","content","url","Sentiment","Penerbit","Tag"
"75","Waspada Link Hoaks BSU 2026 Beredar di Media Sosial!","Ilyas Fadilah","finance.detik.com","2026-01-07T11-43-57Z","Kementerian Ketenagakerjaan (Kemnaker) mengimbau masyarakat mewaspadai informasi palsu atau hoaks yang mengatasnamakan program Bantuan Subsidi Upah (BSU) 2026.","Kementerian Ketenagakerjaan (Kemnaker) mengimbau masyarakat mewaspadai informasi palsu atau hoaks yang mengatasnamakan program Bantuan Subsidi Upah (BSU) 2026, terutama yang memuat tautan pendaftaran tidak resmi dan berpotensi penipuan. Klarifikasi ini disampaikan menyusul beredarnya berbagai unggahan di media sosial, pesan berantai, hingga berita di media massa yang mencatut program BSU 2026 sehingga menimbulkan keresahan di masyarakat. Kepala Biro Humas Kemnaker, Faried Abdurrahman Nur Yuliono, menegaskan pentingnya kehati-hatian masyarakat dalam menyikapi informasi BSU yang beredar di luar kanal resmi pemerintah. SCROLL TO CONTINUE WITH CONTENT ""Kami mengimbau masyarakat agar tidak mudah percaya pada hoaks dan disinformasi tentang BSU, khususnya yang mengarahkan pendaftaran melalui tautan tidak resmi, karena BSU tidak memerlukan pendaftaran mandiri. Informasi resmi BSU hanya disampaikan melalui laman bsu.kemnaker.go.id dan media sosial resmi Kementerian Ketenagakerjaan,"" ujar Faried dalam keterangan tertulis, Rabu (7/1/2026). Sebagai informasi, penyaluran BSU terakhir dilakukan pada 2025 dengan jumlah penerima sebanyak 16.048.472 pekerja/buruh sesuai ketentuan yang berlaku. Faried menegaskan bahwa hingga saat ini belum terdapat kebijakan maupun informasi resmi terkait penyaluran BSU pada tahun 2026. ""Perlu kami sampaikan bahwa sampai saat ini belum ada informasi apa pun terkait BSU tahun 2026. Jika ke depan terdapat kebijakan baru, Kemnaker akan menyampaikannya secara terbuka melalui kanal resmi,"" tegas Faried. Faried juga mengajak masyarakat untuk selalu memeriksa kebenaran informasi sebelum membagikannya, serta melaporkan apabila menemukan indikasi penipuan yang mengatasnamakan program BSU agar tidak menimbulkan kerugian di masyarakat. Tonton juga video ""Sri Mulyani Kena Deepfake, Ini Pernyataan Aslinya soal Guru-Dosen"" [Gambas:Video 20detik]","https://finance.detik.com/berita-ekonomi-bisnis/d-8295677/waspada-link-hoaks-bsu-2026-beredar-di-media-sosial","Negatif","finance.detik.com","Sosial"
"76","8.389 Orang Jadi Korban PHK hingga Maret, Paling Banyak dari Provinsi Ini","Retno Ayuningrum","finance.detik.com","2026-04-12T12-28-38Z","Kementerian Ketenagakerjaan (Kemnaker) mencatat sebanyak 8.389 orang menjadi korban pemutusan hubungan kerja (PHK) hingga Maret 2026.","Kementerian Ketenagakerjaan (Kemnaker) mencatat sebanyak 8.389 orang menjadi korban pemutusan hubungan kerja (PHK) hingga Maret 2026. Pekerja tersebut merupakan yang terklasifikasi sebagai peserta program Jaminan Kehilangan Pekerjaan (JKP) BPJS Ketenagakerjaan. ""Pada periode Januari sampai dengan Maret 2026 terdapat 8.389 orang tenaga kerja ter-PHK (Pemutusan Hubungan Kerja) yang terklasifikasi sebagai peserta program JKP,"" bunyi laporan Satu Data Kemnaker, dikutip Minggu (12/4/2026). Jika dilihat per bulannya, jumlah korban PHK di Januari mencapai 4.590 orang. Pada Februari, jumlah tenaga kerja yang terkena PHK menjadi 3.273 orang. SCROLL TO CONTINUE WITH CONTENT Lalu pada Maret, jumlah korban PHK menjadi 526 orang. Jumlah tenaga kerja yang paling banyak di-PHK berada di Provinsi Jawa Barat dengan kontribusi sekitar 20,51% dari total tenaga kerja. ""Tenaga kerja ter-PHK pada periode ini paling banyak terdapat di Provinsi Jawa Barat yaitu sekitar 20,51 persen dari total tenaga kerja ter-PHK yang dilaporkan,"" tambah laporan tersebut. Adapun total tenaga kerja yang di-PHK di Jawa Barat mencapai 1.721 orang hingga Maret 2026. Kemudian disusul Kalimantan Selatan dengan total 1.071 orang.","https://finance.detik.com/berita-ekonomi-bisnis/d-8440551/8-389-orang-jadi-korban-phk-hingga-maret-paling-banyak-dari-provinsi-ini","Negatif","finance.detik.com","Ekonomi"
"77","BPJS Ketenagakerjaan Wajib, Ini Keuntungannya Buat Pekerja","https://www.facebook.com/detikfinance","finance.detik.com","2014-09-24T16-07-48Z","Pekerja formal maupun informal di Indonesia wajib ikut serta dalam program BPJS Ketenagakerjaan yang dulu dikenal dengan sebutan Jamsostek.","SCROLL TO CONTINUE WITH CONTENT","https://finance.detik.com/berita-ekonomi-bisnis/d-2699934/bpjs-ketenagakerjaan-wajib-ini-keuntungannya-buat-pekerja","Positif","finance.detik.com","Kebijakan"
"78","Daftar BPJS Ketenagakerjaan Sekarang Bisa Dapat Bantuan Rp 600 Ribu?","Anisa Indraini","finance.detik.com","2020-08-27T14-28-36Z","Pegawai yang mendaftar BPJS Ketenagakerjaan sekarang ini tak bisa menerima bantuan Rp 600 ribu tersebut.","Syarat pegawai swasta yang mau dapat bantuan Rp 600 ribu per bulan harus terdaftar di BPJS Ketenagakerjaan dengan gaji di bawah Rp 5 juta. Walaupun bergaji Rp 5 juta namun tidak terdaftar di BPJS Ketenagakerjaan, tidak masuk dalam penerima. Dari target 15,7 penerima, bantuan baru diberikan kepada 2,5 juta pekerja sebagai tahap awal. Targetnya sampai September 2020 seluruh pekerja yang sudah terdata bisa ditransfer bantuan tersebut. Meskipun masih ada waktu untuk sampai September, sayangnya pegawai yang mendaftar BPJS Ketenagakerjaan sekarang ini tak bisa menerima bantuan Rp 600 ribu tersebut. SCROLL TO CONTINUE WITH CONTENT Deputi Direktur Bidang Humas dan Antar Lembaga BP Jamsostek, Irvansyah Utoh Banja mengatakan data peserta BPJS Ketenagakerjaan untuk penerima bantuan ditutup sejak 30 Juni 2020. Sehingga jika daftar hari ini, tetap tidak bisa mendapat bantuan Rp 600 ribu per bulan. ""Sesuai dengan Permenaker (Peraturan Menteri Ketenagakerjaan) Nomor 14 Tahun 2020, cut off datanya peserta aktif per 30 Juni 2020. Jadi yang tidak terdaftar sebagai peserta aktif pada tanggal tersebut tidak berhak,"" kata Utoh kepada detikcom, Kamis (27/8/2020). Saat peluncuran bantuan Rp 600 ribu yang dilakukan hari ini, Menteri Ketenagakerjaan Ida Fauziah berharap bantuan tersebut dapat menjaga serta meningkatkan daya beli pekerja atau buruh untuk mendongkrak konsumsi masyarakat sehingga dapat menumbuhkan ekonomi dan kesejahteraan masyarakat. ""BSU yang diberikan oleh pemerintah ini menjadi salah satu nilai tambah menjadi peserta BP Jamsostek. Tentunya upaya yang dilakukan pemerintah ini dapat dimanfaatkan sebaik-baiknya oleh masyarakat pekerja. Kami terus mengimbau kepada perusahaan agar selalu mendukung dan dapat berkontribusi positif dalam meningkatkan kesejahteraan para pekerjanya,"" ucapnya dalam keterangan resmi.","https://finance.detik.com/berita-ekonomi-bisnis/d-5148813/daftar-bpjs-ketenagakerjaan-sekarang-bisa-dapat-bantuan-rp-600-ribu","Netral","finance.detik.com","Ekonomi"
"79","Mulai April 2026, iuran ringan BPJS Ketenagakerjaan untuk pekerja informal hanya Rp8.400 - ANTARA News Jateng","ANTARA News Agency","jateng.antaranews.com","Wed, 01 Apr 2026 16:16:42 +0700","Angin segar datang bagi para pekerja informal. Pemerintah resmi memberlakukan kebijakan keringanan iuran program BPJS Ketenagakerjaan melalui Peraturan Pemerintah Nomor 50 Tahun ANTARA News jateng peristiwa ...","Solo (ANTARA) - Angin segar datang bagi para pekerja informal. Pemerintah resmi memberlakukan kebijakan keringanan iuran program BPJS Ketenagakerjaan melalui Peraturan Pemerintah Nomor 50 Tahun 2025 yang mulai berlaku pada 1 April 2026. Melalui kebijakan tersebut, pekerja bukan penerima upah (BPU) seperti pedagang, petani, nelayan, hingga pelaku UMKM kini bisa mendapatkan perlindungan jaminan sosial dengan iuran yang jauh lebih terjangkau, yakni hanya Rp8.400/bulan. Program ini akan berjalan hingga Desember 2026 dan ditujukan khusus bagi sektor informal di luar transportasi. Kepala Kantor BPJS Ketenagakerjaan Semarang Majapahit Farah Diana menyebut kebijakan ini sebagai langkah strategis dalam memperluas perlindungan sosial bagi masyarakat, khususnya di daerah. Menurutnya, biaya iuran yang sangat ringan diharapkan mampu mendorong lebih banyak pekerja informal untuk ikut serta dalam program jaminan sosial ketenagakerjaan. “Ini menjadi kesempatan besar bagi masyarakat, terutama pekerja informal, untuk mendapatkan perlindungan kerja dengan biaya yang sangat terjangkau namun manfaatnya tetap maksimal,” ujarnya. Menariknya, meskipun iuran dipangkas hingga setengahnya, manfaat perlindungan tetap diberikan secara penuh. Peserta tetap berhak memperoleh perawatan medis akibat kecelakaan kerja, santunan kematian sebesar Rp42 juta, serta manfaat beasiswa bagi anak peserta sesuai ketentuan yang berlaku. Ia mengajak masyarakat untuk segera mendaftar dan memanfaatkan program tersebut sebagai bentuk perlindungan diri sekaligus jaminan bagi keluarga di masa depan. Program tersebut berlaku bagi peserta BPU yang baru mendaftar, dengan syarat iuran dibayarkan secara mandiri dan tidak ditanggung oleh APBN maupun APBD. Program ini menjadi bukti komitmen BPJS Ketenagakerjaan dalam menghadirkan perlindungan menyeluruh bagi seluruh pekerja Indonesia, sekaligus mendukung peningkatan kesejahteraan masyarakat secara berkelanjutan. Pewarta: Aris Wasita Editor: Edhy Susilo COPYRIGHT © ANTARA 2026","https://jateng.antaranews.com/berita/627225/mulai-april-2026-iuran-ringan-bpjs-ketenagakerjaan-untuk-pekerja-informal-hanya-rp8400","Positif","jateng.antaranews.com","Ekonomi"
"80","Anggaran kesehatan 2026 Rp128 T, alokasi BPJS Kesehatan terbesar","antaranews.com","antaranews.com","2025-08-15T19:33:33+07:00","Menteri Kesehatan Budi Gunadi Sadikin mengatakan, dari total anggaran 2026 untuk program-program kesehatan sebesar Rp128 triliun, pos anggaran terbesar yakni ...","Jakarta (ANTARA) - Menteri Kesehatan Budi Gunadi Sadikin mengatakan, dari total anggaran 2026 untuk program-program kesehatan sebesar Rp128 triliun, pos anggaran terbesar yakni untuk BPJS Kesehatan sekitar Rp59 triliun. Dalam konferensi pers RAPBN dan Nota Keuangan Tahun Anggaran 2026 di Jakarta, Jumat, Budi menjelaskan bahwa selain untuk BPJS Kesehatan, anggaran sebesar Rp9,7 triliun digunakan untuk tiga program hasil terbaik cepat (PHTC), yakni Cek Kesehatan Gratis (CKG), eliminasi tuberkulosis (TB), dan peningkatan RS kelas D menjadi kelas C yang berkualitas. Kemudian, sebesar Rp32,9 triliun untuk dukungan pelayanan di fasilitas kesehatan, antara lain layanan di 38 RS pemerintah pusat dan vaksin untuk sebanyak kurang lebih 2 juta anak. Sebanyak Rp2,5 triliun untuk penyediaan tenaga kesehatan, antara lain untuk pendidikan calon tenaga kesehatan di Politeknik Kesehatan, beasiswa, dan magang dokter serta dokter gigi. Kemudian, katanya, Rp12,7 triliun untuk Bantuan Operasional Kesehatan (BOK) di 508 kabupaten dan kota, antara lain untuk imunisasi, CKG, dan tunjangan khusus dokter spesialis di Daerah Tertinggal, Perbatasan, dan Kepulauan (DTPK). Dia menyebutkan, dari anggaran sebesar Rp128 triliun itu, sekitar Rp14,5 triliun disalurkan ke Anggaran Pendapatan dan Belanja Daerah (APBD). Adapun pada 2025, katanya, anggaran Kemenkes tercatat sebesar Rp105,6 triliun.​​​​​​ Baca juga: Menkes pastikan Cek Kesehatan Gratis pelajar menyasar daerah terpencil Baca juga: Menkes paparkan transformasi kesehatan pada mahasiswa baru UNP Pewarta: Mecca Yumna Ning Prisie Editor: Riza Mulyadi Copyright © ANTARA 2025 Dilarang keras mengambil konten, melakukan crawling atau pengindeksan otomatis untuk AI di situs web ini tanpa izin tertulis dari Kantor Berita ANTARA. Kirim Komentar menjadi tanggung-jawab Anda sesuai UU ITE.","https://www.antaranews.com/berita/5041317/anggaran-kesehatan-2026-rp128-t-alokasi-bpjs-kesehatan-terbesar","Netral","antaranews.com","Ekonomi"
"81","Presiden resmi tetapkan kepemimpinan baru BPJS Ketenagakerjaan periode 2026--2031 - ANTARA News Ambon, Maluku","ANTARA News Agency","ambon.antaranews.com","2026-02-24T10:25:03+07:00","Presiden Republik Indonesia Prabowo Subianto resmi mengangkat jajaran Dewan Pengawas dan Direksi BPJS Ketenagakerjaan untuk masa jabatan 2026&ndash;2031 ...","Ternate (ANTARA) - Presiden Republik Indonesia Prabowo Subianto resmi mengangkat jajaran Dewan Pengawas dan Direksi BPJS Ketenagakerjaan untuk masa jabatan 2026–2031 melalui Keputusan Presiden Nomor 18/P Tahun 2026. Penetapan ini efektif berlaku sejak 19 Februari 2026 dan merupakan langkah strategis untuk memperkuat pelaksanaan program jaminan sosial ketenagakerjaan di seluruh Indonesia. Pelantikan pengurus baru dilakukan oleh Menteri Koordinator Bidang Pemberdayaan Masyarakat Muhaimin Iskandar, yang mewakili Presiden dalam upacara resmi di Jakarta. Susunan baru tersebut dipimpin oleh Saiful Hidayat sebagai Direktur Utama menggantikan Pramudya Iriawan Buntoro serta Dedi Hardianto sebagai Ketua Dewan Pengawas, menggantikan Muhammad Zuhri. Dalam arah kebijakan lima tahun ke depan, manajemen yang baru menegaskan pentingnya memperluas cakupan perlindungan bagi seluruh pekerja, termasuk yang bekerja di sektor informal dan pekerja migran, memperkuat kualitas layanan, serta memastikan tata kelola yang akuntabel dan transparan. “Penetapan kepemimpinan baru ini menjadi momentum penting untuk memperluas perlindungan jaminan sosial ketenagakerjaan tidak hanya di pusat, tetapi sampai ke wilayah–wilayah terpencil,” ujar Kepala Kantor BPJS Ketenagakerjaan Cabang Ternate, I Wayan Alit Mahendra Putra Adi N. Menurutnya, peran BPJS Ketenagakerjaan di daerah sangat krusial terutama dalam menjaga kesejahteraan tenaga kerja lokal yang rentan terhadap risiko pekerjaan. Lebih lanjut, pihak manajemen BPJS Ketenagakerjaan juga menegaskan komitmen untuk kolaborasi lintas sektor dalam memperkuat perlindungan sosial secara berkelanjutan, serta memperkuat kepercayaan publik terhadap program jaminan sosial nasional. Pewarta: Abdul Fatah Uploader : Moh Ponting COPYRIGHT © ANTARA 2026","https://ambon.antaranews.com/berita/318274/presiden-resmi-tetapkan-kepemimpinan-baru-bpjs-ketenagakerjaan-periode-2026-2031","Netral","ambon.antaranews.com","Kebijakan"
"82","Rujukan BPJS Kesehatan Akan Diubah, Tak Lagi Berjenjang, Menkes: Keburu Wafat Kalau Terus Berjenjang - Wartakotalive.com","","wartakota.tribunnews.com","Tayang:Jumat, 14 November 2025 10:54 WIB","Menteri Kesehatan (Menkes) Budi Gunadi Sadikin mengungkapkan bahwa pihaknya sudah merencanakan untuk mengubah sistem rujukan pasien BPJS Kesehatan","Belum punya akun? Daftar Akun Download TribunX untuk Android & iOS WARTAKOTALIVE.COM, JAKARTA -- Menteri Kesehatan (Menkes) Budi Gunadi Sadikin mengungkapkan bahwa pihaknya sudah merencanakan untuk mengubah sistem rujukan bagi pasien BPJS Kesehatan . Dimana, cara sebelumnya dengan harus melalui rujukan berjenjang agar bisa dilayani, akan dipangkas atau diubah menjadi berbasis kompetensi. Artinya rujukan langsung ke rumah sakit yang bisa menangani disesuaikan dengan kebutuhan medis pasien BPJS Kesehatan . Perubahan ini, menurut Budi Gunadi akan memberikan keuntungan bagi BPJS Kesehatan maupun masyarakat. Karena cara sebelumnya, mereka mesti mendapat rujukan 3 kali untuk penyakit tertentu agar bisa mendapatkan pengobatan atau perawatan, sementara sistem yang baru tidak. Baca juga: Tak Mampu Lagi Bayar Iuran BPJS Kesehatan, Warga Bekasi Timur Curhat ke Anggota DPRD Hal itu disampaikan Menkes Budi Gunadi Sadikin saat rapat dengan Komisi IX DPR dan BPJS Kesehatan , di DPR, Kamis (13/11/2025). Ia mengatakan sistem rujukan yang berlaku saat ini mewajibkan pasien bergerak dari Rumah Sakit (RS) kelas D, lalu ke RS kelas C, kemudian B, sampai A. Namun, rencana ke depan akan menghilangkan sistem berjenjang tersebut dan menggantinya dengan rujukan sesuai kompetensi layanan yang dibutuhkan pasien. Hal ini bertujuan agar pasien tidak perlu bolak-balik antar rumah sakit untuk mendapatkan penanganan yang spesifik. Dirjen Kesehatan Lanjutan Kemenkes, Azhar Jaya, menjelaskan bahwa fokus perubahan adalah pada indikasi medis dan tingkat keparahan penyakit. ""Kalau saat ini adalah rujukannya berjenjang, rumah sakit kelas D, C, B, sampai A, maka ke depan kami akan lakukan perubahan rujukan berbasis kompetensi,"" kata Azhar Jaya. Menurutnya sejak awal, aasien akan dirujuk sesuai dengan kebutuhannya. ""Jadi tidak harus berjenjang,"" katanya. Azhar menambahkan bahwa Fasilitas Kesehatan Tingkat Pertama (FKTP) nantinya dapat merujuk pasien langsung ke RS Madya hingga Paripurna, tergantung dari kebutuhan medis yang dibutuhkan pasien. Keburu Wafat Kalau Terus Berjenjang Menteri Kesehatan Budi Gunadi Sadikin menegaskan bahwa sistem rujukan tak berjenjang ini akan membawa manfaat bagi masyarakat sekaligus menghemat pengeluaran BPJS. Budi meyakini rujukan langsung tidak berjenjang ini akan membuat masyarakat senang. Ia memberikan ilustrasi bagaimana rujukan berjenjang saat ini memperlambat penanganan kondisi darurat.","https://wartakota.tribunnews.com/nasional/874141/rujukan-bpjs-kesehatan-akan-diubah-tak-lagi-berjenjang-menkes-keburu-wafat-kalau-terus-berjenjang","Positif","wartakota.tribunnews.com","Kebijakan"
"83","Data BPJS PBI Sebut 50 Persen Rakyat Indonesia Miskin, Rieke Sentil Menkeu: Kategori Negara Kita Apa - Wartakotalive.com","","wartakota.tribunnews.com","Tayang:Senin, 9 Februari 2026 12:33 WIB","Data PBI JKN Sebut 50 Persen Rakyat Indonesia Miskin, Rieke Sentil Menkeu: Kategori Negara Kita Apa?","Belum punya akun? Daftar Akun Download TribunX untuk Android & iOS Ringkasan Berita: Rieke Diah Pitaloka menyebut jika data PBI mencapai 143,9 juta jiwa, artinya 50,31 persen penduduk RI dikategorikan tidak mampu, sebuah angka yang ia ragukan faktualitasnya Rieke meminta pemerintah segera mengaktifkan kembali status peserta PBI yang diputus sepihak karena menyangkut hak asasi manusia dan nyawa rakyat Satu Data Indonesia: DPR mendorong integrasi data jaminan sosial mulai dari level desa agar anggaran triliunan rupiah di APBN tepat sasaran dan sesuai instruksi Presiden Prabowo. WARTAKOTALIVE.COM, JAKARTA -– Anggota Komisi XIII DPR RI, Rieke Diah Pitaloka , melontarkan kritik tajam dalam rapat konsultasi bersama Menteri Keuangan Purbaya Yudhi Sadewa, Menteri Sosial Saifullah Yusuf, dan Menteri Kesehatan Budi Gunadi Sadikin di Kompleks Parlemen, Senayan, Senin (9/2/2026). Rieke mempertanyakan validitas data Penerima Bantuan Iuran (PBI) BPJS Kesehatan yang dinilai tidak sinkron, bahkan berpotensi menunjukkan gambaran kemiskinan yang keliru di Indonesia. Dalam interupsinya, Rieke memaparkan hitungan matematis yang mengejutkan. Baca juga: PBI BPJS Kesehatan Dinonaktifkan, Warga Geruduk Kantor BPJS Depok Berdasarkan data per Februari 2026, terdapat 96,5 juta peserta PBI yang ditanggung APBN dan sekitar 47,3 juta orang yang masih dibebankan pada APBD. ""Artinya keseluruhan peserta PBI saat ini adalah 143.908.293 peserta. Jika dibandingkan dengan jumlah penduduk sekitar 287 juta jiwa, maka jumlah penduduk miskin Indonesia saat ini mencapai 50,31 % ,"" urai Rieke dikutip dari tayangan Kompas TV, Senin. Ia pun langsung melempar pertanyaan retoris kepada Menkeu Purbaya Yudhi Sadewa. ""Apakah ini data yang faktual? Karena kalau 50,31 % , saya mohon masukan, apa kategori negara kita jika 50,31 % rakyatnya tidak mampu? Tentu ini bukan kondisi yang baik-baik saja,"" tegas politisi yang dikenal vokal ini. Rieke Pesan untuk Presiden Prabowo Rieke mengingatkan kembali mandat Presiden Prabowo Subianto saat pelantikan, yang menekankan agar kebijakan tidak lagi hanya berbasis pada data statistik yang tidak sesuai dengan kebutuhan riil rakyat. ""Saya teringat apa yang disampaikan Presiden Prabowo bahwa tidak menginginkan lagi adanya kebijakan yang tidak berbasis pada data faktual atau berbasis hanya pada data statistik yang terindikasi tidak sesuai dengan kondisi riil rakyat Indonesia,"" tuturnya. Ia menekankan bahwa Undang-Undang SJSN dan Undang-Undang BPJS lahir dengan perjuangan bertahun-tahun demi prinsip kegotongroyongan dan nirlaba. ""Undang-undang ini lahir tidak dengan mudah. Kami perjuangkan bertahun-tahun,"" kenang Rieke yang terlibat langsung dalam pengesahannya tahun 2011 silam. Baca juga: Tak Perlu Kartu BPJS, Peserta JKN Cukup Tunjukkan KTP Saat Berobat Sebagai langkah konkret, Rieke memberikan dua rekomendasi utama kepada pemerintah: Reaktivasi Peserta: Ia meminta peserta yang dinonaktifkan segera diaktifkan kembali karena menyangkut nyawa manusia. ""Ada 120.472 orang, biayanya hanya sekitar 15,1 miliar. Ini bukan uang kita, tapi uang rakyat. Saya yakin Pak Purbaya akan mengatakan cukup karena sudah dialokasikan,"" ujarnya. Ekosistem Data Terintegrasi: Benahi ekosistem data mulai dari tingkat desa dan kelurahan. ""Saya yakin anggaran tepat sasaran jika data tepat sasaran. Basis anggaran adalah data dasar negara."" Rieke juga mengapresiasi langkah Wakil Ketua DPR RI, Sufmi Dasco Ahmad, yang menginisiasi RUU Satu Data Indonesia dalam Prolegnas Prioritas 2026. Menurutnya, pembenahan data adalah harga mati karena di balik angka tersebut terdapat nasib jutaan rakyat. WARTAKOTALIVE.COM, JAKARTA -– Anggota Komisi XIII DPR RI, Rieke Diah Pitaloka , melontarkan kritik tajam dalam rapat konsultasi bersama Menteri Keuangan Purbaya Yudhi Sadewa, Menteri Sosial Saifullah Yusuf, dan Menteri Kesehatan Budi Gunadi Sadikin di Kompleks Parlemen, Senayan, Senin (9/2/2026). Rieke mempertanyakan validitas data Penerima Bantuan Iuran (PBI) BPJS Kesehatan yang dinilai tidak sinkron, bahkan berpotensi menunjukkan gambaran kemiskinan yang keliru di Indonesia. Dalam interupsinya, Rieke memaparkan hitungan matematis yang mengejutkan. Baca juga: PBI BPJS Kesehatan Dinonaktifkan, Warga Geruduk Kantor BPJS Depok Berdasarkan data per Februari 2026, terdapat 96,5 juta peserta PBI yang ditanggung APBN dan sekitar 47,3 juta orang yang masih dibebankan pada APBD. ""Artinya keseluruhan peserta PBI saat ini adalah 143.908.293 peserta. Jika dibandingkan dengan jumlah penduduk sekitar 287 juta jiwa, maka jumlah penduduk miskin Indonesia saat ini mencapai 50,31 % ,"" urai Rieke dikutip dari tayangan Kompas TV, Senin. Ia pun langsung melempar pertanyaan retoris kepada Menkeu Purbaya Yudhi Sadewa. ""Apakah ini data yang faktual? Karena kalau 50,31 % , saya mohon masukan, apa kategori negara kita jika 50,31 % rakyatnya tidak mampu? Tentu ini bukan kondisi yang baik-baik saja,"" tegas politisi yang dikenal vokal ini. Rieke Pesan untuk Presiden Prabowo Rieke mengingatkan kembali mandat Presiden Prabowo Subianto saat pelantikan, yang menekankan agar kebijakan tidak lagi hanya berbasis pada data statistik yang tidak sesuai dengan kebutuhan riil rakyat. ""Saya teringat apa yang disampaikan Presiden Prabowo bahwa tidak menginginkan lagi adanya kebijakan yang tidak berbasis pada data faktual atau berbasis hanya pada data statistik yang terindikasi tidak sesuai dengan kondisi riil rakyat Indonesia,"" tuturnya. Ia menekankan bahwa Undang-Undang SJSN dan Undang-Undang BPJS lahir dengan perjuangan bertahun-tahun demi prinsip kegotongroyongan dan nirlaba. ""Undang-undang ini lahir tidak dengan mudah. Kami perjuangkan bertahun-tahun,"" kenang Rieke yang terlibat langsung dalam pengesahannya tahun 2011 silam. Baca juga: Tak Perlu Kartu BPJS, Peserta JKN Cukup Tunjukkan KTP Saat Berobat Sebagai langkah konkret, Rieke memberikan dua rekomendasi utama kepada pemerintah: Rieke juga mengapresiasi langkah Wakil Ketua DPR RI, Sufmi Dasco Ahmad, yang menginisiasi RUU Satu Data Indonesia dalam Prolegnas Prioritas 2026. Menurutnya, pembenahan data adalah harga mati karena di balik angka tersebut terdapat nasib jutaan rakyat.","https://wartakota.tribunnews.com/nasional/881516/data-bpjs-pbi-sebut-50-persen-rakyat-indonesia-miskin-rieke-sentil-menkeu-kategori-negara-kita-apa","Negatif","wartakota.tribunnews.com","Opini"
