"No","title","authors","source","published_date","summary","content","url","Sentiment","Penerbit","Tag"
"22","Video: Akhir Polemik Penonaktifan Jutaan Peserta BPJS Kesehatan","CNBC Indonesia TV","cnbcindonesia.com","2026/02/16 18:00:37","Akhir Polemik Jutaan PBI-JK Non-Aktif","Jakarta, CNBC Indonesia - Penonaktifan massal peserta Penerima Bantuan Iuran Jaminan Kesehatan (PBI JK) BPJS Kesehatan memicu kegaduhan nasional. Kebijakan tersebut menimbulkan persoalan serius, bukan hanya bagi masyarakat, tetapi juga merugikan pemerintah dari sisi anggaran dan citra publik. Simak informasi selengkapnya dalam Big Stories CNBC Indonesia (Senin 16/02/2026) berikut ini.","https://www.cnbcindonesia.com/news/20260213181619-8-711086/video-akhir-polemik-penonaktifan-jutaan-peserta-bpjs-kesehatan","Netral","cnbcindonesia.com","Kebijakan"
"23","Video: Kisruh Penonaktifan Peserta BPJS Kesehatan, Ini Kata Purbaya","CNBC Indonesia TV","cnbcindonesia.com","2026/02/09 14:37:18","Menteri Keuangan Purbaya menjelaskan keributan akibat kebijakan penonaktifan penerima bantuan iuran jaminan kesehatan nasional","Jakarta, CNBC Indonesia- Menteri Keuangan Purbaya Yudhi Sadewa menjelaskan keributan akibat kebijakan penonaktifan penerima bantuan iuran jaminan kesehatan nasional (PBI JKN). Keributan terjadi karena jumlah peserta yang dinonaktifkan pada Februari 2026 melonjak hingga 11 juta orang. Dengan adanya keributan tersebut, Purbaya pun memberikan rekomendasi agar anggaran yang dikeluarkan Kementerian Keuangan untuk penerima bantuan iuran jaminan kesehatan nasional lebih efektif. Selengkapnya dalam program Power Lunch CNBC Indonesia (Senin, 09/02/2026) berikut ini.","https://www.cnbcindonesia.com/news/20260209133905-8-709491/video-kisruh-penonaktifan-peserta-bpjs-kesehatan-ini-kata-purbaya","Negatif","cnbcindonesia.com","Opini"
"24","Apakah Freelancer Bisa Daftar BPJS Ketenagakerjaan? Simak Penjelasannya","Kanya Anindita Mutiarasari","news.detik.com","2025-10-20T15-13-37Z","Seseorang yang berstatus sebagai pekerja lepas (freelancer) bisa mendaftar BPJS Ketenagakerjaan. Berikut tahapan mendaftar BPJS Ketenagakerjaan bagi freelancer.","BPJS Ketenagakerjaan merupakan program jaminan sosial dari pemerintah yang memberikan perlindungan bagi para pekerja. Seseorang yang berstatus sebagai pekerja lepas ( freelancer ) bisa mendaftar BPJS Ketenagakerjaan . Artinya, meski bukan karyawan tetap di perusahaan, freelancer tetap mempunyai kesempatan untuk ikut program perlindungan dari BPJS Ketenagakerjaan. Bagaimana caranya? Berikut tahapannya. SCROLL TO CONTINUE WITH CONTENT Mengutip dari akun Instagram resmi BPJS Ketenagakerjaan (@bpjs.ketenagakerjaan), ini cara mendaftar BPJS Ketenagakerjaan untuk freelancer lewat aplikasi JMO. Selain itu, Anda juga bisa mendaftar dengan cara lain sebagai berikut. Ada tiga program BPJS Ketenagakerjaan yang bisa diikuti pekerja lepas (freelancer), di antaranya: Simak juga Video 'Dirut BPJS Kesehatan Sebut Lansia Kesulitan Akses Mobile JKN': [Gambas:Video 20detik]","https://news.detik.com/berita/d-8169534/apakah-freelancer-bisa-daftar-bpjs-ketenagakerjaan-simak-penjelasannya","Positif","news.detik.com","Kebijakan"
"25","Cara Cek dan Cairkan Saldo JHT BPJS Ketenagakerjaan, Ada 4 Metode","Felicia Gisela Br Sihite","detik.com","2025-08-15T07-30-14Z","Saldo JHT dapat dicairkan apabila Penerima memenuhi Kriteria Pengajuan Klaim. Berikut cara cek dan cairkan saldo JHT BPJS yang ada 4 metode.","Jaminan Hari Tua (JHT) BPJS Ketenagakerjaan merupakan program untuk menjamin stabilitas keuangan di masa pensiun. Saldo JHT dapat dicairkan apabila Penerima memenuhi Kriteria Pengajuan Klaim. Dokumen persyaratan klaim JHT BPJS yang dibutuhkan pun berbeda-beda, tergantung sang Penerima. Dalam artikel berikut, detikSumut hadirkan cara cek dan cairkan saldo JHT BPJS Ketenagakerjaan yang ada 4 metode. SCROLL TO CONTINUE WITH CONTENT Demikian cara cek dan cairkan saldo JHT BPJS Ketenagakerjaan yang ada 4 metode. Semoga membantu, detikers!","https://www.detik.com/sumut/berita/d-8061644/cara-cek-dan-cairkan-saldo-jht-bpjs-ketenagakerjaan-ada-4-metode","Netral","detik.com","Pelayanan"
"26","Cara Mudah Cek Status Kepesertaan BPJS Ketenagakerjaan","Nadhifa Aurellia Wirawan","detik.com","2025-09-09T09-00-34Z","Cek status kepesertaan BPJS Ketenagakerjaan bisa dilakukan dengan mudah. Bisa lewat aplikasi JMO, website resmi, call center, hingga kunjungi kantor terdekat.","Apakah kamu sudah pernah cek status kepesertaan BPJS? Selain ada BPJS Kesehatan, setiap pekerja di Indonesia umumnya sudah terdaftar di BPJS Ketenagakerjaan. Namun tak semua pekerja tahu status kepersetaannya, padahal BPJS Ketenagakerjaan penting untuk memberikan perlindungan sosial mulai dari Jaminan Hari Tua (JHT), Jaminan Pensiun, Jaminan Kecelakaan Kerja (JKK), hingga Jaminan Kematian. Lalu bagaimana cara cek statusnya? BPJS Ketenagakerjaan telah menyediakan sejumlah layanan yang bisa digunakan untuk mengecek status kepesertaan. Prosesnya mudah, bisa dilakukan secara online maupun offline. SCROLL TO CONTINUE WITH CONTENT Oleh karena itu, detikers tidak perlu bingung untuk mengecek status kepesertaan detikers. Berikut beberapa cara yang bisa dicoba: Cara paling praktis adalah menggunakan aplikasi JMO yang tersedia di Google Play Store maupun App Store. Langkahnya: - Unduh aplikasi JMO di ponsel. - Login dengan email dan password. Jika belum memiliki akun, lakukan registrasi menggunakan NIK dan nomor HP. - Masuk ke menu ""Profil Saya"". - Pilih opsi ""Kartu Digital"" untuk melihat status kepesertaan. - Jika status aktif, akan muncul kartu digital BPJS Ketenagakerjaan beserta nomor KPJ (Kartu Peserta Jamsostek). Selain aplikasi, pengecekan juga bisa dilakukan melalui situs berikut: - Kunjungi sso.bpjsketenagakerjaan.go.id. - Login menggunakan akun SSO. Jika belum punya, daftar dengan memasukkan NIK, nomor KPJ (jika ada), nama lengkap, tanggal lahir, dan email aktif. - Setelah masuk, pilih menu ""Kartu Digital"" atau ""Cek Saldo JHT"". - Informasi status kepesertaan akan muncul. Bagi detikers yang lebih nyaman lewat telepon, bisa menghubungi call center di nomor 175. Siapkan NIK KTP atau nomor KPJ untuk proses verifikasi. Petugas akan memberi tahu apakah kepesertaan sudah aktif atau belum. Detikers bisa coba cara lewat SMS bagi yang merasa lebih praktis karena dulunya BPJS Ketenagakerjaan memiliki layanan SMS untuk mengecek saldo dan status kepesertaan. Formatnya adalah: - JHT (spasi) Nomor KPJ (spasi) Tanggal Lahir (dd-mm-yyyy) (spasi) NIK lalu kirim ke 2757. Namun, layanan ini kini sudah terbatas dan tidak selalu tersedia di semua daerah. Jadi, pastikan daerah detikers bisa berlaku. Bagi yang ingin cara konvensional, datanglah langsung ke kantor BPJS Ketenagakerjaan terdekat. Bawa dokumen penting seperti KTP, Kartu Keluarga, dan kartu peserta (jika sudah punya). Petugas akan membantu melakukan pengecekan secara langsung. Mengecek status kepesertaan BPJS Ketenagakerjaan bisa dilakukan dengan banyak cara lewat aplikasi JMO, website resmi, call center 175, layanan SMS (terbatas), maupun dengan datang langsung ke kantor BPJS. Pastikan untuk segera cek BPJS Ketenagakerjaanmu ya, semoga bermanfaat!","https://www.detik.com/kalimantan/berita/d-8102536/cara-mudah-cek-status-kepesertaan-bpjs-ketenagakerjaan","Netral","detik.com","Pelayanan"
"27","Ajakan menjadi peserta BPJS Ketenagakerjaan melalui ""Andai Tau Duluan"" - ANTARA News Jateng","ANTARA News Agency","jateng.antaranews.com","Mon, 01 Sep 2025 15:07:46 +0700","Pesohor Andre Taulany&nbsp;mengajak seluruh pekerja khususnya para pekerja seni dan informal untuk terdaftar sebagai peserta BPJS Ketenagakerjaan lewat pesan kunci pada iklan ANTARA News jateng peristiwa ...","Semarang (ANTARA) - Pesohor Andre Taulany mengajak seluruh pekerja khususnya para pekerja seni dan informal untuk terdaftar sebagai peserta BPJS Ketenagakerjaan lewat pesan kunci pada iklan ""Andai Tau Duluan"". Dengan iuran mulai dari Rp36.800 per bulan, para pekerja informal seperti di bidang seni, musisi, penari, penulis, dan sebagainya bisa mendapat perlindungan 3 Program yaitu Jaminan Kecelakaan Kerja JKK), Jaminan Kematian (JKM) dan Jaminan Hari Tua (JHT). BPJS Ketenagakerjaan melakukan sosialisasi kepada masyarakat melalui iklan televisi dengan slogan “Andai Tau Duluan” untuk memastikan informasi terkait program dan manfaat peserta BPJS Ketenagakerjaan diterima dan dipahami dengan baik, sehingga tidak ada pekerja informal yang menyesal karena tidak tahu bahwa BPJS Ketenagakerjaan dapat melindungi mereka saat bekerja dari risiko pekerjaannya. Lewat iklan “Andai Tau Duluan” yang dapat disaksikan melalui sosial media resmi seperti Youtube, Instagram dan Facebook BPJS Ketenagakerjaan, langkah ini dilakukan untuk dapat meningkatkan literasi dan pemahaman para pekerja di sektor informal. Hingga Agustus 2025 tercatat saat ini peserta informal yang terdaftar di BPJS Ketenagakerjaan baik secara mandiri maupun melalui komunitas sebanyak 8,6 juta yang ada di Indonesia. “Saya mau mengajak seluruh pekerja seni dan informal ikutan bergabung dengan BPJS Ketenagakerjaan untuk mendapatkan manfaat yang luar biasa, caranya gampang tinggal masuk aja ke JMO (Jamsostek Mobile),” ujar Andre dalam kunjungannya ke Kantor Pusat BPJS Ketenagakerjaan. Sebagai penutup, dalam audiensi Andre Taulany bersama Direktur Utama BPJS Ketenagakerjaan, ini menjadi momentum penting untuk mengingatkan seluruh pekerja Indonesia akan pentingnya perlindungan jaminan sosial. Mari bersama-sama memastikan masa depan yang lebih aman dan sejahtera dengan menjadi peserta BPJS Ketenagakerjaan. Karena dengan menjadi peserta BPJS Ketenagakerjaan, bukan hanya diri sendiri yang terlindungi, tetapi juga keluarga dan orang-orang tercinta. Jangan sampai menyesal dan merasa “Andai Tau Duluan” tentang program dan manfaat BPJS Ketenagakerjaan, saat risiko kerja datang melanda. Hal ini juga sejalan juga dengan kampanye yang selalu digaungkan BPJS Ketenagakerjaan yaitu Kerja Keras Bebas Cemas untuk memastikan seluruh pekerja bisa bekerja dengan tenang dan nyaman. Sementara itu, Kepala Kantor BPJS Ketenagakerjaan Cabang Semarang Majapahit, Farah Diana, menyambut positif ajakan tersebut. Ia menilai kampanye ini sangat relevan untuk mendorong kesadaran pekerja seni maupun sektor informal agar segera mendaftar. Dengan adanya keterlibatan Andre Taulany, memberi dampak signifikan bagi upaya edukasi publik. Menurutnya, tokoh publik memiliki kekuatan untuk menyampaikan pesan yang lebih mudah diterima oleh masyarakat. “Kami akan terus memperluas cakupan kepesertaan agar semakin banyak pekerja yang merasakan manfaat jaminan sosial ketenagakerjaan,” ujarnya. Pewarta: Rilis Editor: Teguh Imam Wibowo COPYRIGHT © ANTARA 2026","https://jateng.antaranews.com/berita/597937/ajakan-menjadi-peserta-bpjs-ketenagakerjaan-melalui-andai-tau-duluan","Netral","jateng.antaranews.com","Sosial"
"28","Kabar Baik Buat Ojol! Iuran BPJS Ketenagakerjaan Diskon 50% hingga Maret 2027","Herdi Alif Al Hikam","finance.detik.com","2026-02-04T14-09-26Z","Pemerintah menerapkan diskon iuran Jaminan Kecelakaan Kerja dan Jaminan Kematian (JKK dan JKM) untuk peserta BPJS Ketenagakerjaan kategori bukan penerima upah.","Pemerintah resmi menerapkan diskon iuran Jaminan Kecelakaan Kerja dan Jaminan Kematian (JKK dan JKM) untuk peserta BPJS Ketenagakerjaan kategori bukan penerima upah. Diskon diberikan sebanyak 50% dari tagihan yang mesti dibayar. Kebijakan ini resmi berlaku usai Presiden Prabowo Subianto meneken Peraturan Pemerintah Nomor 50 Tahun 2025 tentang Penyesuaian Iuran Jaminan Kecelakaan Kerja dan Jaminan Kematian bagi Peserta Bukan Penerima Upah. Aturan diteken sejak 22 Desember 2025. ""Besaran penyesuaian Iuran JKK dan JKM bagi Peserta Bukan Penerima Upah ditetapkan sebesar 50% dari Iuran JKK dan JKM yang seharusnya dibayarkan oleh Peserta Bukan Penerima Upah,"" tulis pasal 4 ayat 1 beleid tersebut, Rabu (4/2/2026). SCROLL TO CONTINUE WITH CONTENT Perhitungan Iuran JKK didasarkan pada nilai nominal tertentu dari penghasilan peserta sebagaimana tercantum dalam Lampiran II Peraturan Pemerintah Nomor 44 Tahun 2015 tentang Penyelenggaraan Program Jaminan Kecelakaan Kerja dan Jaminan Kematian sebagaimana telah beberapa kali diubah terakhir dengan Peraturan Pemerintah Nomor 49 Tahun 2023 tentang Perubahan Kedua atas Peraturan Pemerintah Nomor 44 Tahun 2015 tentang Penyelenggaraan Program Jaminan Kecelakaan Kerja dan Jaminan Kematian. Sementara itu, untuk iuran JKM sebesar Rp 6.800 sebagaimana diatur dalam Peraturan Pemerintah Nomor 44 Tahun 2015 tentang Penyelenggaraan Program Jaminan Kecelakaan Kerja dan Jaminan Kematian sebagaimana telah beberapa kali diubah terakhir dengan Peraturan Pemerintah Nomor 49 Tahun 2023 tentang Perubahan Kedua atas Peraturan Pemerintah Nomor 44 Tahun 2015 tentang Penyelenggaraan Program Jaminan Kecelakaan Kerja dan Jaminan Kematian. Dalam hal peserta Bukan Penerima Upah sebagaimana telah melunasi Iuran JKK dan JKM untuk periode yang diberikan penyesuaian dan terdapat kelebihan, maka kelebihan pembayaran Iuran JKK dan JKM tersebut diperhitungkan untuk Iuran JKK dan JKM bulan berikutnya. Namun, bila peserta belum melunasi iuran JKK dan JKM untuk periode sebelum diberikan penyesuaian, maka kekurangan pembayaran Iuran JKK dan JKM untuk periode tersebut, tetap dibayarkan sesuai peraturan perundang-undangan. Pemberlakuan diskon 50% iuran JKK dan JKM bagi peserta bukan penerima upah diberikan mulai iuran bulan Januari 2026 hingga Maret 2027 untuk pekerja informal di sektor transportasi, misalnya saja kurir ataupun pengemudi ojek dan taksi online. Sementara itu, untuk iuran bagi peserta bukan penerima upah di luar sektor transportasi, diskon 50% hanya berlaku untuk iuran bulan April 2026 hingga Desember 2026. Lihat juga Video: Ojol-Kurir Dapat Diskon 50% Iuran JKK-JKM [Gambas:Video 20detik]","https://finance.detik.com/moneter/d-8340262/kabar-baik-buat-ojol-iuran-bpjs-ketenagakerjaan-diskon-50-hingga-maret-2027","Positif","finance.detik.com","Ekonomi"
"29","BPJS Ketenagakerjaan ajak pekerja informal manfaatkan diskon iuran JKK","antaranews.com","antaranews.com","2026-04-02T12:06:40+07:00","BPJS Ketenagakerjaan mendorong pekerja informal atau Bukan Penerima Upah (BPU) memanfaatkan keringanan iuran 50 persen untuk program Jaminan Kecelakaan Kerja ...","Jakarta (ANTARA) - BPJS Ketenagakerjaan mendorong pekerja informal atau Bukan Penerima Upah (BPU) memanfaatkan keringanan iuran 50 persen untuk program Jaminan Kecelakaan Kerja (JKK) dan Jaminan Kematian (JKM) yang berlaku hingga Desember 2026. Direktur Kepesertaan BPJS Ketenagakerjaan Agung Nugroho mengatakan program tersebut merupakan bagian dari dukungan terhadap agenda pemerintah dalam memperkuat pembangunan sumber daya manusia sekaligus menjaga daya beli dan kesejahteraan pekerja sektor informal. “Inilah bukti bahwa negara sangat peduli terhadap perlindungan seluruh pekerja Indonesia, khususnya mereka yang berada di sektor informal. Ayo kita manfaatkan kesempatan ini agar tidak ada satupun pekerja yang tertinggal dan bekerja tanpa perlindungan,” kata Agung dalam keterangan di Jakarta, Kamis. Ia menjelaskan keringanan iuran tersebut berlaku bagi seluruh pekerja BPU yang mendaftar secara mandiri, baik peserta baru maupun peserta yang sudah terdaftar aktif. Dalam program itu, pekerja cukup membayar iuran sebesar Rp8.400 per bulan selama periode April hingga Desember 2026. Sementara untuk memanfaatkan keringanan selama sembilan bulan, pekerja cukup membayar total Rp75.600. Agung memastikan kebijakan diskon iuran tersebut tidak mengurangi kualitas layanan maupun manfaat yang diterima peserta. Manfaat yang tetap diberikan antara lain santunan kecelakaan kerja maksimal Rp70 juta, perawatan akibat kecelakaan kerja tanpa batas biaya sesuai kebutuhan medis, santunan kematian maksimal Rp42 juta, serta beasiswa pendidikan bagi dua orang anak dengan nilai maksimal Rp174 juta. Ia menambahkan pendaftaran dan pembayaran iuran dapat dilakukan melalui berbagai kanal, seperti aplikasi JMO (Jamsostek Mobile), situs resmi BPJS Ketenagakerjaan, serta mitra pembayaran seperti Indomaret, Alfamart, Kantor Pos, agen perbankan, e-commerce, dompet digital, dan kanal lain yang bekerja sama. “Kami terus berkomitmen memberikan perlindungan jaminan sosial ketenagakerjaan bagi seluruh pekerja Indonesia. Perlindungan ini penting agar para pekerja dapat bekerja dengan aman, produktif, dan sejahtera,” ujar Agung. Baca juga: Cara mudah perbarui rekening BSU 2025 agar pencairan lancar Baca juga: Panduan login aplikasi JMO untuk cek status penerima BSU 2025 Pewarta: Ida Nurcahyani Editor: Evi Ratnawati Copyright © ANTARA 2026 Dilarang keras mengambil konten, melakukan crawling atau pengindeksan otomatis untuk AI di situs web ini tanpa izin tertulis dari Kantor Berita ANTARA. Kirim Komentar menjadi tanggung-jawab Anda sesuai UU ITE.","https://www.antaranews.com/berita/5506921/bpjs-ketenagakerjaan-ajak-pekerja-informal-manfaatkan-diskon-iuran-jkk","Positif","antaranews.com","Ekonomi"
"31","Pemprov Jateng dan BPJS Kesehatan Sinergi Tingkatkan Keaktifan Peserta, Ahmad Luthfi Tegaskan Warga Kurang Mampu Jangan Sampai Tidak Tercover - Mettanews.id","Puspita","mettanews.id","2025-09-03T10:31:06+00:00","Pemprov Jateng dan BPJS Kesehatan perkuat kolaborasi meningkatkan kepesertaan dan keaktifan peserta program Universal Health Coverage (UHC)","SEMARANG, MettaNEWS – Pemerintah Provinsi Jawa Tengah (Pemprov Jateng) bersama BPJS Kesehatan memperkuat kolaborasi untuk meningkatkan kepesertaan dan keaktifan peserta program Universal Health Coverage (UHC) di wilayahnya. Hingga 31 Mei 2025, cakupan kepesertaan UHC di Jawa Tengah tercatat mencapai 98,68%, namun tingkat keaktifan peserta masih perlu ditingkatkan. Deputi Direksi Wilayah VI BPJS Kesehatan, Yessi Kumalasari, menyampaikan bahwa per Agustus 2025, keaktifan peserta baru berada di kisaran 74-75%, dengan target akhir tahun naik menjadi 80%. “Sudah ada dukungan dari pemerintah dan badan usaha untuk meningkatkan keaktifan, terutama untuk peserta sektor informal,” ujar Yessi saat audiensi dengan Gubernur Jateng Ahmad Luthfi di Semarang, Rabu (3/9/2025). Pertemuan tersebut membahas tiga aspek utama sistem kesehatan nasional: kepesertaan, penerimaan, dan pelayanan kesehatan. Dalam aspek kepesertaan, sosialisasi akan digencarkan di tingkat provinsi hingga kabupaten/kota agar masyarakat sadar mendaftar dan membayar iuran tepat waktu. Untuk aspek penerimaan, pemerintah daerah sudah menyediakan anggaran cukup, dan yang perlu diperhatikan adalah rutin dalam pembayaran. Sedangkan untuk pelayanan kesehatan, penyediaan fasilitas kesehatan tingkat pertama dan lanjut sudah tersedia, dengan rencana penambahan fasilitas disesuaikan jumlah peserta aktif di masing-masing wilayah. Gubernur Ahmad Luthfi menekankan, BPJS Kesehatan merupakan salah satu instrumen penting untuk memberikan layanan kesehatan paripurna, terutama bagi masyarakat kurang mampu. “Prioritas kita adalah kepada orang yang membutuhkan. Jangan sampai mereka tidak memiliki pelayanan paripurna. Sosialisasi harus terus dilakukan, kita harus jemput bola,” tegasnya. Kepala Dinas Kesehatan Provinsi Jateng, Yunita Dyah Suminar, menambahkan, pemetaan data dari BPJS Kesehatan serta dinas kesehatan kabupaten/kota akan terus dilakukan. Tujuannya, agar seluruh masyarakat di Jawa Tengah memiliki akses mudah ke layanan kesehatan. Yunita menjelaskan, peserta BPJS Kesehatan terbagi menjadi Penerima Bantuan Iuran (PBI) dan non-PBI. Untuk PBI, iuran ditanggung pemerintah sehingga keaktifan peserta terjamin. Sedangkan non-PBI, khususnya peserta perorangan yang mampu, masih perlu dorongan agar rutin membayar iuran dan memanfaatkan layanan yang tersedia. Kolaborasi ini diharapkan tidak hanya meningkatkan keaktifan peserta, tetapi juga memastikan semua warga, terutama yang kurang mampu, tercover layanan kesehatan secara paripurna, sehingga tujuan Universal Health Coverage di Jawa Tengah dapat tercapai secara optimal. Metta Media consists of Metta FM, Metta EO and Metta COMM. We are ready to inspire families all over the world and become perfect media solution for you. Connect With Us","https://mettanews.id/pemprov-jateng-dan-bpjs-kesehatan-sinergi-tingkatkan-keaktifan-peserta-ahmad-luthfi-tegaskan-warga-kurang-mampu-jangan-sampai-tidak-tercover/","Positif","mettanews.id","Kebijakan"
"32","BPJS Ketenagakerjaan Deltamas sosialisasi program manfaat jaminan sosial kepada pemberi kerja - ANTARA News Megapolitan","ANTARA News Agency","megapolitan.antaranews.com","2025-11-28T15:14:02+07:00","Kantor BPJS Ketenagakerjaan Cabang Bekasi Deltamas menyosialisasikan program manfaat jaminan sosial kepada pemberi kerja di lingkungan perusahaan dalam rangka ...","Kabupaten Bekasi (ANTARA) - Kantor BPJS Ketenagakerjaan Cabang Bekasi Deltamas menyosialisasikan program manfaat jaminan sosial kepada pemberi kerja di lingkungan perusahaan dalam rangka optimalisasi penggunaan aplikasi Jamsostek Mobile (JMO) dan manfaat layanan tambahan (MLT). Kepala Kantor BPJS Ketenagakerjaan Cabang Bekasi Deltamas M Ali Saepuloh mengatakan sosialisasi dengan mengunjungi langsung pemberi kerja ini dilakukan mengingat belum semua fitur dan manfaat perlindungan sosial tenaga kerja dipahami tenaga kerja selaku peserta program. ""Kegiatan ini dalam rangka mengoptimalkan penggunaan aplikasi Jamsostek Mobile, khususnya tenaga kerja di PT Futaba Industrial Indonesia dan seluruh tenaga kerja yang ada di wilayah Kabupaten Bekasi,"" katanya di Cikarang, Kabupaten Bekasi, Jawa Barat, Jumat. Baca juga: BPJS Ketenagakerjaan pastikan perlindungan penuh petugas BPS korban kecelakaan Ia menjelaskan pengenalan kembali terhadap fitur-fitur manfaat program BPJS Ketenagakerjaan mencakup cek kepesertaan tenaga kerja, jumlah upah atau gaji yang dilaporkan, monitoring pembayaran iuran perusahaan, cek saldo, kartu digital, pengajuan klaim Jaminan Hari Tua (JHT) maupun program lain. Pihaknya juga menyosialisasikan program MLT, terkait dengan pinjaman pembiayaan perumahan, seperti KPR, Pinjaman Renovasi Perumahan (PRP) dan Pinjaman Uang Muka Perumahan (PUMP) dengan bunga ringan, 7,75 persen yang dapat dimanfaatkan peserta. ""Tenaga kerja dapat memanfaatkan fasilitas tersebut jika telah terdaftar minimal satu tahun kepesertaan serta perusahaan tertib dan patuh dalam hal pelaporan data maupun iuran,"" katanya. Dirinya berharap, seluruh tenaga kerja memanfaatkan aplikasi JMO sehingga data kepesertaan di BPJS Ketenagakerjaan menjadi transparan dan dapat diakses pekerja maupun perusahaan. Baca juga: BPJS Ketenagakerjaan Bekasi Deltamas sosialisasi kepada pekerja SPPG Apabila kepesertaan telah non-aktif, katanya, pekerja dapat mengajukan klaim JHT melalui JMO dengan maksimal saldo Rp15 juta sekaligus bisa mengajukan pinjaman perumahan, yaitu MLT khusus bagi peserta dengan bunga yang rendah. Manajer HRD PT Futaba Industrial Indonesia Anindia Tri Jayanti mengapresiasi kegiatan yang diselenggarakan BPJS Ketenagakerjaan Bekasi Deltamas sekaligus mendorong segenap tenaga kerja untuk memanfaatkan fitur program layanan jaminan sosial yang ada. ""Kami berkomitmen seluruh tenaga kerja perusahaan menggunakan JMO dan juga mengajukan program manfaat layanan tambahan sehingga tenaga kerja terbantu untuk memiliki rumah impian,"" kata dia. Pewarta: Pradita Kurniawan Syah Uploader : Naryo COPYRIGHT © ANTARA 2026","https://megapolitan.antaranews.com/berita/467325/bpjs-ketenagakerjaan-deltamas-sosialisasi-program-manfaat-jaminan-sosial-kepada-pemberi-kerja","Positif","megapolitan.antaranews.com","Sosial"
