"No","title","authors","source","published_date","summary","content","url","Sentiment","Penerbit","Tag"
"51","Beban BPJS Kesehatan Makin Berat, Pengeluaran Lebih Besar dari Iuran","Khadijah Nur Azizah","health.detik.com","2025-11-14T06-49-04Z","Menkes Budi Gunadi Sadikin ungkap defisit BPJS Kesehatan sejak 2014. Defisit diprediksi terus melebar tanpa perubahan kebijakan.","Menteri Kesehatan Budi Gunadi Sadikin mengungkapkan bahwa beban Program Jaminan Kesehatan Nasional (JKN) yang dikelola BPJS Kesehatan selalu lebih besar dari pendapatannya sejak 2014. Hal itu ia sampaikan dalam rapat kerja dengan Komisi IX DPR. ""Emang BPJS (Kesehatan) itu nggak pernah sustainable, dia positif karena dinaikin iuran. Jadi kenaikan iuran itu selalu telat, dan minus, minus, minus, naikin,"" kata Budi, Kamis (13/11/2025). Menurutnya, BPJS sempat mencatat surplus pendapatan pada 2019 dan tahun-tahun pandemi karena pemanfaatan layanan menurun. Namun tren defisit kembali terlihat sejak 2023 hingga 2025. SCROLL TO CONTINUE WITH CONTENT Budi menegaskan bahwa keberlanjutan pembiayaan BPJS Kesehatan perlu dijaga, sambil mengingatkan bahwa iuran BPJS ""sangat-sangat murah dan menguntungkan masyarakat."" Ke depan, pemerintah mendorong agar mekanisme iuran lebih efisien melalui penerapan kelas rawat inap standar. ""Supaya BPJS itu fokusnya ke yang bawah aja. Nggak perlu urus yang kaya-kaya karena kelas 1 itu biayanya diambil swasta. Jadi kita tanda tangan dengan OJK untuk combine benefit,"" jelasnya. Dalam kesempatan yang sama, Ketua Dewan Jaminan Sosial Nasional (DJSN) Nunung Nuryartono menambahkan, jumlah peserta terdaftar JKN kini mencapai 281,88 juta jiwa atau 98,3 persen dari penduduk Indonesia. Namun, peserta aktif hanya 228,67 juta jiwa atau 79,8 persen. Menurut Nunung, rata-rata klaim bulanan pada 2025 telah mencapai Rp 16,75 triliun, naik lima kali lipat dibanding 2014. Kenaikan ini terjadi seiring meningkatnya utilisasi dan akses pelayanan kesehatan masyarakat. Ia memperingatkan bahwa tanpa perubahan kebijakan seperti manfaat, tarif layanan, atau iuran, defisit BPJS Kesehatan akan terus melebar. Dalam Peraturan Pemerintah (PP) Nomor 53 Tahun 2018, pemerintah dapat mengambil tindakan khusus ketika aset jaminan sosial kesehatan bernilai negatif. ""Paling sedikit dilakukan melalui penyesuaian besaran iuran sesuai ketentuan; atau pemberian suntikan dana tambahan,"" ujarnya.","https://health.detik.com/berita-detikhealth/d-8209814/beban-bpjs-kesehatan-makin-berat-pengeluaran-lebih-besar-dari-iuran","Negatif","health.detik.com","Ekonomi"
"52","Cara Cek BPJS Kesehatan Aktif atau Tidak, Simak Panduannya","Kompas Cyber Media","money.kompas.com","2026-02-09T13:48:21+00:00","Cara cek BPJS Kesehatan aktif atau tidak melalui berbagai layanan resmi yang disediakan BPJS Kesehatan","Cara Cek BPJS Kesehatan Aktif atau Tidak, Simak Panduannya JAKARTA, KOMPAS.com - Mengetahui cara cek BPJS Kesehatan aktif atau tidak penting dilakukan peserta agar tetap bisa mengakses layanan kesehatan tanpa kendala. Status kepesertaan yang tidak aktif bisa menghambat pelayanan di fasilitas kesehatan. BPJS Kesehatan menyediakan sejumlah kanal resmi untuk memudahkan peserta mengecek status kepesertaan. Cara cek BPJS Kesehatan aktif atau tidak dapat dilakukan secara daring maupun luring, mulai dari aplikasi hingga datang langsung ke kantor cabang. Peserta dapat memanfaatkan aplikasi Mobile JKN, layanan WhatsApp PANDAWA, call center 165, hingga chatbot CHIKA. Setiap kanal memiliki tahapan yang relatif mudah diikuti. Baca juga: Tunggakan BPJS Kesehatan Kelas 3 Akan Dihapus, Pemerintah Siapkan Perpres Berikut ini penjelasan lengkap cara cek BPJS Kesehatan aktif atau tidak melalui berbagai layanan resmi yang disediakan BPJS Kesehatan. Aplikasi Mobile JKN menjadi kanal utama untuk mengakses informasi kepesertaan. Aplikasi ini tersedia gratis di Google Play Store dan App Store serta dapat digunakan oleh seluruh segmen peserta. Berikut langkah-langkah untuk mengecek status kepesertaan BPJS Kesehatan aktif atau tidak: Baca juga: BPJS PBI Nonaktif Februari 2026, Begini Cara Cek Status BPJS Kesehatan Lewat HP rsudtp.acehbaratdayakab.go.id Ilustrasi Kartu BPJS Kesehatan. Status BPJS Kesehatan PBI bisa berubah tanpa pemberitahuan, tetapi peserta masih punya beberapa cara cepat untuk mengecek dan mengaktifkannya kembali. BPJS Kesehatan juga menyediakan layanan PANDAWA (Pelayanan Administrasi Melalui WhatsApp) yang dapat diakses melalui nomor resmi 08118165165. Berikut caranya: Selain PANDAWA, peserta juga dapat memanfaatkan layanan CHIKA melalui Telegram (@Chika_BPJSKesehatan_bot) atau WhatsApp 0811-8750-400. Berikut langkah-langkahnya: Baca juga: 5 Poin Kesepakatan DPR-Pemerintah soal Kisruh Penonaktifan PBI BPJS Bagi peserta yang mengalami kendala digital, pengecekan status juga dapat dilakukan melalui Care Center BPJS Kesehatan di nomor 165 yang beroperasi 24 jam. Hubungi nomor 165 melalui ponsel, lalu pilih opsi layanan jenis 1. Setelah itu, pilih layanan untuk memeriksa status kepesertaan. Peserta akan diminta memasukkan nomor peserta atau NIK serta tanggal lahir untuk proses verifikasi. Informasi mengenai status kepesertaan aktif atau tidak akan disampaikan melalui layanan suara interaktif atau petugas. Perlu diperhatikan, layanan ini dikenakan biaya sesuai tarif operator. Selain melalui layanan digital, peserta dapat mengecek status kepesertaan dengan mendatangi kantor cabang BPJS Kesehatan terdekat. Peserta cukup membawa KTP atau kartu BPJS Kesehatan dan menyampaikan kebutuhan kepada petugas. Cara ini biasanya dipilih oleh peserta yang sekaligus ingin memperbarui data atau menyelesaikan kendala administrasi yang tidak dapat ditangani secara daring. Copyright 2008 - 2026 PT. Kompas Cyber Media (Kompas Gramedia Digital Group). All Rights Reserved.","https://money.kompas.com/read/2026/02/09/204821326/cara-cek-bpjs-kesehatan-aktif-atau-tidak-simak-panduannya","Netral","money.kompas.com","Pelayanan"
"53","Cara Lengkap Klaim Jaminan Pensiun BPJS Ketenagakerjaan","Rindi Salsabilla","cnbcindonesia.com","2023/12/07 11:40:00","Sebelum mengajukan klaim JP BPJS Ketenagakerjaan, peserta harus melengkapi dokumen-dokumen yang diperlukan sesuai ketentuan.","Jakarta, CNBC Indonesia - BPJS Ketenagakerjaan adalah program jaminan tenaga kerja dan perlindungan sosial bagi seluruh pekerja di Indonesia. Salah satu program yang terdapat di BPJS Ketenagakerjaan adalah program Jaminan Pensiun (JP). Melansir dari laman Indonesia Baik, program JP bertujuan untuk mempertahankan kehidupan yang layak bagi peserta saat memasuki usia pensiun, pensiun cacat total tetap, janda atau duda, anak, orang tua, atau meninggal dunia. Khusus meninggal dunia, jaminan akan diberikan kepada ahli waris. Lantas, bagaimanakah cara klaim Jaminan Pensiun BPJS Ketenagakerjaan? Sebelum mengajukan klaim JP BPJS Ketenagakerjaan, peserta harus melengkapi dokumen-dokumen yang diperlukan sesuai ketentuan. Berikut daftar dokumen yang harus dilengkapi agar dapat mengajukan klaim JP BPJS Ketenagakerjaan berdasarkan keterangan laman resmi BPJS Ketenagakerjaan. Usia Pensiun 1. Formulir 7 (Form JP) BPJS Ketenagakerjaan yang diisi lengkap 2. Kartu Peserta Program JP BP JAMSOSTEK 3. Kartu Tanda Penduduk (KTP) asli dan fotokopi 4. Fotokopi Kartu Keluarga Cacat Total Tetap 1. Formulir 7 (Form JP) BPJS Ketenagakerjaan yang diisi lengkap 2. Kartu Peserta Program JP BP JAMSOSTEK 3. KTP asli dan fotokopi 4. Fotokopi Kartu Keluarga 5. Fotokopi surat keterangan dokter yang memeriksa atau dokter penasehat yang menyatakan mengalami cacat total tetap 6. Fotokopi surat keterangan tidak mampu bekerja karena cacat dari Pemberi Kerja Janda atau Duda Cerai Mati Klaim JP BPJS Ketenagakerjaan untuk kategori ini berlaku bagi janda atau duda yang ditinggalkan oleh suami atau istri yang sudah meninggal dunia. Adapun, dokumen yang diperlukan adalah. 1. Formulir 7 (Form JP) BPJS Ketenagakerjaan yang diisi lengkap 2. Kartu Peserta Program JP BP JAMSOSTEK 3. KTP asli dan fotokopi 4. Fotokopi Kartu Keluarga 5. Fotokopi surat nikah 6. Fotokopi surat keterangan kematian dari kelurahan atau desa atau fasilitas kesehatan yang telah dilegalisir 7. Fotokopi surat keterangan ahli waris dari Kelurahan atau desa yang telah dilegalisir Orang Tua Orang tua dari peserta yang meninggal dunia juga dapat mengajukan klaim JP BPJS Ketenagakerjaan milik anaknya dengan membawa dokumen syarat sebagai berikut. 1. Formulir 7 (Form JP) BPJS Ketenagakerjaan yang diisi lengkap 2. Kartu Peserta Program JP BP JAMSOSTEK 3. KTP asli dan fotokopi orang tua 4. Fotokopi Kartu Keluarga 5. Fotokopi surat keterangan kematian dari kelurahan atau desa atau fasilitas kesehatan yang telah dilegalisir 6. Fotokopi surat keterangan ahli waris dari Kelurahan atau desa yang telah dilegalisir. Meninggal Dunia (Diajukan oleh anak dari peserta) Anak dari peserta yang telah meninggal dunia dapat mengklaim dana JP milik orang tua yang meninggal dengan pesyaratan sebagai berikut. 1. Formulir 7 (Form JP) BPJS Ketenagakerjaan yang diisi lengkap 2. Kartu Peserta Program JP BPJAMSOSTEK 3. Fotokopi akta kelahiran atau kartu tanda penduduk anak 4. Fotokopi Kartu Keluarga 5. Fotokopi surat keterangan kematian dari kelurahan atau desa atau fasilitas kesehatan yang telah dilegalisir 6. Fotokopi surat keterangan ahli waris dari kelurahan atau desa yang telah dilegalisir 7. Surat keterangan wali anak dari pejabat yang berwenang (khusus anak di bawah usia 18 tahun) 8. KTP wali anak (khusus anak di bawah usia 18 tahun) Cara Klaim Jaminan Pensiun BPJS Ketenagakerjaan Setelah menyiapkan dan melengkapi dokumen-dokumen yang diperlukan sesuai ketentuan, peserta dapat mengajukan klaim JP di Kantor BPJS Ketenagakerjaan dengan cara berikut. 1. Mengisi formulir dan melengkapi dokumen pendaftaran kepesertaan 2. Mengambil nomor antrian untuk klaim JP 3. Peserta akan dipanggil petugas melalui mesin antrian 4. Peserta akan dilayani oleh petugas terkait pengajuan klaim JP 5. Petugas akan memberikan tanda terima klaim 6. Peserta melakukan penilaian kepuasan melalui e-survey 7. Peserta menerima saldo JP di rekening peserta","https://www.cnbcindonesia.com/lifestyle/20231207105755-33-495262/cara-lengkap-klaim-jaminan-pensiun-bpjs-ketenagakerjaan","Netral","cnbcindonesia.com","Pelayanan"
"54","Jangan Bingung! Ini Beda BPJS Ketenagakerjaan, BPJS Kesehatan & Tapera","Muhammad Reza Ilham Taufani","cnbcindonesia.com","2024/05/29 10:15:00","Pungutan Tapera akan menambah sederet pungutan yang sudah ada mulai dari BPJS Ketenagakerjaan dan BPJS Kesehatan.","Jakarta, CNBC Indonesia - P ara pekerja di Indonesia, termasuk Aparatur Sipil Negara (ASN), pekerja swasta, dan pekerja mandiri, harus bersiap untuk pemotongan gaji sebesar 3% guna simpanan tabungan perumahan (Tapera) mulai tahun ini. Presiden Joko Widodo telah merilis Peraturan Pemerintah (PP) Nomor 21 Tahun 2024 yang mengubah PP Nomor 25 Tahun 2020 tentang Penyelenggaraan Tapera, pada 20 Mei 2024. Dalam aturan tersebut, pekerja akan dikenakan potongan gaji sebesar 2,5% untuk Tapera, sementara pemberi kerja menanggung 0,5%. Bagi pekerja mandiri, potongan penuh sebesar 3% akan diterapkan langsung dari penghasilan mereka. Pungutan Tapera akan menambah sederet pungutan yang sudah ada mulai dari BPJS Ketenagakerjaan dan BPJS Kesehatan. BPJS (Badan Penyelenggara Jaminan Sosial) Ketenagakerjaan adalah program yang memberikan perlindungan sosial kepada pekerja melalui jaminan kecelakaan kerja, jaminan hari tua, jaminan pensiun, dan jaminan kematian. Program ini bertujuan untuk memastikan pekerja mendapatkan perlindungan yang memadai saat terjadi risiko di tempat kerja dan setelah masa kerja berakhir. BPJS Kesehatan adalah program jaminan kesehatan nasional yang memberikan akses layanan kesehatan yang komprehensif kepada seluruh penduduk Indonesia. Melalui program ini, peserta dapat memperoleh layanan medis, mulai dari pelayanan dasar hingga pelayanan spesialistik di rumah sakit. Tujuan utama BPJS Kesehatan adalah meningkatkan akses dan kualitas layanan kesehatan bagi seluruh lapisan masyarakat. Tapera (Tabungan Perumahan Rakyat) Tapera adalah program tabungan yang dikelola oleh BP Tapera (Badan Pengelola Tabungan Perumahan Rakyat) yang bertujuan membantu masyarakat dalam pembiayaan perumahan. Program ini mengharuskan peserta untuk menabung sebagian kecil dari pendapatannya, yang kemudian dapat digunakan untuk pembelian, pembangunan, atau perbaikan rumah. Tapera berfokus pada meningkatkan kepemilikan rumah di kalangan pekerja dan masyarakat berpenghasilan rendah hingga menengah. Berikut tabel perbandingan antara BPJS Tenaga Kerja, BPJS Kesehatan, dan Tapera: BPJS Tenaga Kerja, BPJS Kesehatan, dan Tapera adalah program penting yang disediakan oleh pemerintah Indonesia untuk meningkatkan kesejahteraan rakyat. Setiap program memiliki fokus dan manfaat yang berbeda sesuai dengan kebutuhan perlindungan sosial dan kesejahteraan masyarakat. Dengan memahami perbedaan ini, masyarakat dapat lebih bijak dalam memanfaatkan setiap program yang ada. CNBC INDONESIA RESEARCH","https://www.cnbcindonesia.com/research/20240528153602-128-541856/jangan-bingung-ini-beda-bpjs-ketenagakerjaan-bpjs-kesehatan-tapera","Netral","cnbcindonesia.com","Kebijakan"
"55","Cara Cek Tagihan dan Bayar Iuran BPJS Kesehatan","https://www.facebook.com/CNNIndonesia","cnnindonesia.com","2025/08/21 08:30:45","Cara cek tagihan dan bayar iuran BPJS Kesehatan harus diketahui oleh tiap pesertanya. Ada beragam cara mudah dan praktis yang bisa dicoba.","Cara cek dan bayar iuran BPJS Kesehatan harus diketahui oleh tiap pesertanya. Ada beragam cara yang mudah dan praktis untuk mengecek dan membayar tagihan BPJS Kesehatan. Badan Penyelenggara Jaminan Sosial (BPJS) Kesehatan adalah lembaga yang dibentuk pemerintah Indonesia untuk memberikan program jaminan kesehatan nasional ( JKN ) kepada masyarakat. SCROLL TO CONTINUE WITH CONTENT Program ini bertujuan memberikan perlindungan kesehatan bagi seluruh penduduk Indonesia, sehingga setiap orang bisa mendapatkan layanan medis yang layak tanpa terbebani biaya besar. Untuk bisa menggunakan layanan BPJS Kesehatan, peserta diwajibkan untuk membayar iuran atau tagihan yang diberikan oleh pemerintah setiap bulannya. Melansir dari laman BPJS Kesehatan , ada beragam cara yang dapat Anda lakukan untuk membayar tagihan BPJS Kesehatan. Tagihan ini bisa dicek dengan mudah melalui aplikasi Mobile JKN, chat WhatsApp, kantor pos atau minimarket, atau e-commerce. Mobile JKN adalah aplikasi resmi BPJS Kesehatan untuk memudahkan peserta JKN-KIS mengakses layanan, termasuk cek tagihan. Pandawa (Pelayanan Administrasi melalui WhatsApp) juga dapat digunakan untuk cek tagihan iuran BPJS. Jika lokasi Anda dekat dengan kantor pos atau minimarket, Anda bisa langsung cek dan bayar tagihan di sana. Simak langkahnya: Platform seperti Shopee atau Tokopedia juga menyediakan layanan cek dan bayar tagihan BPJS Kesehatan. Peserta BPJS Kesehatan harus membayar iuran atau tagihan yang diberikan setiap bulannya. Sebab, jika tidak membayar iuran tersebut, Anda akan diberi sanksi berupa denda. Mengacu pada Perpres No. 64 Tahun 2020, denda pelayanan BPJS Kesehatan ditetapkan sebesar 5% dari biaya diagnosis awal rawat inap, dikalikan dengan jumlah bulan tunggakan. Ketentuannya sebagai berikut: Apabila Anda mendapatkan denda, segera lunasi tagihan tersebut dan kembali membayar iuran setiap bulannya. Demikian cara cek tagihan dan bayar iuran BPJS Kesehatan yang bisa Anda ikuti. Semoga bermanfaat.","https://www.cnnindonesia.com/edukasi/20250814171157-561-1262495/cara-cek-tagihan-dan-bayar-iuran-bpjs-kesehatan","Netral","cnnindonesia.com","Pelayanan"
"56","Cara Daftar BPJS Kesehatan Online untuk Satu Keluarga","https://www.facebook.com/CNNIndonesia","cnnindonesia.com","2025/10/21 09:00:10","Cara daftar BPJS Kesehatan online untuk satu keluarga perlu diketahui oleh peserta. Langkah-langkahnya tak hanya mudah, tapi juga cepat.","BPJS Kesehatan adalah program jaminan kesehatan dari pemerintah yang bertujuan untuk memberikan perlindungan dan pelayanan kesehatan bagi masyarakat. Cara daftar BPJS Kesehatan online untuk satu keluarga perlu diketahui oleh pesertanya, terutama jika ingin menambahkan anggota keluarga yang tercantum di kartu keluarga (KK). SCROLL TO CONTINUE WITH CONTENT Penambahan anggota keluarga, seperti bayi yang baru lahir, atau pasangan setelah menikah, dapat dilakukan secara online sehingga tidak perlu datang ke kantor BPJS Kesehatan. Pendaftaran untuk menambah anggota keluarga dapat dilakukan dengan mudah, cepat, dan praktis melalui aplikasi atau layanan WhatsApp dari BPJS Kesehatan. Dokumen dan ketentuan yang dibutuhkan sebagai syarat pendaftaran anggota keluarga baru adalah KK dan juga nomor induk kependudukan (NIK). Kemudian akta kelahiran (untuk bayi yang baru lahir), buku nikah atau surat keterangan nikah (jika menambahkan pasangan), surat keterangan domisili, dan terdaftar sebagai peserta BPJS Kesehatan aktif. Berikut cara daftar BPJS Kesehatan online untuk satu keluarga melalui aplikasi Mobile JKN. Penambahan anggota keluarga hanya berlaku pada tiga segmen, yakni Peserta Bukan Penerima Upah (PBPU) dan Bukan Pekerja (BP) Perorangan, BP Penyelenggara Negara, serta Pekerja Penerima Upah (PPU), seperti dikutip dari laman resmi BPJS Kesehatan . Pendaftaran Bayi Baru Lahir (BBL) dalam program BPJS Kesehatan hanya berlaku untuk segmen kepesertaan Penerima Bantuan Iuran Jaminan Kesehatan (PBI JK) atau PBI APBN. Proses pendaftarannya sama seperti pendaftaran peserta baru melalui aplikasi Mobile JKN. Sistem akan melakukan validasi otomatis terhadap data NIK yang dimasukkan. Validasi ini akan menentukan apakah NIK tersebut termasuk dalam kategori pendaftaran peserta baru satu keluarga, penambahan anggota keluarga, atau pendaftaran bayi baru lahir. Lalu, khusus untuk penambahan anggota keluarga dari segmen non-Mandiri seperti PBPU/BP Perorangan dan termasuk juga pendaftaran bayi baru lahir pada PBI JK, peserta tidak perlu mengisi bagian kelas rawat dan rekening. Sistem akan mengisi otomatis kelas rawat sesuai dengan kelas peserta utama yang sudah terdaftar sebelumnya. Tampilan formulir akan menyesuaikan dengan data yang sudah tersimpan dalam sistem Mobile JKN. Demikian cara daftar BPJS Kesehatan online untuk satu keluarga yang perlu diketahui oleh tiap pesertanya. Semoga membantu.","https://www.cnnindonesia.com/edukasi/20251009115807-561-1282694/cara-daftar-bpjs-kesehatan-online-untuk-satu-keluarga","Netral","cnnindonesia.com","Pelayanan"
"57","Ini beda JKN, BPJS Kesehatan, dan KIS","antaranews.com","antaranews.com","2025-05-07T14:09:11+07:00","Unit Pengelola Jaminan Kesehatan Jakarta Dinas Kesehatan DKI Jakarta menjelaskan perbedaan antara Jaminan Kesehatan Nasional (JKN), BPJS Kesehatan, dan Kartu ...","Jakarta (ANTARA) - Unit Pengelola Jaminan Kesehatan Jakarta Dinas Kesehatan DKI Jakarta menjelaskan perbedaan antara Jaminan Kesehatan Nasional (JKN), BPJS Kesehatan, dan Kartu Indonesia Sehat (KIS) karena masih adanya kerancuan terkait ketiga istilah tersebut di masyarakat. ""BPJS yaitu Badan Penyelenggara Jaminan Sosial Kesehatan itu adalah badan penyelenggaranya. Kemudian bedanya dengan JKN, JKN adalah programnya, yaitu Jaminan Kesehatan Nasional,"" kata Kepala Unit Pengelola Jaminan Kesehatan Jakarta Dinas Kesehatan DKI Jakarta, Ratna Sari, dalam acara bertemakan ""Sudah Tepatkah Kepesertaan JKN mu?"" yang diselenggarakan Pemprov DKI Jakarta, Rabu. Baca juga: Pekerja penerima upah bayar iuran JKN hanya 1 persen Sementara itu, KIS atau Kartu Indonesia Sehat merupakan tanda kepesertaan bagi para peserta JKN. Kendati begitu, saat ini nomor peserta JKN sudah terintegrasi dengan Nomor Induk Kependudukan (NIK). ""Nomor peserta JKN sudah terintegrasi dengan NIK sehingga cukup menunjukkan KTP saja, maka sudah terhubung, sudah terintegrasi dengan nomor kepesertaan JKN. Jadi kalau yang lebih tepat sebenarnya, sudah jadi peserta JKN atau belum?"" kata Ratna. Baca juga: Lansia atau pensiunan tetap harus bayar iuran JKN Adapun JKN merujuk Peraturan Presiden Nomor 82 Tahun 2018 merupakan perlindungan kesehatan bagi peserta untuk memperoleh manfaat pemeliharaan kesehatan baik itu promotif, preventif, kuratif, maupun rehabilitatif. Pemerintah Provinsi (Pemprov) DKI Jakarta melalui Peraturan Gubernur (Pergub) Nomor 169 Tahun 2016 dilanjutkan Pergub Nomor 46 tahun 2021 menargetkan jumlah penduduk Jakarta yang menjadi peserta JKN sebanyak 95 persen. Hingga Maret 2025, cakupan kepesertaan DKI Jakarta yakni 98,79 persen dari total seluruh penduduk Jakarta yang jumlahnya sekitar 11 juta orang. Baca juga: Pekerja harus lapor bila belum didaftarkan JKN oleh perusahaan ""Walaupun tidak semuanya aktif. Jadi ada yang mungkin menunggak, ada bayi yang baru lahir belum didaftarkan, kemudian ada yang dinonaktifkan atau mengundurkan diri dari peserta JKN tapi belum mendaftarkan kembali. Tingkat keaktifan di Jakarta adalah 92,14 persen,"" ujar Ratna. Pewarta: Lia Wanadriani Santosa Editor: Ganet Dirgantara Copyright © ANTARA 2025 Dilarang keras mengambil konten, melakukan crawling atau pengindeksan otomatis untuk AI di situs web ini tanpa izin tertulis dari Kantor Berita ANTARA. Kirim Komentar menjadi tanggung-jawab Anda sesuai UU ITE.","https://www.antaranews.com/berita/4818773/ini-beda-jkn-bpjs-kesehatan-dan-kis","Netral","antaranews.com","Kebijakan"
