"No","title","authors","source","published_date","summary","content","url","Sentiment","Penerbit","Tag"
"44","Kenapa Data BPJS PBI Kemenkes dan Kemensos Sempat Berbeda?","Kompas Cyber Media","nasional.kompas.com","2026-02-09T08:59:50+00:00","Mensos Gus Ipul menjelaskan perbedaan data BPJS Kesehatan dan Kemensos terkait peserta PBI yang dinonaktifkan.","Kenapa Data BPJS PBI Kemenkes dan Kemensos Sempat Berbeda? JAKARTA, KOMPAS.com - Menteri Sosial (Mensos) Saifullah Yusuf angkat bicara mengenai perbedaan data Kemensos dengan Kementerian Kesehatan (Kemenkes) terkait jumlah peserta BPJS Kesehatan Penerima Bantuan Iuran (PBI) pengidap penyakit berat yang dinonaktifkan. Sebab, berdasarkan data Kemenkes, ada 120.472 ribu peserta BPJS PBI pengidap penyakit katastropik yang dinonaktifkan. Sedangkan data Kemensos menunjukkan 106.000 peserta PBI JK pengidap penyakit katastropik yang dinonaktifkan, bukan 120.472. ""Data kami 106 (ribu) itu adalah setelah kita sesuaikan dengan yang meninggal,"" ujar Saifullah dalam Rapat Konsultasi bersama Pimpinan DPR di Gedung DPR, Senayan, Jakarta, Senin (9/2/2026). Baca juga: Jumlah PBI yang Direaktivasi Lebih Sedikit, Anggaran Ikut Berkurang? Saifullah menyampaikan, pihaknya telah melakukan validasi ulang terhadap peserta PBI yang mengidap sakit katastropik atau sakit berat itu. Sebab, kata dia, ada peserta yang sudah meninggal, sehingga datanya berkurang. ""Jadi 120 itu, kemudian kita cek ulang dan tinggal 106 setelah kita lakukan penelusuran yang meninggal. Jadi 106, yang dari catatan kami,"" katanya. Baca juga: Mensos Sebut Reaktivasi Otomatis 106.000 Pasien Sakit Berat di BPJS PBI Sementara itu, Gus Ipul menyebut, data dalam jaminan sosial merupakan hal yang krusial. Dia menegaskan bahwa data kerap berubah seiring berjalannya waktu, bahkan setiap hari selalu berubah. ""Kenapa? Karena setiap hari ada yang meninggal, setiap hari ada yang lahir, setiap hari ada yang menikah, setiap hari ada yang pindah tempat, setiap hari ada yang naik kelas, setiap hari ada yang turun kelas. Ini sangat krusial,"" jelas Saifullah. ""Jadi mungkin data hari ini dengan data besok sudah sangat berubah. Ini yang perlu kita sadari bersama,"" imbuhnya. Ada 11 juta peserta PBI program Jaminan Kesehatan Nasional atau JKN yang dinonaktifkan kepesertaannya. Para pasien yang semula terdaftar sebagai peserta PBI menjadi tidak bisa mengakses layanan kesehatan PBI karena mereka baru tahu bahwa keanggotaannya sudah tidak aktif lagi. Penonaktifan keanggotaan PBI ini mengacu pada Keputusan Menteri Sosial Nomor 3/HUK/2026, diteken Mensos Saifullah Yusuf pada 19 Januari 2026, diundangkan pada 22 Januari 2026, dan mulai berlaku pada 1 Februari 2026. Baca juga: Komisi IX Dorong Pemerintah Sosialisasikan soal Penonaktifan PBI BPJS Kesehatan Penonaktifan BPJS PBI karena ada perubahan dalam Data Tunggal Sosial dan Ekonomi Nasional (DTSEN) sebagai data acuan PBI. Peserta PBI adalah fakir miskin dan masyarakat tidak mampu, atau desil 1 hingga 5 dalam DTSEN. Desil 6 sampai 10 alias kelas menengah ke atas tidak menjadi peserta PBI JKN. Dari 11 juta PBI yang dinonaktifkan, Mensos memastikan akan mereaktivasi 106.000 PBI di antaranya, yakni yang mengidap penyakit katastropik alias sakit berat. Rapat di DPR Senin (9/2/2026) hari ini memastikan bahwa biaya pengobatan PBI akan dibayari negara sampai tiga bulan ke depan. Copyright 2008 - 2026 PT. Kompas Cyber Media (Kompas Gramedia Digital Group). All Rights Reserved.","https://nasional.kompas.com/read/2026/02/09/15595081/kenapa-data-bpjs-pbi-kemenkes-dan-kemensos-sempat-berbeda","Netral","nasional.kompas.com","Kebijakan"
"45","Polemik PBI BPJS Kesehatan, Komisi IX Sorot Tidak Jelasnya Arti Desil 1-10","Kompas Cyber Media","nasional.kompas.com","2026-02-11T10:24:15+00:00","Pembagian desil ini berkaitan dengan bantuan dari pemerintah yang diberikan kepada masyarakat yang membutuhkan, seperti PBI BPJS Kesehatan.","Polemik PBI BPJS Kesehatan, Komisi IX Sorot Tidak Jelasnya Arti Desil 1-10 JAKARTA, KOMPAS.com - Wakil Ketua Komisi IX DPR Charles Honoris melihat banyaknya masyarakat yang tidak mengerti arti dan kriteria dari desil 1 sampai 10. Pasalnya, pembagian desil ini berkaitan dengan bantuan dari pemerintah yang diberikan kepada masyarakat yang membutuhkan. Adapun terkait Penerima Bantuan Iuran (PBI) BPJS Kesehatan , pemerintah memberikan program tersebut kepada masyarakat yang berada di golongan desil 1 sampai 5 . ""Karena mewakili pemerintah, mungkin bisa sekaligus dijelaskan supaya masyarakat lebih paham. Desil 1 sampai 10 definisinya apa sih Pak,"" ujar Charles dalam rapat kerja Komisi IX DPR bersama Menteri Kesehatan ( Menkes ), Ketua DJSN, Ketua BPJS Kesehatan, dan Ketua Dewas BPJS Kesehatan, Rabu (11/2/2026). Baca juga: Menkes: 1.824 Orang dari Desil Terkaya Terdaftar PBI BPJS Kesehatan Salah satu ketidakjelasan mengenai kriteria desil ini adalah soal penghasilan atau pendapatan masyarakat Indonesia. Bahkan ia menerima informasi, masyarakat dengan penghasilan Rp 2 juta per bulan sudah dikategorikan sebagai desil 6. Artinya, masyarakat dengan penghasilan Rp 2 juta per bulan sudah tidak bisa menjadi peserta PBI BPJS Kesehatan . ""Ya mungkin ada yang mengatakan bahwa sekitar 2 jutaan sudah dianggap Desil 6 per bulan. Apakah dengan penghasilan 2 juta sampai 3 juta bisa dianggap bisa hidup layak di Indonesia dan tidak lagi mendapatkan bantuan dari pemerintah,"" tegas Charles. Baca juga: Penonaktifan BPJS PBI Picu Kendala Layanan Kesehatan, Warga Diminta Segera Lapor ke Dinsos Menurutnya, saat ini belum ada sumber literatur yang resmi mengenai pengertian dan kriteria desil 1 sampai 10. Padahal, kalsifikasi dalam desil tersebut merupakan pegangan pemerintah dalam pemberian bantuan kepada masyarakat. ""Ini kan ditonton nih sama publik, sama rakyat Indonesia. Supaya masyarakat jelas, tahu, 'kalau misalnya saya penghasilannya di atas Rp 3 juta, kemungkinan saya dinonaktifkan',"" tegas Charles. Hal senada juga disampaikan oleh Ketua Komisi IX DPR Felly Estelita Runtuwene yang mempertanyakan pengertian soal desil 1 sampai 10. Ia mencotohkan seorang kepala keluarga dengan penghasilan Rp 4,5 juta per bulan dan dikategorikan masuk desil 6 ke atas. Baca juga: BPJS PBI Nonaktif di Bekasi Bisa Diaktifkan Lagi, Ini Syarat dan Caranya Maka orang tersebut dan keluarganya tidak bisa menjadi peserta PBI BPJS Kesehatan, karena pengkategorian desil tersebut. ""Itu dengan gaji misalkan lets say Rp 3 juta per bulan atau Rp 4,5 juta deh, ini kan bukan sendiri Pak, ada keluarga, Ada istri, ada anak-anak, nah anak-anak ini ada yang sdua, ada yang satu, mungkin ada yang lima,"" ujar Felly. Copyright 2008 - 2026 PT. Kompas Cyber Media (Kompas Gramedia Digital Group). All Rights Reserved.","https://nasional.kompas.com/read/2026/02/11/17241541/polemik-pbi-bpjs-kesehatan-komisi-ix-sorot-tidak-jelasnya-arti-desil-1-10","Negatif","nasional.kompas.com","Kebijakan"
"46","202.889 Peserta BPJS PBI Bandung Barat Dicoret Kemensos, Judol Jadi Salah Satu Alasan","Kompas Cyber Media","bandung.kompas.com","2026-02-09T04:51:35+00:00","Jumlah kepesertaan Penerima Bantuan Iuran Jaminan Kesehatan (PBI JK) yang dicoret Kemensos sebanyak 202.889. Ini penyebabnya.","202.889 Peserta BPJS PBI Bandung Barat Dicoret Kemensos, Judol Jadi Salah Satu Alasan BANDUNG BARAT, KOMPAS.com - Dinas Sosial Kabupaten Bandung Barat mengungkap jumlah peserta Penerima Bantuan Iuran Jaminan Kesehatan (PBI JK) dari APBN yang dicoret Kemensos mencapai 202.889 jiwa. Penghapusan itu terhitung sejak Mei 2025 hingga Februari 2026 setelah pembaruan Data Tunggal Sosial dan Ekonomi Nasional (DTSEN) dan kebijakan baru terkait pengetatan batas desil penerima. Kepala Dinas Sosial KBB, Idad Saadudin mengatakan, penghapusan dilakukan bertahap berdasarkan hasil pemadanan data dan aturan baru pembatasan desil penerima bantuan. “Peserta PBI JK KBB yang dihapus karena tidak terdapat di DTSEN atau terdapat di DTSEN tapi masuk desil 6-10 di bulan Mei-Desember 2025 sebanyak 101.041 jiwa,” kata Idad saat dikonfirmasi, Senin (9/2/2026). Baca juga: Banyak Peserta BPJS Kesehatan PBI di Solo Minta Reaktivasi, Dinsos: Terutama yang Kontrol Rutin Selain itu, penghapusan kembali dilakukan pada Februari 2026 setelah pemerintah menetapkan peserta PBI JK hanya berasal dari kelompok desil 1 sampai desil 4. “Peserta PBI JK yang dihapus karena pembatasan desil 1 sampai desil 4 di Februari 2026 sebanyak 101.848 jiwa,” ujarnya. Dengan demikian, total peserta yang dinonaktifkan dari kepesertaan PBI JK APBN di Bandung Barat dalam rentang Mei 2025 hingga Februari 2026 mencapai 202.889 jiwa. Sebelumnya, Dinsos KBB juga mencatat penonaktifan besar terjadi per 1 Februari 2026. ""Sejak tanggal 1 Februari 2026 telah dinonaktifkan kepesertaan PBI APBN di KBB berkisar 101.000 jiwa,” sebut Idad. Program PBI APBN merupakan skema jaminan kesehatan bagi warga tidak mampu dengan iuran dibayarkan pemerintah pusat. Namun perubahan sistem pendataan membuat peserta wajib tercatat di DTSEN dan berada pada kategori desil kemiskinan terbawah. “Ini terjadi karena adanya perubahan peraturan baru, di mana peserta PBI APBN harus masuk Desil 1-4. Bila Desilnya 5 ke atas, otomatis akan dinonaktifkan PBI APBN-nya,” jelas Idad. Baca juga: Ribuan BPJS PBI Nonaktif, Dedi Mulyadi: Yang Tak Mampu, Dibayarkan Pemerintah Provinsi Selain faktor pemeringkatan desil dan ketidaksesuaian data, Dinsos juga menemukan pelanggaran ketentuan penerima bantuan. Sejumlah peserta dicoret karena terindikasi terlibat aktivitas ekonomi yang dinilai tidak sesuai kriteria penerima bantuan sosial. “Penghapusan juga dilakukan karena adanya pelanggaran ketentuan penerima bantuan. Banyak yang terlibat dengan judi online , pinjaman online , dan pelanggaran lainnya. Sehingga mereka dihapus dari daftar penerima manfaat,” jelas Idad. Meski dinonaktifkan, warga masih memiliki peluang untuk diusulkan kembali sebagai peserta PBI JK apabila hasil verifikasi lapangan menunjukkan kondisi ekonomi masuk kategori miskin dan membutuhkan layanan kesehatan mendesak. “Bila ada kasus penting seperti ke RS atau lansia atau ibu hamil atau punya riwayat penyakit bisa didaftarkan ulang PBI-nya oleh Dinsos melalui aplikasi Sik-ng yang dikelola Kemensos,” tandasnya. Copyright 2008 - 2026 PT. Kompas Cyber Media (Kompas Gramedia Digital Group). All Rights Reserved.","https://bandung.kompas.com/read/2026/02/09/115135778/202889-peserta-bpjs-pbi-bandung-barat-dicoret-kemensos-judol-jadi-salah-satu","Negatif","bandung.kompas.com","Opini"
"47","96.000 Peserta BPJS PBI di Kaltim Nonaktif, Ini Penjelasan Lengkap BPJS Kesehatan soal Reaktivasi","Kompas Cyber Media","regional.kompas.com","2026-02-13T04:44:58+00:00","BPJS Kesehatan nonaktifkan 96.757 peserta PBI JK di Kaltim. Cek status kepesertaan Anda untuk memastikan hak layanan kesehatan!","96.000 Peserta BPJS PBI di Kaltim Nonaktif, Ini Penjelasan Lengkap BPJS Kesehatan soal Reaktivasi SAMARINDA, KOMPAS.com - BPJS Kesehatan mencatat sebanyak 96.757 peserta Penerima Bantuan Iuran Jaminan Kesehatan (PBI JK) di Provinsi Kalimantan Timur dinonaktifkan per Februari 2026. Penonaktifan ini merujuk pada Surat Keputusan Kementerian Sosial yang memperbarui data kepesertaan berdasarkan verifikasi terbaru pemerintah pusat. Deputi Direksi Wilayah VIII BPJS Kesehatan , Herman Dinata Mihardja, menjelaskan bahwa pembaruan data PBI merupakan proses rutin yang dilakukan setiap bulan, namun jumlah penonaktifan pada Februari tergolong besar dibanding periode sebelumnya. “Total penonaktifan di Kalimantan Timur mencapai 96.757 jiwa berdasarkan SK terbaru Kementerian Sosial,” ujar Herman saat ditemui di Kantor Cabang Utama BPJS Kesehatan Samarinda, Jumat (12/2/2026). Baca juga: Pasien Cuci Darah di RSUD AWS Tetap Terlayani, Ada Gratispol jika BPJS PBI Nonaktif Secara wilayah kerja, BPJS Kesehatan di Kalimantan Timur terbagi menjadi dua kantor cabang, yakni Cabang Samarinda dan Cabang Balikpapan. Cabang Samarinda membawahi enam daerah: Kota Samarinda, Kota Bontang, Kabupaten Kutai Kartanegara, Kutai Timur, Kutai Barat, dan Mahakam Ulu. Dari wilayah ini, jumlah peserta PBI JK yang dinonaktifkan mencapai 64.684 jiwa. Sementara itu, Cabang Balikpapan yang menangani Balikpapan, Penajam Paser Utara, Paser, dan Berau mencatat 32.073 jiwa peserta PBI JK dinonaktifkan. Herman menegaskan, penonaktifan bukan berarti masyarakat kehilangan hak layanan kesehatan sepenuhnya, melainkan bagian dari pemutakhiran data agar bantuan tepat sasaran. BPJS Kesehatan mengimbau seluruh peserta, baik PBI maupun non-PBI, untuk rutin memeriksa status kepesertaan setiap awal bulan. Cara paling mudah adalah melalui aplikasi Mobile JKN, WhatsApp layanan BPJS, puskesmas, atau kantor BPJS terdekat. “Jangan sampai baru mengetahui status nonaktif ketika sudah berada di rumah sakit. Lebih baik dicek sejak awal agar bisa segera direaktivasi,” kata Herman. Bagi peserta PBI yang dinonaktifkan, terdapat dua opsi: 1. Mengajukan reaktivasi sebagai PBI melalui Dinas Sosial, yang memerlukan proses verifikasi ulang. 2. Berpindah menjadi peserta mandiri agar kepesertaan dapat langsung aktif setelah pembayaran iuran. BPJS Kesehatan menegaskan bahwa rumah sakit tetap wajib memberikan pelayanan kepada pasien dalam kondisi darurat, terlepas dari status kepesertaan. Dalam situasi rawat inap mendesak, peserta diberi waktu 3 x 24 jam hari kerja untuk mengurus aktivasi kembali. Selama masa tersebut, proses perawatan tetap berjalan sambil koordinasi dilakukan antara rumah sakit, BPJS Kesehatan, Dinas Kesehatan, dan Dinas Sosial. “Keselamatan pasien adalah prioritas. Administrasi bisa diselesaikan kemudian,” tegas Herman. Untuk peserta yang tidak lagi memenuhi kriteria PBI pusat, pemerintah daerah dapat mengambil alih pembiayaan melalui skema jaminan kesehatan daerah. Di Kota Samarinda, misalnya, proses dimulai dari laporan keluarga ke kelurahan dan Dinas Sosial. Data kemudian diverifikasi sebelum diajukan ke pusat data Kementerian Sosial. Jika disetujui, BPJS Kesehatan akan mengaktifkan kembali kepesertaan. Namun jika peserta berada di luar kriteria desil penerima bantuan, alternatif pembiayaan dapat berasal dari program jaminan kesehatan pemerintah daerah. Secara nasional, penonaktifan peserta PBI mencapai hampir 11 juta jiwa. Kebijakan ini dilakukan karena pemerintah kini menggunakan basis data kesejahteraan terbaru yang membagi masyarakat dalam 10 desil ekonomi. Baca juga: Jember Targetkan Entaskan Kemiskinan dalam 5 Tahun lewat Aktivasi PBI dan Gentengisasi Kelompok dengan tingkat ekonomi lebih tinggi tidak lagi masuk kategori penerima bantuan iuran 6-10 Desil, sehingga dialihkan agar anggaran negara dapat menyasar masyarakat yang benar-benar membutuhkan yaitu Desil 1-5. Meski demikian, pemerintah tetap memprioritaskan pasien dengan penyakit kronis atau yang menjalani pengobatan rutin untuk direaktivasi lebih cepat. Secara nasional, sekitar 120.000 peserta telah diaktifkan kembali melalui mekanisme prioritas tersebut. Baca juga: 39.137 Peserta PBI di Sumbawa Dinonaktifkan, Faskes Diminta Tetap Layani Warga Sakit BPJS Kesehatan menyebut sebagian besar kabupaten/kota di Kalimantan Timur telah mencapai status Universal Health Coverage (UHC) dengan tingkat kepesertaan di atas 98 persen. Tantangan utama kini bukan lagi pendaftaran, melainkan keaktifan kepesertaan agar layanan kesehatan tetap dapat digunakan saat dibutuhkan. “Kami berharap masyarakat aktif mengecek status kepesertaannya. Sedia payung sebelum hujan,” ujar Herman. Herman juga menegaskan untuk masyarakat di wilayah pedalaman yang tidak dapat mengakses ke aplikasi atau dinas sosial, dapat mengakses ke puskesmas terdekat untuk mereaktivasi kembali BPJS PBI yang dinonaktifkan. Copyright 2008 - 2026 PT. Kompas Cyber Media (Kompas Gramedia Digital Group). All Rights Reserved.","https://regional.kompas.com/read/2026/02/13/114458578/96000-peserta-bpjs-pbi-di-kaltim-nonaktif-ini-penjelasan-lengkap-bpjs?page=all","Netral","regional.kompas.com","Kebijakan"
"48","Foto Rumah dan Token Listrik Jadi Syarat Verifikasi BPJS PBI-JKN 2026","Kompas Cyber Media","health.kompas.com","2026-02-19T12:00:00+00:00","Pemerintah mulai verifikasi peserta BPJS Kesehatan PBI-JKN hingga April 2026 dan meminta warga menyiapkan foto rumah serta bukti token listrik.","Foto Rumah dan Token Listrik Jadi Syarat Verifikasi BPJS PBI-JKN 2026 KOMPAS.com - Pemerintah mulai melakukan verifikasi lapangan peserta BPJS Kesehatan segmen Penerima Bantuan Iuran Jaminan Kesehatan Nasional (PBI-JKN) mulai Februari hingga April 2026. Selain itu, peserta diminta kooperatif serta menyiapkan dokumen pendukung seperti foto rumah dan bukti token listrik. Kebijakan ini disampaikan dalam konferensi pers usai pertemuan terbatas di Kantor BPS Pusat Jakarta, Kamis (19/2/2026). Baca juga: Status BPJS Kesehatan PBI Bisa Dinonaktifkan, Ini Bedanya dengan Non PBI Menteri Koordinator Bidang Pemberdayaan Masyarakat (Menko PM) Muhaimin Iskandar menegaskan bahwa akurasi data menjadi kunci agar bantuan iuran benar-benar tepat sasaran. “Silakan berikan data yang akurat dan sesuai dengan kondisi sebenarnya agar penyaluran bantuan pemerintah, khususnya PBI-JKN , dapat tepat sasaran,” kata Muhaimin, seperti dikutip dari Antara, Kamis. Verifikasi lapangan atau ground check melibatkan sekitar 60 ribu petugas dari Badan Pusat Statistik (BPS), Kementerian Sosial, serta Dinas Sosial kabupaten/kota. Muhaimin juga meminta para petugas bekerja secara disiplin dan bertanggung jawab sesuai prosedur yang telah ditetapkan. Saat ini jumlah penerima PBI-JKN mencapai sekitar 152 juta jiwa atau sekitar 52 persen dari total penduduk Indonesia. Sekitar 100 juta peserta dibiayai pemerintah pusat dan sekitar 50 juta lainnya oleh pemerintah daerah. Namun, pemerintah menemukan masih banyak kelompok miskin dan rentan miskin yang belum terlindungi. Berdasarkan Data Tunggal Sosial Ekonomi Nasional (DTSEN) 2025, lebih dari 54 juta jiwa pada kelompok Desil 1 sampai 5 belum menerima PBI-JKN. Sebaliknya, lebih dari 15 juta jiwa pada kelompok Desil 6 sampai 10 serta non-desil masih tercatat sebagai penerima. Selain itu, terdapat lebih dari 11 juta peserta PBI-JKN yang saat ini dinonaktifkan dan perlu diverifikasi kembali kelayakannya. Baca juga: BPJS PBI Nonaktif Februari 2026, Begini Cara Cek Status BPJS Kesehatan Lewat HP KOMPAS.com/DINDA AULIA RAMADHANTY Tampilan notifikasi dari aplikasi Mobile JKN saat penerima BPJS PBI tiba-tiba dinonaktifkan dan gagal mendaftar jadwal kontrol. Pemerintah mulai verifikasi peserta BPJS Kesehatan PBI-JKN hingga April 2026 dan meminta warga menyiapkan foto rumah serta bukti token listrik sebagai syarat pendataan ulang. Menteri Sosial Saifullah Yusuf menjelaskan bahwa foto kondisi rumah dan bukti penggunaan listrik seperti token menjadi bagian dari dokumen pendukung verifikasi. Dokumen tersebut menjadi rujukan utama dalam proses ground check untuk menilai tingkat kesejahteraan terbaru peserta. Foto aset termasuk kondisi tempat tinggal serta bukti token listrik harus diunggah melalui aplikasi yang disediakan Kementerian Sosial. Syarat ini berlaku bagi masyarakat yang mengajukan usulan, sanggahan, maupun reaktivasi kepesertaan PBI-JKN . Saifullah menegaskan partisipasi publik dibuka seluas-luasnya melalui aplikasi Cek Bansos Kemensos yang telah dilengkapi fitur DTSEN. Masyarakat juga dapat menyampaikan pengaduan melalui Command Center 021-171 atau layanan WhatsApp 0888-771-171-171. Baca juga: Status BPJS Kesehatan Nonaktif, Ini Langkah yang Bisa Dilakukan Peserta Proses verifikasi yang berlangsung Februari hingga April 2026 melibatkan sekitar 60 ribu pendamping Program Keluarga Harapan (PKH) serta petugas dan mitra statistik dari BPS. Langkah ini bertujuan memastikan bantuan iuran BPJS Kesehatan benar-benar diterima warga yang membutuhkan layanan kesehatan. Pemerintah berharap masyarakat memberikan informasi secara jujur dan melampirkan bukti yang akurat agar kepesertaan PBI-JKN tetap tepat sasaran. Penyesuaian data ini juga diharapkan mampu melindungi warga miskin dan rentan miskin yang selama ini belum terdaftar, sekaligus mencegah penerima yang tidak memenuhi kriteria tetap tercatat sebagai peserta bantuan. Baca juga: Ramai BPJS Kesehatan PBI Dinonaktifkan, Ini Cara Cek Status Kepesertaan JKN Copyright 2008 - 2026 PT. Kompas Cyber Media (Kompas Gramedia Digital Group). All Rights Reserved.","https://health.kompas.com/read/26B19190000468/foto-rumah-dan-token-listrik-jadi-syarat-verifikasi-bpjs-pbi-jkn-2026","Netral","health.kompas.com","Opini"
"49","Menkes Sentil Orang Kaya Peserta BPJS PBI: Masa Tidak Bisa Bayar Rp 42.000?","Kompas Cyber Media","nasional.kompas.com","2026-02-11T04:29:16+00:00","Menkes Budi Gunadi Sadikin menyoroti ribuan orang kaya masuk daftar peserta BPJS Kesehatan PBI. Ia heran mengapa mereka tidak mampu bayar iuran.","Menkes Sentil Orang Kaya Peserta BPJS PBI: Masa Tidak Bisa Bayar Rp 42.000? JAKARTA, KOMPAS.com - Menteri Kesehatan (Menkes) Budi Gunadi Sadikin menyentil orang-orang kaya yang tergolong dalam Desil 10 tetapi terdaftar sebagai BPJS Kesehatan Penerima Bantuan Iuran (PBI). Budi mengatakan, pemerintah akan meninjau ulang kepesertaan orang-orang kaya tersebut agar peserta BPJS PBI benar-benar diperuntukkan bagi orang-orang yang tidak mampu. ""Dalam 3 bulan ini akan di- review dan disosialisasikan oleh BPJS dan pemda bahwa, 'hei, Anda kan sebenarnya Desil 10 , sangat mampu. Ayo bayarlah BPJS kan Rp 42.000. Masa tidak bisa bayar Rp 42.000, orang Desil 10?',"" ujar Budi dalam rapat kerja bersama Komisi IX DPR di Gedung DPR, Senayan, Jakarta, Rabu (11/2/2026). Baca juga: Pemerintah Diminta Menjamin PBI BPJS yang Nonaktif Dapatkan Layanan Kesehatan ""Supaya apa? Supaya porsinya dia bisa diisi oleh teman-teman yang benar-benar tidak mampu,"" imbuh dia. Budi menyebutkan, ada 1.824 orang yang masuk desil 10 atau desil terkaya tetapi terdaftar sebagai penerima BPJS PBI. Akibatnya, banyak warga yang lebih berhak malah tidak terdaftar sebagai peserta BPJS PBI karena tidak masuk kuota yang tersedia sekitar 96,8 juta. Oleh sebab itu, pemerintah akan melakuka rekonsiliasi untuk mencoret orang-orang yang sesungguhnya tidak layak menjadi peserta BPJS PBI. Baca juga: Nasib 270.000 Peserta PBI BPJS Kesehatan di Jakarta yang Nonaktif, Masih Bisa Gratis? ""BPJS, BPS, Kementerian Sosial, dan pemerintah daerah harus melakukan rekonsiliasi data dari 11 juta data PBI yang berpindah. Karena total yang berpindah itu ada 11 juta, dari PBI menjadi tidak PBI,"" kata Budi. Budi menegaskan, orang-orang yang ada di kalangan desil tinggi tidak boleh masuk sebagai peserta BPJS PBI lagi karena banyak orang miskin dari desil 1-5 yang belum masuk PBI. ""Nah, itu kita akan rapikan, tapi itu 3 bulan ke depan saja, supaya tidak mengganggu khususnya pasien-pasien yang kritis tadi, yang katastropik tadi. Jadi kalau toh pun ada pasien katastropik, dia masih di Desil 10, Desil 9, 3 bulan ke depan dia tetap akan jalan,"" ujar dia. Copyright 2008 - 2026 PT. Kompas Cyber Media (Kompas Gramedia Digital Group). All Rights Reserved.","https://nasional.kompas.com/read/2026/02/11/11291661/menkes-sentil-orang-kaya-peserta-bpjs-pbi-masa-tidak-bisa-bayar-rp-42000","Negatif","nasional.kompas.com","Kebijakan"
