"No","title","authors","source","published_date","summary","content","url","Sentiment","Penerbit","Tag"
"78","DPR Gelar Rapat Bahas Mitigasi Penonaktifan Peserta BPJS PBI","Metro TV","metrotvnews.com","2026-02-09T09:55:05+07:00","Rapat dipimpin Wakil Ketua DPR Sufmi Dasco Ahmad.","Wakil Ketua DPR Sufmi Dasco Ahmad. Foto: TVR Parlemen. Fachri Audhia Hafiez • 9 February 2026 09:55 Jakarta: DPR menggelar rapat konsultasi lintas komisi bersama sejumlah menteri dan lembaga negara untuk merespons dinamika penonaktifan jaminan sosial terkait kepesertaan BPJS Kesehatan segmen Penerima Bantuan Iuran (PBI). Rapat dipimpin Wakil Ketua DPR Sufmi Dasco Ahmad. ""Sehubungan dengan agenda pertemuan ini adalah dalam rangka membahas perbaikan ekosistem tata kelola jaminan sosial kesehatan terintegrasi, untuk itu saya minta izin kepada saudara-saudara, apakah pertemuan ini dapat dinyatakan bersifat terbuka?"" ujar Dasco saat membuka rapat di Kompleks Parlemen, Jakarta, dikutip dari tayangan Breaking News Metro TV, Senin, 9 Februari 2026. Baca Juga : Siasat Sembunyi di Area Parkir RS Gagal, 3 Penyelundup Ganja Diringkus Seluruh peserta menyatakan setuju. Rapat ini dihadiri oleh Pimpinan Komisi VIII, Komisi IX, dan Komisi XI DPR RI, serta melibatkan sejumlah menteri yakni, Kementerian Sosial, Kementerian Kesehatan, hingga BPJS Kesehatan. Fokus utama pertemuan adalah memitigasi persoalan penonaktifan peserta PBI yang sering kali menjadi keluhan di tengah masyarakat. Rapat ini juga untuk menegaskan pentingnya perbaikan ekosistem tata kelola jaminan kesehatan agar program bantuan sosial tersebut tepat sasaran bagi masyarakat miskin. Dasco menjelaskan bahwa program PBI merupakan bantuan sosial pemerintah yang krusial agar warga tidak mampu tidak perlu mengeluarkan biaya pengobatan. Prioritas program ini, kata dia, harus mereka yang berada di kategori miskin atau rentan miskin. Rapat konsultasi lintas komisi bersama sejumlah menteri dan lembaga negara untuk merespons dinamika penonaktifan jaminan sosial terkait kepesertaan BPJS Kesehatan segmen Penerima Bantuan Iuran (PBI). Foto: TVR Parlemen. Oleh karena itu, lanjut Dasco, DPR menilai perlu adanya koordinasi intensif antar-alat kelengkapan dewan dan pemerintah untuk melakukan sinkronisasi data dan regulasi. Perbaikan tata kelola yang terintegrasi diharapkan mampu mencegah terjadinya penonaktifan kepesertaan secara sepihak yang merugikan masyarakat kecil. ""Oleh karenanya, perlu ada perbaikan ekosistem tata kelola jaminan kesehatan yang terintegrasi dalam rangka mitigasi penonaktifan program BPJS Kesehatan Penerima Bantuan Iuran,"" tegas Dasco. Metrotv © Copyright 2007 - 2026. All Rights Reserved","https://www.metrotvnews.com/read/bVDCPw55-dpr-gelar-rapat-bahas-mitigasi-penonaktifan-peserta-bpjs-pbi","Netral","metrotvnews.com","Kebijakan"
"79","Pemutakhiran Data Peserta PBI BPJS Kesehatan Sekali Sebulan","Dinda Shabrina, Rusman Paraqbueq","tempo.co","16 Februari 2026 | 16.02 WIB","Dalam proses pemutakhiran data peserta PBI BPJS Kesehatan, masyarakat berhak mengajukan sanggahan.","16 Februari 2026 | 16.02 WIB MENTERI Koordinator Pemberdayaan Masyarakat Muhaimin Iskandar mengatakan pemerintah akan memutakhirkan data peserta Penerima Bantuan Iuran (PBI) Badan Penyelenggara Jaminan Sosial (BPJS) Kesehatan satu kali dalam sebulan. Tujuannya, agar bantuan pemerintah itu tepat sasaran. “Kalau pemutakhiran data terpadu kesejahteraan sosial (DTKS) setiap tiga bulan, penerima PBI itu setiap satu bulan,” kata Muhaimin di Kantor Kemenko Pemberdayaan Masyarakat, Jakarta, pada Senin, 16 Februari 2026. Scroll ke bawah untuk melanjutkan membaca Ia mengatakan dalam proses pemutakhiran data akan dikonsolidasikan bersama dengan BPJS. “Ini penting untuk dikonsolidasikan supaya tidak terjadi kesalahpahaman,” kata dia. Ketua Umum Partai Kebangkitan Bangsa ini mengatakan, dalam pemutakhiran data, masyarakat tetap bisa mengajukan sanggahan atau koreksi terhadap data yang tercatat. Sanggahan data itu dapat dilakukan melalui tiga jalur. Yaitu, lewat Cek Bansos. call center , dan nomor WhatsApp Kementerian Sosial. Urusan BPJS Kesehatan ini menuai kritikan ketika pemerintah tiba-tiba menonaktifkan 11 juta peserta PBI BJPS Kesehatan, awal Februari 2026. Penonanktifan itu mengakibatkan puluhan ribu yang hendak mengontrol kesehatan di fasilitas kesehatan tak dilayani dengan menggunakan kartu BPJS Kesehatan. Belakangan pemerintah beralasan penonaktifan itu merupakan akibat dari pemutakhiran data peserta PBI. Kepala Badan Pusat Statistik (BPS) Amalia Adininggar Widyasanti mengatakan pemerintah akan menyelesaikan verifikasi lapangan terhadap 11 juta peserta yang dinonaktifkan ini selama dua bulan kerja. Verifikasi dilakukan untuk memastikan ada peserta PBI BPJS Kesehatan yang harus diaktifkan kembali, atau mereka dialihkan ke BPJS mandiri. Amalia menjelaskan proses verifikasi data tersebut. Ia mengatakan tim BPS di lapangan akan bekerja sama dengan pendamping Program Keluarga Harapan (PKH) Kementerian Sosial untuk mengecek langsung kesesuaian data peserta. “Di dalam Cek Bansos itu sudah dilengkapi dengan fitur untuk masyarakat bisa memutakhirkan desil-nya dengan cara mereka harus memasukkan keterangan dan juga mengisi form yang sudah kami sediakan. Jadi, masyarakat bisa segera aktif untuk melakukan pemutakhiran data di sana,” ujar Amalia. Ia melanjutkan, berdasarkan keputusan Menteri Sosial, desil 1 hingga desil 5 masuk dalam kategori peserta penerima PBI. “Artinya, data yang kami siapkan untuk mendukung kebijakan itu adalah perankingan atau pendesilan di tingkat nasional, bukan daerah,” kata dia. Amalie mengatakan proses perankingan dari desil 1 sampai desil 10 tingkat nasional akan berbeda dengan pendesilan di masing-masing daerah. “Ini mungkin yang harus jadi catatan buat kepala daerah,” katanya. Pilihan Editor: Sengkarut BPJS Kesehatan, Pemerintah dan DPR Bingung Lulusan Program Studi Jurnalistik Universitas Esa Unggul Jakarta. Mengawali karier jurnalistik di Tempo sejak pertengahan 2024. Kini meliput isu pendidikan, kesehatan dan sosial. PT NasDem Indonesia Raya Tbk PT NasDem Indonesia Raya Tbk PODCAST REKOMENDASI TEMPO Militer AS Langgar Wilayah RI, Kemlu: Sudah Ada Tindakan Ibadah Haji Sebentar Lagi, Kartu Nusuk Belum Terdistribusi Airlangga Pimpin Satgas Pertumbuhan Ekonomi Bentukan Prabowo Bandara Adi Soemarmo Siap Layani 29 Ribu Jemaah Haji Koalisi Sipil Nilai RUU KUHAP Minim Partisipasi Publik, Habiburokhman: Kami yang Omong Kosong atau Mereka Jejak Diplomasi Militer Indonesia di ASEAN Tanggapan YLBHI dan BEM SI soal TNI Telusuri Dalang di Balik Petisi Tolak RUU TNI dan Indonesia Gelap Retak Piring Koalisi Prabowo Ketua MPR: Penetapan Status Bencana Nasional Sepenuhnya Kewenangan Presiden Ibadah Haji Sebentar Lagi, Kartu Nusuk Belum Terdistribusi Militer AS Langgar Wilayah RI, Kemlu: Sudah Ada Tindakan Airlangga Pimpin Satgas Pertumbuhan Ekonomi Bentukan Prabowo Andrie Yunus Minta Prabowo Bentuk TGPF Reformasi Kenaikan Jabatan Profesor Politeknik Tempo Rayakan Dies Natalis ke-5 Pelita Buat Portal Terpadu Seleksi Masuk Politeknik Swasta Politeknik Tempo dan IKADIM Gelar Bedah Buku Soft Skills untuk Gen Z Kontroversi Jakarta sebagai Daerah Khusus Hujan Deras Sebabkan 21 RT di Jakarta Banjir Pagi Ini Ratusan Siswa di Pulau Anambas Diduga Keracunan MBG Penjelasan Dirut RSHS Bandung Soal Bayi Pasien Nyaris Hilang Sejarah Mushaf Sundawi, Al-Quran Bermotif Khas Jawa Barat Bandara Adi Soemarmo Siap Layani 29 Ribu Jemaah Haji Rincian Pengadaan Sikat dan Semir Sepatu Rp 1,5 Miliar BGN BGN Hamburkan Rp 1,5 Miliar buat Beli Sikat dan Semir Sepatu Mayoritas Anak Disabilitas Alami Kekerasan Sistematis Dianggap Tak Akomodatif bagi Disabilitas, UU ASN Digugat Kemenkes: Ketersediaan Evidence Base Kesehatan Jiwa Terbatas","https://www.tempo.co/politik/pemutakhiran-data-peserta-pbi-bpjs-kesehatan-sekali-sebulan-2115594","Netral","tempo.co","Kebijakan"
"80","Ratusan Ribu Peserta BPJS PBI Dinonaktifkan, Begini Langkah Jitu Antisipatif Pemkot Depok","","netralnews.com","","Begini langkah jitu antisipatif Pemerintah Kota (Pemkot) Depok terkait ratusan ribu peserta Badan Penyelenggara Jaminan Sosial (BPJS) Kesehatan Penerima Bantuan Iuran Jaminan Kesehatan (PBI JK) yang mendadak dinonaktifkan.","Berikut hasil skor quiz yang sudah Anda kerjakan. Apakah Anda yakin ingin menghapus komentar tersebut? Silakan berikan laporan Anda terkait komentar ini? Masukan email & password Anda. Masa berlangganan penulis Anda akan habis Apakah Anda yakin ingin melanjutkan proses ini? • Dengan menekan tombol ""Nanti Saja"", Anda hanya dapat membaca dan membagikan berita netralnews • Akun Anda dapat kembali digunakan untuk berinteraksi setelah menyetujui Ketentuan dan Kebijakan Privasi yang berlaku di netralnews","https://www.netralnews.com/ratusan-ribu-peserta-bpjs-pbi-dinonaktifkan-begini-langkah-jitu-antisipatif-pemkot-depok/QzBZZGdzV3pSenplMDI0b1hvREM1Zz09","Positif","netralnews.com","Sosial"
"81","Ombudsman Jateng Soroti Penonaktifan BPJS PBI yang Hambat Layanan Cuci Darah","Ombudsman RI","ombudsman.go.id","","SEMARANG, Jatengnews.id – Ombudsman Republik Indonesia Perwakilan Provinsi Jawa Tengah (Jateng) memberikan perhatian serius terhadap laporan warga terkait ter","SEMARANG, Jatengnews.id - Ombudsman Republik Indonesia Perwakilan Provinsi Jawa Tengah (Jateng) memberikan perhatian serius terhadap laporan warga terkait terhentinya akses layanan cuci darah bagi pasien gagal ginjal. Hal ini terjadi setelah status kepesertaan BPJS Kesehatan segmen Penerima Bantuan Iuran (PBI) mereka nonaktif secara tiba-tiba. Langkah BPJS yang menonaktifkan kepesertaan tanpa konfirmasi terlebih dahulu sangat merugikan masyarakat. Kondisi ini sangat fatal bagi pasien gagal ginjal yang menggantungkan hidupnya pada layanan cuci darah rutin. Kepala Perwakilan Ombudsman RI Provinsi Jawa Tengah, Siti Farida, menilai penonaktifan sepihak ini berpotensi melanggar hak masyarakat dalam memperoleh pelayanan kesehatan dasar. Ia menegaskan bahwa penyelenggara pelayanan publik wajib memberikan perhatian khusus kepada kelompok rentan. ""Penyelenggara layanan harus memberikan atensi khusus bagi kelompok rentan. Salah satu caranya adalah dengan menyediakan layanan responsif melalui posko pengaduan khusus bagi peserta yang kepesertaannya nonaktif,"" ujar Farida. Dorong Kolaborasi BPJS dan Pemerintah Daerah Ombudsman Jateng mendorong BPJS Kesehatan untuk proaktif membuka kanal layanan khusus. Kanal ini bisa ditempatkan di gerai BPJS, Mal Pelayanan Publik (MPP), maupun kanal pengaduan digital lainnya guna mempercepat proses pengaktifan kembali kepesertaan. Selain itu, Siti Farida juga meminta Pemerintah Daerah di Jawa Tengah-baik tingkat provinsi maupun kabupaten/kota-untuk bergerak aktif melalui: Verifikasi Data Harus Berkeadilan Farida menambahkan bahwa instansi terkait harus melakukan verifikasi dan validasi data penerima bantuan secara cermat. Pemerintah wajib melindungi hak kelompok rentan, namun di sisi lain harus segera mengoreksi jika terdapat bantuan yang tidak tepat sasaran. ""Jika warga memang membutuhkan layanan dan masuk kategori kelompok rentan, mereka harus tetap mendapatkan pelayanan. BPJS Kesehatan, Dinas Sosial, dan Dinas Kesehatan harus berkolaborasi menindaklanjuti setiap keluhan dengan cepat,"" tegasnya. Ombudsman RI Jawa Tengah berkomitmen memantau perkembangan kasus ini dan berkoordinasi dengan instansi terkait demi memastikan hak kesehatan masyarakat terpenuhi. Layanan Pengaduan: Bagi masyarakat Jawa Tengah yang mengalami dugaan maladministrasi, silakan berkonsultasi atau melapor ke Ombudsman Jateng melalui nomor WhatsApp 08119983737. Here settings can be configured...","https://ombudsman.go.id/perwakilan/news/r/pwkmedia--ombudsman-jateng-soroti-penonaktifan-bpjs-pbi-yang-hambat-layanan-cuci-darah","Negatif","ombudsman.go.id","Ekonomi"
"82","Dinsos Buka Layanan Reaktivasi PBI Nonaktif, Siap Layani 19.981 Peserta BPJS","","gorontalokab.go.id","","Dinas Sosial Kabupaten Gorontalo memberikan layanan intensif untuk menjamin akses kesehatan bagi 19.981 warga yang PBI-nya nonaktif imbas penyesuai...","LIMBOTO, KOMINFO – Pemerintah Kabupaten (Pemkab) Gorontalo melalui Dinas Sosial merespons penonaktifan kepesertaan Penerima Bantuan Iuran (PBI) yang berdampak pada 19.981 jiwa di daerah ini. Penonaktifan massal ini merupakan bagian dari pemutakhiran data nasional oleh Kementerian Sosial terhadap warga yang tidak lagi masuk dalam kategori desil 1 hingga 5. Kepala Dinas Sosial Kabupaten Gorontalo, Afriyani Katili, menjelaskan bahwa Pemkab Gorontalo telah mengambil langkah strategis dengan menanggung pembiayaan sekitar 12.000 jiwa melalui APBD. Sementara itu, sekitar 7.000 jiwa lainnya kini dalam proses pengusulan kembali ke skema APBN. ""Ini terjadi secara nasional, namun Pemkab Gorontalo berkomitmen penuh memastikan warga yang membutuhkan, terutama yang sedang menjalani perawatan medis, tetap mendapatkan pelayanan kesehatan tanpa hambatan,"" ujar Afriyani, Rabu (11/2/2026), ditemui di ruang kerjanya. Guna memberikan perlindungan maksimal, Dinas Sosial bersama BPJS Kesehatan membuka layanan percepatan reaktivasi bagi warga dalam kondisi mendesak, seperti pasien rawat inap, pasien operasi, atau ibu hamil yang akan melahirkan. Dengan status Universal Health Coverage (UHC) kategori Utama yang dimiliki Kabupaten Gorontalo, proses pengaktifan kembali kepesertaan dapat dilakukan secara instan dalam kurun waktu 3x24 jam. Hingga saat ini, tercatat sekitar 260 orang telah melapor dan mendapatkan layanan reaktivasi secara langsung. Warga yang terdampak cukup membawa persyaratan berupa KTP, Kartu Keluarga, surat keterangan desa, serta surat rujukan atau rawat inap ke kantor Dinas Sosial untuk segera diproses. Afriyani mengimbau masyarakat agar tetap tenang dan segera berkoordinasi dengan pemerintah desa atau Dinas Sosial jika mengetahui kepesertaan PBI mereka tidak aktif. Layanan intensif ini merupakan wujud nyata kehadiran pemerintah daerah dalam memastikan seluruh lapisan masyarakat tetap terlindungi dalam program Jaminan Kesehatan Nasional. Website Resmi Pemerintah Kabupaten Gorontalo. Menyajikan informasi publik yang transparan, akuntabel, dan terkini untuk masyarakat. Jl. Kol. Rauf Mo'o No. 357, Limboto, Kab. Gorontalo","https://gorontalokab.go.id/berita_read.php?id=875","Positif","gorontalokab.go.id","Pelayanan"
"83","YLKI Kritik Penonaktifan Peserta PBI BPJS Kesehatan","Mutia Yuantisya, Aditya Budiman","tempo.co","6 Februari 2026 | 14.44 WIB","Penonaktifan peserta PBI BPJS Kesehatan mencerminkan lemahnya sistem sosialisasi dan berpotensi melanggar hak konsumen atas informasi.","6 Februari 2026 | 14.44 WIB YAYASAN Lembaga Konsumen Indonesia (YLKI) mengkritik kebijakan penonaktifan kepesertaan Penerima Bantuan Iuran (PBI) BPJS Kesehatan yang belakangan ramai dikeluhkan masyarakat. YLKI menilai kebijakan tersebut berisiko menghambat akses layanan kesehatan, terutama bagi kelompok masyarakat miskin dan rentan yang sangat bergantung pada jaminan kesehatan negara. Ketua YLKI Niti Emiliana mengatakan bahwa peserta PBI merupakan kelompok konsumen rentan secara ekonomi karena iurannya ditanggung oleh negara. ""Penonaktifan tersebut sangat berdampak pada keberlanjutan layanan kesehatan bagi pasien rentan,” kata Niti dalam keterangan tertulis, Jumat, 6 Februari 2026. Scroll ke bawah untuk melanjutkan membaca Menurut dia, penonaktifan kepesertaan tanpa mekanisme perlindungan yang memadai dapat berdampak serius pada keberlanjutan layanan kesehatan. YLKI mempertanyakan mekanisme pemberian informasi kepada peserta PBI yang kepesertaannya dinonaktifkan. Penonaktifan tanpa pemberitahuan dinilai berpotensi menghambat layanan kesehatan, khususnya bagi pasien yang membutuhkan perawatan rutin. Kondisi ini mencerminkan lemahnya sistem sosialisasi dan berpotensi melanggar hak konsumen atas informasi yang jelas dan mudah diakses. Menurut YLKI, dampak penonaktifan paling berat dirasakan oleh pasien dengan penyakit kronis yang memerlukan pengobatan berkelanjutan, seperti pasien cuci darah, tuberkulosis, penyakit jantung, dan hipertensi. Terputusnya kepesertaan dapat menyebabkan terhentinya pengobatan dan berisiko membahayakan keselamatan pasien. YLKI meminta pemerintah menerapkan pengecualian dan masa transisi bagi peserta PBI yang sedang menjalani pengobatan rutin. Selain itu, pemerintah diminta menjamin obat, tindakan medis, dan layanan kesehatan tetap berjalan selama proses verifikasi dan pembaruan data kepesertaan. Sebagai tindak lanjut, YLKI berencana mengirimkan surat resmi kepada pemerintah, Kementerian Sosial, dan BPJS Kesehatan. Dalam surat tersebut, YLKI akan meminta penjelasan yang transparan serta mekanisme klarifikasi dan reaktivasi kepesertaan PBI yang mudah diakses dan tidak berbelit. YLKI juga membuka posko pengaduan bagi masyarakat yang kepesertaan PBI BPJS Kesehatannya dinonaktifkan. Pengaduan dapat disampaikan melalui surat elektronik [email protected] atau laman pelayananylki.or.id. Aduan tersebut akan dihimpun sebagai bahan advokasi dan evaluasi kebijakan yang akan disampaikan kepada pemerintah. YLKI menegaskan bahwa jaminan kesehatan merupakan amanat konstitusi sebagaimana diatur dalam Undang-undang Dasar Negara Republik Indonesia Tahun 1945. Menurut YLKI, kebijakan administratif, pembaruan data, maupun penyesuaian anggaran tidak seharusnya menjadi alasan terputusnya layanan kesehatan bagi warga negara, khususnya kelompok miskin dan rentan. Pilihan Editor: Dampak Ekonomi dan Risiko Fiskal 'Gentengisasi' Alumnus Program Studi Bahasa dan Sastra Indonesia Universitas Negeri Padang ini memulai karier jurnalistik di Tempo pada 2022. Ia mengawalinya dengan menulis isu ekonomi bisnis, politik nasional, perkotaan, dan saat ini menulis isu hukum dan kriminal. PT NasDem Indonesia Raya Tbk PT NasDem Indonesia Raya Tbk PODCAST REKOMENDASI TEMPO BI: PMI Manufaktur Triwulan I Naik ke Level 52,03 Persen Alasan Target PLTS 100 Gigawatt Dianggap Ambisius PTPP Siap Ikuti Keputusan Danantara soal Merger BUMN Karya Alasan OJK Ingin Kredit Bank ke Program Prioritas Pemerintah Mana Lebih Tepat: Harga BBM Naik atau Membatasi Konsumsi AI Bukan untuk Menggantikan Manusia Risiko Warga Negara Asing Menjabat Direksi BUMN Erick Thohir Bicara Peran Kementerian Setelah Ada Danantara Di Balik Rencana Pertamina Menggabungkan Tiga Anak Usaha Alasan Target PLTS 100 Gigawatt Dianggap Ambisius Antisipasi Rupiah Makin Terpuruk Syarat Longgar Kredit Rumah Pemerintah Rekrut 30 Ribu Manajer Koperasi Merah Putih Surplus Perdagangan Menyusut di Tengah Perang Iran Pertumbuhan yang Terasa Jauh dari Realitas Pemerintah Besar Menguji Pasar Tahun Pertama Prabowo: Nilai Tukar Rupiah Rontok Holding Maskapai BUMN Terbentuk Tahun Depan BI: PMI Manufaktur Triwulan I Naik ke Level 52,03 Persen PTPP Siap Ikuti Keputusan Danantara soal Merger BUMN Karya Alasan OJK Ingin Kredit Bank ke Program Prioritas Pemerintah KLH Apresiasi Pertamina Geothermal Dorong Ekonomi Sirkular Pertamina Kerja Sama dengan SK Group, ExxonMobil, dan Posco Zhejiang Weiming Ditunjuk jadi Pengelola PSEL di Bogor Raya","https://www.tempo.co/ekonomi/ylki-kritik-penonaktifan-peserta-pbi-bpjs-kesehatan-2113145","Negatif","tempo.co","Sosial"
"84","43 Ribu Penerima BPJS Kesehatan di Situbondo Dinonaktifkan - tribunjatim-timur.com","","jatim-timur.tribunnews.com","Tayang:Jumat, 6 Februari 2026 19:47 WIB","Sebanyak 43 ribu peserta Penerima JKN BPJS Kesehatan di Situbondo dinonaktifkan Kemensos karena perubahan desil dan validasi data kepesertaan.","Belum punya akun? Daftar Akun Download TribunX untuk Android & iOS Ringkasan Berita: 43 ribu peserta PBI JKN di Situbondo dinonaktifkan Kemensos Penyebab utama penonaktifan karena perubahan desil kesejahteraan Faktor lain meliputi NIK tidak valid, meninggal, dan pindah segmen Dinsos membuka mekanisme reaktivasi kepesertaan PBI JKN Pasien kronis tetap dijamin melalui koordinasi lintas instansi TRIBUNJATIMTIMUR.COM, Situbondo - Puluhan ribu peserta Penerima Bantuan Iuran Jaminan Kesehatan Nasional (PBI JKN) justru dinonaktifkan oleh Kementerian Sosial Republik Indonesia. Pelaksana Tugas (Plt) Kepala Dinas Sosial Pemkab Situbondo , Viskanto, mengungkapkan jumlah peserta PBI JKN yang dinonaktifkan mencapai 43 ribu orang. “Berdasarkan data totalnya ada sebanyak 43 ribu PBI JKN yang dinonaktifkan,” ujar Viskanto. Ia menyebut, saat ini Dinas Sosial masih melakukan validasi dan verifikasi data terhadap peserta yang kepesertaannya dinonaktifkan tersebut. “Untuk penjelasan lebih detail bisa ditanyakan ke Kepala Bidang Dayasos,” tambahnya. Baca juga: Tembok Penahan Jalan di Situbondo Ambrol Timpa Rumah Warga Perubahan Desil Kepala Bidang Pemberdayaan Sosial dan Penanganan Fakir Miskin (Dayasos) Dinsos Situbondo , Erwan Ari Triyono, menjelaskan bahwa penonaktifan puluhan ribu peserta PBI JKN disebabkan oleh perubahan desil atau peringkat kesejahteraan. “Yang semula berada di desil 1 sampai 5, ternyata berubah menjadi desil 6 sampai 10,” ujar Erwan di kantornya, Jumat (6/2/2026). Selain perubahan desil, Erwan menyebut terdapat sejumlah faktor lain yang menyebabkan kepesertaan dinonaktifkan. “Ada NIK yang tidak ditemukan, peserta meninggal dunia, pindah segmen kepesertaan, hingga data pekerjaan yang tidak sesuai,” jelasnya. Penonaktifan tersebut, lanjut Erwan, mengacu pada Surat Keputusan Menteri Sosial Nomor 03/HUK/2026. Baca juga: Ngaku Dipukul dan Uangnya Dirampas, Pemuda di Situbondo Lapor Polisi Reaktivasi Terkait dampak penonaktifan tersebut, Erwan mengatakan pihaknya telah melakukan koordinasi dengan Dinas Kesehatan dan BPJS Kesehatan , khususnya untuk memastikan pasien dengan kebutuhan layanan kesehatan berkelanjutan tetap terlayani. “Contohnya pasien cuci darah dan penderita jantung,” ujarnya. Bagi peserta yang kepesertaannya dinonaktifkan, Dinsos membuka peluang reaktivasi PBI JKN dengan melengkapi sejumlah persyaratan. “Pemohon bisa mengajukan reaktivasi dengan melampirkan KTP, KK, serta rekomendasi dari fasilitas kesehatan dan Dinsos. Setelah itu kami proses ke Kemensos,” terangnya. TRIBUNJATIMTIMUR.COM, Situbondo - Puluhan ribu peserta Penerima Bantuan Iuran Jaminan Kesehatan Nasional (PBI JKN) justru dinonaktifkan oleh Kementerian Sosial Republik Indonesia. Pelaksana Tugas (Plt) Kepala Dinas Sosial Pemkab Situbondo , Viskanto, mengungkapkan jumlah peserta PBI JKN yang dinonaktifkan mencapai 43 ribu orang. “Berdasarkan data totalnya ada sebanyak 43 ribu PBI JKN yang dinonaktifkan,” ujar Viskanto. Ia menyebut, saat ini Dinas Sosial masih melakukan validasi dan verifikasi data terhadap peserta yang kepesertaannya dinonaktifkan tersebut. “Untuk penjelasan lebih detail bisa ditanyakan ke Kepala Bidang Dayasos,” tambahnya. Baca juga: Tembok Penahan Jalan di Situbondo Ambrol Timpa Rumah Warga Kepala Bidang Pemberdayaan Sosial dan Penanganan Fakir Miskin (Dayasos) Dinsos Situbondo , Erwan Ari Triyono, menjelaskan bahwa penonaktifan puluhan ribu peserta PBI JKN disebabkan oleh perubahan desil atau peringkat kesejahteraan. “Yang semula berada di desil 1 sampai 5, ternyata berubah menjadi desil 6 sampai 10,” ujar Erwan di kantornya, Jumat (6/2/2026). Selain perubahan desil, Erwan menyebut terdapat sejumlah faktor lain yang menyebabkan kepesertaan dinonaktifkan. “Ada NIK yang tidak ditemukan, peserta meninggal dunia, pindah segmen kepesertaan, hingga data pekerjaan yang tidak sesuai,” jelasnya. Penonaktifan tersebut, lanjut Erwan, mengacu pada Surat Keputusan Menteri Sosial Nomor 03/HUK/2026. Baca juga: Ngaku Dipukul dan Uangnya Dirampas, Pemuda di Situbondo Lapor Polisi Terkait dampak penonaktifan tersebut, Erwan mengatakan pihaknya telah melakukan koordinasi dengan Dinas Kesehatan dan BPJS Kesehatan , khususnya untuk memastikan pasien dengan kebutuhan layanan kesehatan berkelanjutan tetap terlayani. “Contohnya pasien cuci darah dan penderita jantung,” ujarnya. Bagi peserta yang kepesertaannya dinonaktifkan, Dinsos membuka peluang reaktivasi PBI JKN dengan melengkapi sejumlah persyaratan. “Pemohon bisa mengajukan reaktivasi dengan melampirkan KTP, KK, serta rekomendasi dari fasilitas kesehatan dan Dinsos. Setelah itu kami proses ke Kemensos,” terangnya. Isi komentar sepenuhnya adalah tanggung jawab pengguna dan diatur dalam UU ITE.","https://jatim-timur.tribunnews.com/kabupaten-situbondo/35759/43-ribu-penerima-bpjs-kesehatan-di-situbondo-dinonaktifkan","Netral","jatim-timur.tribunnews.com","Kebijakan"
