"No","title","authors","source","published_date","summary","content","url","Sentiment","Penerbit","Tag"
"16","Pemerintah-DPR Sepakat Masalah BPJS PBI Diselesaikan dalam 3 Bulan","https://www.facebook.com/CNNIndonesia","cnnindonesia.com","2026/02/10 06:57:47","DPR dan pemerintah menyepakati untuk menyelesaikan masalah penonaktifan belasan juta peserta BPJS Kesehatan PBI JKN dalam tiga bulan.","DPR dan pemerintah menyepakati untuk menyelesaikan masalah penonaktifan belasan juta peserta BPJS Kesehatan segmen Penerima Bantuan Iuran Jaminan Kesehatan Nasional ( PBI JKN ) dalam tiga bulan. ""DPR dan pemerintah sepakat dalam jangka waktu tiga bulan ke depan semua layanan kesehatan tetap dilayani, dan PBI-nya dibayarkan pemerintah,"" ujar Wakil Ketua DPR Sufmi Dasco Ahmad membacakan kesimpulan rapat bersama sejumlah menteri membahas isu penonaktifan sejumlah kepesertaan BPJS PBI di kompleks parlemen, Senin (9/2). Di tempat sama, Menteri Sosial Saifullah Yusuf atau Gus Ipul menegaskan rumah sakit tidak boleh menolak pasien, termasuk mereka dengan penyakit kronis yang membutuhkan perawatan berkelanjutan, seperti cuci darah. ""Saya rasa dalam rapat tadi Pak Menkes sudah sangat jelas juga. Jangan ada rumah sakit yang menolak pasien. Selama tiga bulan ke depan ini akan dijamin,"" kata Gus Ipul. Penonaktifan sejumlah peserta BPJS PBI merupakan bagian dari transformasi data nasional yang mengacu pada Instruksi Presiden Nomor 4 Tahun 2025. Seluruh penyaluran subsidi dan bantuan sosial, termasuk PBI JKN, wajib menggunakan Data Tunggal Sosial dan Ekonomi Nasional (DTSEN) yang terus dimutakhirkan. Proses pemutakhiran dilakukan melalui usulan rutin pemerintah daerah, kemudian diverifikasi dan divalidasi sebelum ditetapkan alokasinya. Tahun lalu, lebih dari 13 juta peserta sempat dinonaktifkan, dengan sekitar 87 ribu peserta berhasil direaktivasi. ""Tahun ini diperkirakan sekitar 11 juta peserta akan dinonaktifkan, namun tetap tersedia mekanisme reaktivasi dan diharapkan prosesnya bisa lebih cepat,"" ujar Gus Ipul. Gus Ipul menegaskan untuk peserta dengan penyakit kronis yang membutuhkan perawatan berkelanjutan, layanan tidak boleh terhenti, dan pembiayaannya tetap ditanggung pemerintah selama masa transisi. ""Untuk penyakit kronis yang membutuhkan perawatan berkelanjutan, otomatis tidak boleh ditolak oleh rumah sakit dan pembiayaannya dibiayai oleh pemerintah,"" tegasnya. Gus Ipul juga menekankan alokasi PBI JKN tidak berubah, tetap sesuai ketentuan yang berlaku. Penyesuaian dilakukan dengan mengalihkan subsidi kepada kelompok yang lebih memenuhi kriteria, sementara pemerintah daerah memberikan dukungan melalui APBD, terutama di wilayah yang telah mencapai Universal Health Coverage (UHC). Sebagian peserta yang dinonaktifkan beralih ke skema mandiri BPJS Kesehatan, menandakan adanya kelompok masyarakat yang mampu membiayai kepesertaannya sendiri. ""Yang penting dipahami, alokasi tidak berubah. Hanya dialihkan agar lebih tepat sasaran,"" ujarnya. Masyarakat juga diajak ikut berpartisipasi dalam pemutakhiran data melalui kanal resmi, termasuk aplikasi cek bansos, pusat data, call center, dan WhatsApp. Partisipasi publik diharapkan dapat memastikan data penerima bantuan lebih tepat sasaran. FOTO: Pelayanan BPJS Kesehatan di Tengah Rencana Kenaikan Iuran ""Masyarakat luas boleh melakukan verifikasi, validasi, boleh melakukan usul melalui saluran yang kami buat diantaranya adalah aplikasi cek bansos di 021 171 untuk call center dan juga ada WA center. Jadi semuanya kita ajak untuk melakukan pemutakhiran,"" terangnya. Menteri Keuangan (Menkeu) Purbaya Yudhi Sadewa menilai penonaktifan jutaan peserta BPJS PBI sebagai masalah serius yang merugikan pemerintah, baik dari sisi anggaran maupun citra. ""Karena sedemikian besar orang yang terpengaruh dan mereka tidak tahu bahwa mereka sudah tidak masuk daftar lagi, sehingga kerasa itu 10 persen, kalau 1 persen gak ribut orang-orang"" ujar Purbaya. Menurutnya, penonaktifan peserta PBI secara massal memang seharusnya dilakukan bertahap, misalnya melalui mekanisme transisi selama tiga hingga lima bulan, agar masyarakat tidak terkejut. ""Ini yang musti dikendalikan ke depan. Kalau angkanya sedrastis begini ya di- smoothing sedikit lah, di average 3-5 bulan, terserah. Tapi, jangan menimbulkan kejutan seperti itu,"" ujar Purbaya. © 2026 Trans Media, CNN name, logo and all associated elements (R) and © 2017 Cable News Network, Inc. A Time Warner Company. All rights reserved. CNN and the CNN logo are registered marks of Cable News Network, Inc., displayed with permission.","https://www.cnnindonesia.com/ekonomi/20260210064126-78-1326436/pemerintah-dpr-sepakat-masalah-bpjs-pbi-diselesaikan-dalam-3-bulan/amp","Positif","cnnindonesia.com","Kebijakan"
"17","RSCM Pastikan Pasien BPJS PBI Tetap Dilayani: Keselamatan Nomor Satu","https://www.facebook.com/CNNIndonesia","cnnindonesia.com","2026/02/12 16:44:14","RSCM memastikan pasien BPJS PBI nonaktif tetap mendapatkan pelayanan. Keselamatan pasien diutamakan, meski ada masalah administrasi. Datanglah tanpa khawatir!","Rumah Sakit Cipto Mangunkusumo ( RSCM ), Jakarta Pusat, mengatakan para pasien sudah tidak perlu khawatir untuk berobat jika status BPJS Penerima Bantuan Iuran (PBI) nonaktif. Direktur Medik dan Keperawatan RSCM, Renan Sukmawan mengatakan pelayanan keselamatan pasien akan diprioritaskan di atas masalah administrasi. SCROLL TO CONTINUE WITH CONTENT ""Nomor satu layanan, enggak usah khawatir. Silakan datang ke semua layanan rumah sakit, apalagi rumah sakit vertikal, rumah sakit daerah seperti yang disampaikan pemerintah. Kita semua akan dilayani dengan baik. Keberhasilan, keselamatan pasien nomor satu. Administrasi mengikuti,"" ujar Renan kepada wartawan di Gedung RSCM Kiara, Jakarta, Kamis (12/2). Terkait dengan pasien berpenyakit katastropik atau kronis, Renan mengatakan BPJS PBI-nya sudah otomatis teraktivasi di RSCM. ""Kalau yang kami dapat informasi yang kita bisa bacakan, yang katastropik otomatis teraktivasi,"" katanya. Bahkan, kata Renan, pihaknya akan tetap melayani pasien terlepas dari status aktif atau tidaknya BPJS pasien tersebut. ""Sekali lagi, mungkin karena kami langsung enggak melihat statusnya itu hanya berhenti di status aktif-tidaknya hanya berhenti di admisi. Pasien kita layani. Nah, bahwa dia ngurus dan sebagainya, jadi praktis kami enggak melihat masalah itu,"" sambungnya. Lebih lanjut, Renan pun menyerukan agar para pasien BPJS PBI yang non-aktif untuk tidak khawatir karena pasti akan diberi pelayanan yang baik RSCM. ""Bapak-Ibu, teman-teman silakan. Keluarga pasien PBI, saudara-saudara kita yang menerima bantuan iuran untuk JKN, jangan khawatir. Datang ke mana saja di rumah sakit-rumah sakit kita, insyaallah siap kita beri pelayanan yang paling baik,"" tuturnya. Sebelumnya, Kementerian Sosial (Kemensos) disebut telah mengeluarkan surat keputusan (SK) agar pasien katastropik atau kronis penerima bantuan iuran (PBI) BPJS Kesehatan tetap dilayani secara gratis oleh rumah sakit. Hal itu disampaikan Menteri Kesehatan (Menkes) Budi Gunadi Sadikin usai rapat kerja dengan Komisi IX DPR, Rabu (11/2). Menurut Budi, lewat SK itu, PBI pasien katastropik otomatis telah kembali aktif. Terlebih, Budi juga sudah meminta masyarakat untuk melapor jika ada rumah sakit yang menolak melayani pasien katastropik atau kronis yang dihapus dari penerima BPJS Penerima Bantuan Iuran (PBI). ""Kalau ada rumah sakit-rumah sakit seperti itu tolong dilaporkan ke Dinas Kesehatan, Dinas Sosial, dan BPJS, karena itu harusnya dilayani dan dibayar oleh BPJS,"" kata Budi dalam rapat tersebut.","https://www.cnnindonesia.com/nasional/20260212155042-20-1327540/rscm-pastikan-pasien-bpjs-pbi-tetap-dilayani-keselamatan-nomor-satu","Positif","cnnindonesia.com","Pelayanan"
"18","Jarang Berobat, Apakah BPJS Kesehatan PBI akan Dinonaktifkan?","https://www.facebook.com/CNNIndonesia","cnnindonesia.com","2024/10/27 07:30:30","Sebagian masyarakat mungkin belum tahu, apakah kepesertaan BPJS Kesehatan PBI dapat otomatis dinonaktifkan apabila jarang digunakan berobat?","Peserta BPJS Kesehatan bisa mendapatkan layanan kesehatan gratis seumur hidup, baik itu untuk kepesertaan Penerima Bantuan Iuran (PBI) yang iurannya ditanggung pemerintah maupun peserta non-PBI. Pertanyaannya, apakah kepesertaan BPJS Kesehatan PBI dapat otomatis dinonaktifkan apabila jarang digunakan berobat? Apa sajakah yang menyebabkan penonaktifan status kepesertaan BPJS Kesehatan PBI? Simak penjelasannya. SCROLL TO CONTINUE WITH CONTENT Penerima Bantuan Iuran Jaminan Kesehatan alias PBI adalah kepesertaan BPJS meliputi orang yang tergolong fakir miskin dan orang tidak mampu menurut data Dinas Sosial. Untuk biaya iuran bulanan BPJS Kesehatan PBI tidak dibebani ke peserta, melainkan ditanggung sepenuhnya oleh pemerintah. Peserta BPJS PBI hanya dapat berobat di fasilitas tingkat 1 puskesmas kelurahan atau desa. Begitu juga dengan fasilitas rawat inap, BPJS PBI hanya berhak untuk BPJS kelas 3. Penonaktifan kepesertaan BPJS Kesehatan PBI telah diatur dalam Peraturan Menteri Sosial Republik Indonesia Nomor 5 Tahun 2016 tentang Pelaksanaan Peraturan Pemerintah Nomor 76 Tahun 2015 tentang Perubahan Atas Peraturan Pemerintah Nomor 101 Tahun 2012 Tentang Penerima Bantuan Iuran Jaminan Kesehatan. Penghapusan peserta PBI Jaminan Kesehatan jika tidak lagi memenuhi kriteria sebagai fakir miskin dan orang tidak mampu dikarenakan hal sebagai berikut: Lantas, apakah BPJS Kesehatan PBI bisa nonaktif karena jarang dipakai berobat? Mengacu ketentuan di atas, selama peserta BPJS Kesehatan PBI tidak memenuhi kriteria tersebut maka status kepesertaan masih tetap bisa digunakan sekalipun jarang berobat. Penonaktifan BPJS Kesehatan PBI akan dilakukan jika peserta telah naik kelas secara ekonomi dan statusnya berubah menjadi pekerja penerima upah (PPU). Bagi peserta BPJS PBI yang menyadari status kepesertaannya telah nonaktif dan ingin melakukan aktivasi kembali, berikut langkahnya. Sementara bagi peserta PBI yang status kepesertaannya nonaktif lebih dari enam bulan, perlu membawa dokumen, seperti KTP dan KK, ke Dinas Sosial untuk didaftarkan kembali ke dalam DTKS. Demikian penjelasan mengenai ketentuan penonaktif BPJS Kesehatan PBI yang perlu diketahui pesertanya.","https://www.cnnindonesia.com/edukasi/20241025113037-561-1159445/jarang-berobat-apakah-bpjs-kesehatan-pbi-akan-dinonaktifkan","Netral","cnnindonesia.com","Kebijakan"
"19","Ini Penyebab Status Kepesertaan PBI BPJS Kesehatan Tidak Aktif","https://www.facebook.com/CNNIndonesia","cnnindonesia.com","2026/02/06 18:15:10","Ada beberapa hal yang menjadi penyebab kepesertaan PBI di BPJS Kesehatan tidak aktif lagi. Simak penjelasannya berikut ini.","Baru-baru ini media sosial X diramaikan oleh keluhan soal BPJS Kesehatan yang menonaktifkan sejumlah peserta Penerima Bantuan Iuran Jaminan Kesehatan (PBI JK). Sebagai antisipasi, Anda perlu mengetahui apa saja penyebab kepesertaan PBI BPJS Kesehatan tidak aktif. Tak sedikit warganet yang mengakui bahwa kepesertaan mereka jadi nonaktif setelah mengecek melalui aplikasi Mobile JKN. Pihak BPJS Kesehatan sendiri sudah menanggapi perihal status kepesertaan PBI yang tiba-tiba nonaktif ini. SCROLL TO CONTINUE WITH CONTENT Berdasarkan keterangan Kepala Humas BPJS Kesehatan Rizzky Anugerah, seperti diberitakan Antara , penonaktifan dilakukan sebagai bagian dari penyesuaian data berdasarkan Surat Keputusan Menteri Sosial Nomor 3/HUK/2026 yang ditetapkan 19 Januari dan berlaku per 1 Februari 2026. Selain berdasarkan SK tersebut, sebenarnya ada beberapa penyebab umum kepesertaan PBI BPJS Kesehatan bisa tidak aktif. Apa saja itu? Merujuk Pasal 7 Peraturan Menteri Sosial (Permensos) Nomor 21 Tahun 2019, ada beberapa hal yang menyebabkan kepesertaan PBI bisa tiba-tiba dinonaktifkan. Berikut ini daftarnya: BPJS PBI merupakan peserta BPJS Kesehatan yang iurannya dibayarkan oleh pemerintah. Hal ini memungkinkan para peserta yang tidak mampu membayar sendiri, bisa mengakses layanan kesehatan secara. Adapun iurannya dibayarkan oleh pemerintah melalui Anggaran Pendapatan dan Belanja Negara (APBN) atau Anggaran Pendapatan dan Belanja Daerah (APBD). Peraturan ini tercantum dalam Peraturan Presiden (Perpres) Nomor 82 Tahun 2018 tentang Jaminan Kesehatan. Berikut ini sejumlah kriteria untuk menjadi penerima PBI JK: Demikian informasi terkait penyebab kepesertaan PBI BPJS Kesehatan tidak aktif lagi dan syarat menjadi penerimanya. Semoga bermanfaat.","https://www.cnnindonesia.com/edukasi/20260205121422-561-1324879/ini-penyebab-status-kepesertaan-pbi-bpjs-kesehatan-tidak-aktif","Netral","cnnindonesia.com","Kebijakan"
"20","Agar Tetap Dapat Layanan Kesehatan, Pemkot Denpasar Biayai 24.401Jiwa Peserta BPJS PBI Yang Dinonaktifkan - https://www.denpasarkota.go.id","","denpasarkota.go.id","","Denpasar, Pemerintah Kota Denpasar mengambil langkah untuk tetap membiayai 24.401 jiwa masyarakat Kota Denpasar peserta BPJS Kesehatan Penerima Bantu","Denpasar, Pemerintah Kota Denpasar mengambil langkah untuk tetap membiayai 24.401 jiwa masyarakat Kota Denpasar peserta BPJS Kesehatan Penerima Bantuan Iuran (PBI) dikarenakan masuk ke desil 6-10, menyusul penonaktifan kepesertaan BPJS Kesehatan tersebut berdasarkan Instruksi Presiden Nomor 4 Tahun 2025. Hal ini disampaikan oleh Wali Kota Denpasar, I Gusti Ngurah Jaya Negara, saat ditemui usai rapat koordinasi di kantor Wali Kota Denpasar, Senin (9/2) siang. Dalam keterangannya, Wali Kota Denpasar, I Gusti Ngurah Jaya Negara yang didampingi Kepala Dinas Sosial Kota Denpasar, I Gusti Ayu Laxmy Saraswati, Kepala Dinas Dukcapil Kota Denpasar, I Dewa Gede Juli Artabrata, dan Kepala Dinas Kesehatan Kota Denpasar, dr. Anak Agung Ayu Agung Candrawati mengemukakan, setidaknya dana yang disiapkan Pemerintah Kota Denpasar Rp9.233.578.000 untuk mengaktifkan kembali kepesertaan bulan Januari dan Februari 2026. ""Secara keseluruhan, Pemkot Denpasar telah menyiapkan dana Rp 62.228.554.400 milyar untuk pembiayaan kepesertaan BPJS Kesehatan selama setahun,"" ungkap Jaya Negara. Lebih jauh, Jaya Negara kemudian mengemukakan, pihaknya akan segera melakukan koordinasi dengan pihak BPJS Kesehatan agar masyarakat yang dinonaktifkan itu, segera dapat menggunakan pelayanan kesehatan di berbagai rumah sakit. ""Intinya kami akan segera berkoordinasi dengan pihak BPJS Kesehatan agar, segera diaktifkan. Ini untuk menghindari ada kejadian masyarakat yang betul-betul membutuhkan tidak mendapatkan layanan kesehatan. Nanti sambil jalan, kami akan melakukan verifikasi terhadap kepesertaan ini, bisa jadi dari jumlah tersebut memang ada perubahan status ekonomi dari peserta,"" kata Jaya Negara. Sementara itu, Kepala Dinas Sosial Kota Denpasar, I Gusti Ayu Laxmy Saraswati, mengungkapkan, pihak Dinas Sosial Kota Denpasar, melalui layanan Pobia Dinsos akan melakukan koordinasi perihal penonaktifan kepesertaan ini. Masyarakat yang membutuhkan layanan dapat menghubungi pihak Dinas Sosial Kota Denpasar terkait dengan hal ini, bisa melalui WA 0818-357-417 ""Untuk layanan Pobia secara online juga dapat menginformasikan jika ada warga mendadak non aktif langsung bisa ke nomor WA,"" katanya. Sebagai informasi, hingga 1 Februari 2026, jumlah keaktifan peserta BPJS Kesehatan berjumlah 593.145 jiwa atau sekitar 87.69% dari jumlah penduduk Denpasar secara keseluruhan pada semester I Tahun 2025, yakni 676.383 jiwa. ""Saat ini, warga Denpasar yang masuk desil 1-5 sebanyak 14.393 jiwa. Pemerintah Kota Denpasar juga menyediakan kuota sebanyak 113.505 jiwa/per bulan. Kami berharap ini bisa membantu jaminan layanan kesehatan terhadap masyarakat,"" katanya. (HumasDps/Win). Graha Sewaka Dharma Lumintang Lt. III, Kota Denpasar, Bali - Indonesia kominfo@denpasarkota.go.id https://www.denpasarkota.go.id","https://www.denpasarkota.go.id/berita/agar-tetap-dapat-layanan-kesehatan-pemkot-denpasar-biayai-24401jiwa-peserta-bpjs-pbi-yang-dinonaktifkan-260211","Positif","denpasarkota.go.id","Ekonomi"
"21","Jaminan Kesehatan Nonaktif, Dinkes Sukabumi Siapkan Hotline","Syahdan Alamsyah","detik.com","2026-03-09T13-30-04Z","Dinkes Sukabumi buka layanan pengaduan untuk warga terdampak penonaktifan jaminan kesehatan PBI JKN. Hubungi 0857-7521-1755 untuk bantuan darurat.","Dinas Kesehatan (Dinkes) Kabupaten Sukabumi bergerak cepat menyikapi persoalan penonaktifan jaminan kesehatan PBI JKN yang didanai APBN. Sebagai langkah solutif, Dinkes membuka layanan pengaduan khusus melalui saluran telepon dan WhatsApp bagi warga yang terdampak. Bagi masyarakat yang saat ini sedang menjalani perawatan di rumah sakit namun mendapati jaminan kesehatannya tidak lagi aktif, dapat segera menghubungi nomor layanan di 0857-7521-1755. SCROLL TO CONTINUE WITH CONTENT Layanan ini disiapkan khusus untuk memfasilitasi warga yang membutuhkan bantuan darurat terkait status kepesertaan jaminan kesehatan mereka. Kepala Dinas Kesehatan Kabupaten Sukabumi, Masykur Alawi, menegaskan bahwa pihaknya akan menindaklanjuti setiap permohonan bantuan yang masuk. Meski kewenangan reaktivasi melibatkan berbagai instansi, Dinkes berkomitmen untuk menjadi jembatan bagi masyarakat. ""Kami akan berkoordinasi dengan Dinas Sosial, BPJS, rumah sakit, dan instansi lainnya. Intinya, kami di Dinas Kesehatan insyaallah akan menerima informasi atau permohonan bantuan mengenai hal tersebut,"" ujar Masykur Alawi dalam keterangannya. Instruksi untuk Kepala Puskesmas Selain layanan darurat bagi pasien rumah sakit, Masykur juga menginstruksikan seluruh Kepala Puskesmas di Kabupaten Sukabumi untuk bersikap responsif. Warga yang belum membutuhkan layanan medis pun diminta untuk proaktif mengecek status kartu jaminan kesehatannya sejak dini. ""Cek kartu dan jaminannya sekarang. Jika ternyata tidak aktif, secepatnya kita akan berupaya memfasilitasi untuk reaktivasi melalui kolaborasi dengan Dinas Sosial, Disdukcapil, hingga BPJS,"" tegasnya. Dinkes memberikan perhatian khusus bagi sasaran rentan yang memerlukan layanan medis rutin. Masykur memerintahkan jajaran Puskesmas untuk melakukan pendataan detail terhadap warga dengan kondisi kesehatan tertentu agar jaminan mereka tetap terjaga. Kelompok prioritas tersebut meliputi masyarakat dengan penyakit degeneratif, penyakit kronis, gizi buruk, HIV, TB, hingga Orang Dengan Gangguan Jiwa (ODGJ). Selain itu, warga yang membutuhkan layanan cuci darah serta ibu hamil juga menjadi fokus utama pendataan status jaminan kesehatan. ""Kami akan memfasilitasi bagi warga yang layak untuk mendapatkan kembali jaminan kesehatan yang didanai pemerintah sesuai aturan yang berlaku. Sinergi lintas instansi terus kami lakukan agar masyarakat tetap mendapatkan hak layanan kesehatannya,"" pungkas Masykur.","https://www.detik.com/jabar/berita/d-8390805/jaminan-kesehatan-nonaktif-dinkes-sukabumi-siapkan-hotline","Positif","detik.com","Pelayanan"
"22","Reaktivasi 1,9 Juta Peserta PBI JKN di Jawa Barat Masih Berjalan","Bima Bagaskara","detik.com","2026-03-06T13-30-02Z","Proses reaktivasi 1,9 juta peserta PBI JKN di Jawa Barat terus berjalan. Dinkes memastikan tidak ada keluhan besar, target selesai dalam enam bulan.","Upaya mengaktifkan kembali kepesertaan jutaan warga miskin dalam program jaminan kesehatan di Jawa Barat masih terus berjalan. Hingga awal Maret 2026, proses reaktivasi sekitar 1,9 juta peserta Penerima Bantuan Iuran (PBI) Jaminan Kesehatan Nasional (JKN) masih berlangsung di tingkat pemerintah kabupaten dan kota. Dinas Kesehatan (Dinkes) Jawa Barat memastikan proses tersebut masih berada di jalurnya. Sejauh ini, belum ada keluhan besar yang muncul dari masyarakat selama tahapan reaktivasi berlangsung. SCROLL TO CONTINUE WITH CONTENT Kepala Dinkes Jawa Barat, Vini Adiani Dewi mengatakan, proses pengaktifan kembali kepesertaan BPJS Kesehatan PBI JKN saat ini memang sedang ditangani pemerintah daerah di tingkat kabupaten dan kota. ""Semua sedang berproses di tingkat kota dan kabupaten. Kami belum dapat keluhan terkait penonaktifan itu,"" kata Vini, Jumat (6/3/2026). Meski belum ada laporan kendala yang berarti, Dinkes Jawa Barat tetap bersiaga dan bakal turun tangan membantu masyarakat apabila ada hambatan ketika warga membutuhkan akses layanan kesehatan. Vini menegaskan, koordinasi lintas dinas sudah disiapkan untuk merespons setiap keluhan yang mungkin muncul. Jika ada persoalan yang berkaitan dengan data atau administrasi kepesertaan, Dinkes akan segera berkomunikasi dengan Dinas Sosial. ""Kalau ada keluhan, pasti kami langsung memberikan bantuan (yang berkaitan dengan akses pelayanan kesehatan),"" ujarnya. Proses reaktivasi ini tidak berlangsung tanpa batas waktu. Pemerintah daerah telah menetapkan target penyelesaian yang jelas. Berdasarkan kesepakatan lintas organisasi perangkat daerah (OPD) pada awal Februari 2026, proses reaktivasi kepesertaan PBI JKN di Jawa Barat ditargetkan rampung dalam waktu enam bulan. ""Kemarin kesepakatannya (target penyelesaian reaktivasi) dua kali tiga bulan,"" tutur Vini. Dengan target tersebut, masyarakat yang kepesertaannya dinonaktifkan diharapkan segera mengurus proses pengaktifan kembali melalui Dinas Sosial di daerah masing-masing. Langkah ini penting agar warga tetap bisa mengakses layanan kesehatan yang menjadi hak mereka. Adapun kemungkinan perubahan jumlah peserta atau pembaruan data kepesertaan, menurut Vini, sepenuhnya menjadi kewenangan teknis Dinas Sosial. ""Kalau itu datanya di Dinas Sosial,"" katanya.","https://www.detik.com/jabar/berita/d-8387052/reaktivasi-1-9-juta-peserta-pbi-jkn-di-jawa-barat-masih-berjalan","Positif","detik.com","Kebijakan"
