"No","title","authors","source","published_date","summary","content","url","Sentiment","Penerbit","Tag"
"1","Sistem Baru Kemensos Picu Penonaktifan BPJS PBI Warga Malang, Akses Kesehatan Terhambat","Sulis Astuti","acehground.com","2026-02-08T13:31:29+00:00","Ratusan warga Desa Donowarih, Malang, alami penonaktifan BPJS PBI mendadak akibat perubahan sistem pendataan Kemensos. Akses layanan kesehatan terhambat, desa kesulitan memantau data.","Minggu, 8 Februari 2026, 20:31 ACEHGROUND.COM – Sejumlah warga di Desa Donowarih, Kecamatan Karangploso, Kabupaten Malang , Jawa Timur, kini menghadapi kendala serius setelah kepesertaan BPJS Kesehatan Penerima Bantuan Iuran (PBI) mereka dinonaktifkan secara mendadak. Penonaktifan ini baru diketahui saat mereka membutuhkan perawatan medis, termasuk pasien dengan penyakit kronis yang memerlukan penanganan berkelanjutan di rumah sakit. Permasalahan ini, menurut pemerintah desa setempat, berakar pada perubahan sistem pendataan bantuan sosial di Kementerian Sosial . Sistem Data Terpadu Kesejahteraan Sosial (DTKS) telah bertransformasi menjadi Data Terpadu Sosial Ekonomi Nasional (DTSEN), yang berdampak langsung pada status kepesertaan PBI. Sekretaris Desa Donowarih, Ary Widy Hartono, menjelaskan bahwa perubahan ini menyebabkan klasifikasi warga ke dalam desil 1 hingga 10 berdasarkan pendataan Kemensos dari berbagai sumber. “Data warga itu sifatnya dinamis. Sekarang diklasifikasikan ke desil 1-10 berdasarkan pendataan Kemensos dari berbagai sumber, sehingga posisi desil warga bisa berubah,” kata Ary saat dihubungi pada Minggu (8/2). Ary menambahkan, penonaktifan terjadi ketika warga yang sebelumnya tergolong dalam desil 1-5 bergeser ke desil 6-10. Namun, kendala utama muncul karena pemerintah desa tidak menerima pembaruan data tersebut secara berkala. “Yang jadi persoalan, desa tidak menerima data perubahan itu secara berkala. Akibatnya, warga baru tahu BPJS-nya nonaktif ketika sudah sakit dan butuh layanan rumah sakit,” ujarnya. AcehGround mencatat bahwa setidaknya ada tiga warga yang telah mengadu ke pemerintah desa karena tidak dapat mengakses layanan kesehatan akibat status BPJS PBI mereka yang dinonaktifkan. Bagi warga yang tidak sedang sakit, perubahan status ini seringkali tidak disadari. Namun, bagi mereka yang memerlukan perawatan rutin, kondisi ini menjadi sangat krusial. “Dari tiga warga yang BPJS PBI mereka dinonaktifkan itu, satu pasien harus cuci darah secara rutin. Ada juga yang membutuhkan kontrol lanjutan ke rumah sakit,” jelas Ary. Meskipun seluruh warga yang melapor telah kembali mendapatkan kepesertaan aktif dan bisa mengakses layanan kesehatan, Ary mengakui keterbatasan pemerintah desa dalam memantau data secara menyeluruh. “Kami di desa tidak bisa memastikan berapa jumlah warga yang sebetulnya masih masuk desil 1-5, tetapi kepesertaan PBI-nya sudah dinonaktifkan. Padahal ketika PBI dihentikan, baik yang ditanggung APBN maupun APBD, statusnya langsung nonaktif total,” paparnya. Minimnya keterbukaan data dan pemahaman administrasi di tingkat desa memperparah persoalan, mendorong sebagian warga untuk beralih ke BPJS mandiri, meskipun kemudian kesulitan dalam membayar iuran. Selain itu, Ary juga menyoroti carut-marut data kependudukan yang lebih luas. “Masih ada lebih dari 200 warga yang sudah meninggal tetapi tercatat dalam data. Ini berdampak langsung pada BPJS dan bantuan sosial,” kata Ary. Situasi ini menggarisbawahi pentingnya pembaruan data yang akurat dan transparan untuk memastikan bantuan sosial, termasuk akses kesehatan, tepat sasaran. Ary berharap pemerintah pusat segera melakukan pembaruan data kependudukan secara menyeluruh dan membuka akses keterbukaan data yang lebih baik bagi pemerintah desa. “Kalau data kependudukan rapi dan terbuka, bantuan akan lebih tepat sasaran, warga tidak lagi kesulitan saat sakit, dan potensi penyimpangan bisa ditekan,” pungkasnya. Jumat, 10 April 2026, 14:02 Jumat, 10 April 2026, 14:01 Jumat, 10 April 2026, 14:00 Jumat, 10 April 2026, 13:13 Jumat, 10 April 2026, 11:43 Menu Makan Bergizi Gratis di Aceh Selatan Berbelatung, Siswa SDN 1 Panton Luas dan SMPN 3 Sawang Trauma Prediksi Atletico Madrid vs Real Sociedad 19 April 2026: Ambisi Los Colchoneros vs Motivasi La Real Erick Thohir dan Maruarar Sirait Rancang Piala Presiden 2026 dengan Format Dua Turnamen Berbeda Prediksi Persebaya vs Madura United 17 April 2026: Misi Bajol Ijo Amankan Poin di Derbi Suramadu Jorginho Beberkan Sisi Lain Mikel Arteta: Latihan Bola Mati di Arsenal Terasa Seperti Tugas Sekolah acehground[at]protonmail.com Pedoman Perlindungan Wartawan Berita Aceh - Berita Aceh Hari Ini - Berita Aceh Terkini Jln Gla Deyah, Krueng Barona Jaya, Aceh Besar","https://www.acehground.com/nasional/sistem-baru-kemensos-picu-penonaktifan-bpjs-pbi-warga-malang-akses-kesehatan-terhambat/#google_vignette","Negatif","acehground.com","Kebijakan"
"2","Dinsos Lebak-BPS kolaborasi lakukan ""groundcheck"" PBI JKN - ANTARA News Banten","ANTARA News Agency","banten.antaranews.com","2026-03-06T17:05:34+07:00","Dinas Sosial (Dinsos ) Kabupaten Lebak dan Badan Pusat Statistik (BPS) berkolaborasi untuk melakukan pemeriksaan lapangan atau groundcheck terhadap 179.710 ...","Lebak (ANTARA) - Dinas Sosial (Dinsos ) Kabupaten Lebak dan Badan Pusat Statistik (BPS) berkolaborasi untuk melakukan pemeriksaan lapangan atau groundcheck terhadap 179.710 warga miskin Penerima Bantuan Iuran (PBI) Jaminan Kesehatan Nasional (JKN) yang terdampak pemutakhiran data. ""Kita akan melakukan pemeriksaan lapangan itu mulai April 2026, selama dua bulan ke depan, yang melibatkan petugas BPS dan pendamping Program Keluarga Harapan (PKH),"" kata Plt Kepala Dinas Sosial (Dinsos) Kabupaten Lebak, Lela Gifty Cleria di Lebak, Jumat. Dinsos Kabupaten Lebak meminta masyarakat, khususnya penerima manfaat dapat memberikan keterangan secara jujur saat petugas melakukan pemeriksaan lapangan. Sebab, hasil pemutakhiran akan diserahkan kepada BPS untuk diverifikasi dan divalidasi untuk penetapan kebijakan dan pelaksanaan program. Baca juga: 42 ribu penerima manfaat dipastikan tetap jadi peserta PBI JKN Masyarakat Kabupaten Lebak yang dinonaktifkan BPJS PBI pada 1 Februari 2026 lalu sebanyak 179.710 penerima manfaat. Pemutakhiran data tersebut untuk penetapan penerima BPJS PBI dengan mengacu pada Keputusan Menteri Sosial (Kepmensos) Nomor 3/HUK/2026, yang menjelaskan bahwa PBI-JKN diperuntukkan bagi masyarakat dalam desil 1 - 5 Data Tunggal Sosial dan Ekonomi Nasional. ""Kami berharap pelaksanaan pemeriksaan lapangan berjalan lancar,"" katanya menjelaskan. Lela mengatakan, pihaknya telah mengaktifkan kembali BPJS PBI yang positif teridentifikasi menderita penyakit kronis atau katastropik, seperti cuci darah dan gawat darurat. Sedangkan, pasien yang menjalani pengobatan dan perawatan rumah sakit dibantu oleh program Pemda Universal Health Coverage (UHC) yang bekerja sama pemerintah daerah dengan BPJS Kesehatan untuk menjamin warganya menerima layanan kesehatan gratis. Baca juga: Pemkot Serang gandeng 8 RS untuk layani pasien Jamkesda Dia meminta masyarakat untuk melakukan reaktivasi BPJS PBI, dengan melapor ke Dinsos dan membawa kelengkapan Surat Keterangan Tidak Mampu (SKTM), fotokopi KTP, serta fakta integritas kepala desa. Berkas tersebut dapat diproses melalui Mal Pelayanan Publik dengan waktu maksimal 14 hari. Selama ini, pelayanan kesehatan tidak boleh terhambat oleh persoalan administrasi, terutama dalam kondisi darurat ""Bila pasien sudah gawat, jangan tunggu BPJS aktif dulu. Datang saja ke rumah sakit untuk mendapatkan penanganan medis pasti dilayani. Soal Administrasi menyusul,"" katanya menjelaskan. Baca juga: Reaktivasi BPJS-PBI di kelurahan bawa surat rujukan puskesmas Pewarta: Mansyur suryana Editor : Bayu Kuncahyo COPYRIGHT © ANTARA 2026","https://banten.antaranews.com/berita/374783/dinsos-lebak-bps-kolaborasi-lakukan-groundcheck-pbi-jkn","Netral","banten.antaranews.com","Kebijakan"
"3","776 peserta BPJS PBI di Temanggung direaktivasi - ANTARA News Jateng","ANTARA News Agency","jateng.antaranews.com","Thu, 19 Feb 2026 22:43:36 +0700","Dinas Sosial Kabupaten Temanggung, Jateng&nbsp;menyebut 776 peserta BPJS&nbsp;Penerima Bantuan Iuran (PBI) yang sebelumnya dinonaktifkan telah direaktivasi&nbsp;selama Februari ANTARA News jateng peristiwa ...","Temanggung (ANTARA) - Dinas Sosial Kabupaten Temanggung, Jateng menyebut 776 peserta BPJS Penerima Bantuan Iuran (PBI) yang sebelumnya dinonaktifkan telah direaktivasi selama Februari 2026, setelah adanya kebijakan pemerintah pusat membuka kembali akses bagi peserta yang memenuhi kriteria tertentu. Kepala Dinas Sosial Kabupaten Temanggung Umi Lestari Nurjanah di Temanggung, Kamis, mengatakan ratusan peserta tersebut diaktifkan kembali setelah mengajukan reaktivasi sejak awal Februari 2026. ""Sampai cut off 18 Februari 2026, ada 776 peserta BPJS PBI yang sudah direaktivasi. Itu pengajuan dari tanggal 2 sampai 14 Februari 2026,"" katanya. Ia menjelaskan kebijakan tersebut bertujuan mengalihkan kepesertaan dari masyarakat kategori mampu atau desil 6–10 ke masyarakat tidak mampu yang masuk desil 1–5. Kuota kepesertaan secara umum, katanya, tidak berkurang dan bahkan bertambah, karena hanya dialihkan kepada yang lebih berhak. ""Jadi sebenarnya ini pengalihan, bukan pengurangan. Kuotanya tetap, bahkan ada penambahan. Yang dinonaktifkan dialihkan ke masyarakat yang lebih layak menerima,"" katanya. Namun, kebijakan tersebut sempat menimbulkan keresahan, terutama bagi peserta yang sedang menjalani pengobatan rutin penyakit kronis, seperti cuci darah, yang mendadak tidak dapat mengakses layanan BPJS karena statusnya nonaktif. ""Yang ramai itu karena ada peserta yang punya penyakit kronis atau rutin berobat, tiba-tiba statusnya nonaktif tanpa pemberitahuan sebelumnya,"" katanya. Ia menyampaikan pemerintah kemudian memberikan ruang reaktivasi bagi peserta yang memenuhi syarat, yakni tergolong tidak mampu, menderita penyakit kronis atau katastropik, serta kondisi darurat yang mengancam jiwa. Pewarta: Heru Suyitno Editor: Immanuel Citra Senjaya COPYRIGHT © ANTARA 2026","https://jateng.antaranews.com/berita/621222/776-peserta-bpjs-pbi-di-temanggung-direaktivasi","Positif","jateng.antaranews.com","Kebijakan"
"4","Gubernur DKI pastikan 270 ribu peserta PBI BPJS tetap dilayani - ANTARA News Megapolitan","ANTARA News Agency","megapolitan.antaranews.com","2026-02-10T16:40:15+07:00","Gubernur DKI Jakarta Pramono Anung memastikan bahwa 270.000 peserta Penerima Bantuan Iuran (PBI) BPJS Kesehatan di Jakarta yang terdampak pemutakhiran data ...","Jakarta (ANTARA) - Gubernur DKI Jakarta Pramono Anung memastikan bahwa 270.000 peserta Penerima Bantuan Iuran (PBI) BPJS Kesehatan di Jakarta yang terdampak pemutakhiran data tetap bisa berobat dan mendapatkan layanan kesehatan secara baik. Adapun penonaktifan tersebut merupakan kebijakan pemerintah pusat terkait pemutakhiran data kepesertaan yang mulai berlaku 1 Februari 2026. “Saya sudah menyampaikan kepada Ibu Kepala Dinas dan jajaran kesehatan yang ada di Jakarta apakah reaktivasi ini berjalan dengan baik atau tidak. Tetapi pemerintah Jakarta tetap harus hadir,” kata Pramono di Jakarta Pusat, Selasa. Pramono mengatakan, Pemerintah Provinsi Jakarta akan tetap memberikan pelayanan yang sama termasuk untuk penyakit berat yang diderita. Layanan kesehatan yang diberikan termasuk penanganan penyakit berat, rawat inap, cuci darah, operasi katarak, layanan darurat serta layanan kesehatan rutin di puskesmas dan rumah sakit. Pramono mengatakan, pihaknya masih menunggu pemutakhiran data dari Kementerian Koordinator Bidang Pembangunan Manusia dan Kebudayaan (Kemenko PMK) dan Kementerian Sosial. “Tetapi yang jelas Jakarta dalam hal ini tetap memberikan pelayanan yang tidak berkurang bagi masyarakat yang harus diaktivasi kembali,” kata Pramono. Kepala Dinas Kesehatan DKI Jakarta, Ani Ruspitawati menjelaskan, bagi warga yang membutuhkan layanan darurat atau layanan yang tidak dapat dihentikan, seperti cuci darah atau rawat inap, Pemprov DKI akan segera mengambil langkah administratif. “Kalau layanan darurat atau yang tidak bisa berhenti, ketika PBI JK-nya dinonaktifkan, akan langsung kami alih segmenkan ke PBI Pemda,” ujar Ani. Untuk layanan yang tidak bersifat darurat, Pemprov DKI akan membantu proses reaktivasi PBI JK melalui mekanisme yang berlaku. Proses ini dilakukan oleh Dinas Sosial dengan tahapan ""ground checking"" untuk memastikan kelayakan penerima bantuan. “Kalau masih masuk Desil 1 sampai 5, maka PBI JK-nya akan direaktivasi kembali,” katanya. Ani juga menegaskan, proses pengaktifan kepesertaan BPJS Kesehatan di Jakarta relatif lebih mudah karena Jakarta telah mencapai ""Universal Health Coverage"" (UHC) di atas 99 persen. “Untuk kondisi darurat, rumah sakit bisa langsung berkoordinasi dengan puskesmas domisili peserta. Reaktivasi atau alih segmen bisa langsung dilakukan di puskesmas,” katanya. Sementara untuk kondisi non-darurat, reaktivasi kepesertaan dilakukan melalui mekanisme Dinas Sosial sesuai prosedur yang berlaku. Pewarta: Lifia Mawaddah Putri Uploader : Naryo COPYRIGHT © ANTARA 2026","https://megapolitan.antaranews.com/berita/496138/gubernur-dki-pastikan-270-ribu-peserta-pbi-bpjs-tetap-dilayani","Positif","megapolitan.antaranews.com","Pelayanan"
"5","Puluhan ribu PBI JK Lombok Tengah terancam nonaktif, cek segera!","ANTARA News Agency","mataram.antaranews.com","Fri, 17 Apr 2026 18:21:01 +0700","Badan Penyelenggara Jaminan Sosial (BPJS) Kesehatan mengingatkan warga Kabupaten Lombok Tengah, Provinsi Nusa Tenggara Barat (NTB) untuk mengecek status kepesertaan Penerima ANTARA News mataram 38 ...","Lombok Tengah (ANTARA) - Badan Penyelenggara Jaminan Sosial (BPJS) Kesehatan mengingatkan warga Kabupaten Lombok Tengah, Provinsi Nusa Tenggara Barat (NTB) untuk mengecek status kepesertaan Penerima Bantuan Iuran Jaminan Kesehatan (PBI JK). ""Ada 93 ribu kepesertaan PBI JK di Lombok Tengah yang dilakukan penonaktifan,"" kata Kepala BPJS Kesehatan Cabang Selong Elly Widiani saat silaturahim dengan wartawan di Lombok Tengah, Jumat. Ia mengatakan Kabupaten Lombok Tengah telah menerapkan universal health care (UHC) dan cakupan kepesertaan BPJS Kesehatan mencapai 1.142.173 jiwa atau 98,99 persen. ""Lombok Tengah telah UHC untuk menjamin pelayanan kesehatan bagi masyarakat,"" katanya. Baca juga: Kabar baik! 66 ribu Warga Lombok Tengah kembali aktif jadi peserta BPJS PBI Ia mengatakan keaktifan kepesertaan PBI JK pada Januari 2026 mencapai 80 persen, namun pada Februari menurun menjadi 75 persen. ""Tahun ini sebanyak 93 ribu PBI JK dinonaktifkan,"" katanya. Oleh karena itu, ia mengimbau kepada masyarakat untuk melakukan pengecekan status kepesertaan PBI JK dan melakukan reaktivasi melalui petugas yang disiapkan di masing-masing desa. Pihaknya juga telah melakukan sosialisasi kepada pemerintah desa agar reaktivasi kepesertaan PBI JK bisa ditingkatkan. ""Sampai saat ini sekitar 60 ribu PBI JK yang telah dilakukan reaktivasi,"" katanya. Baca juga: Lombok Tengah membentuk Ranperda program jaminan sosial Ketenagakerjaan Ia mengatakan pihaknya berharap kepada rumah sakit untuk tidak menolak pasien yang kepesertaan PBI JK-nya dinonaktifkan, tetapi diharapkan melakukan koordinasi untuk dilakukan reaktivasi. ""RS tidak boleh menolak, meskipun kartu PBI JK warga dinonaktifkan, tetapi diarahkan untuk reaktivasi,"" katanya. Oleh karena itu, masyarakat tidak perlu panik dengan penonaktifan kartu PBI JK tersebut, karena masih bisa dilakukan reaktivasi. Ia mengatakan JKN bertujuan untuk memberikan perlindungan masyarakat, sehingga mendapatkan kepastian jaminan kesehatan dan diharapkan dapat meningkatkan produktivitas serta kesejahteraan masyarakat. ""Cek status kepesertaan, karena cukup banyak dinonaktifkan,"" katanya. Pewarta : Akhyar Rosidi Editor: Abdul Hakim COPYRIGHT © ANTARA 2026","https://mataram.antaranews.com/berita/539015/puluhan-ribu-pbi-jk-lombok-tengah-terancam-nonaktif-cek-segera","Negatif","mataram.antaranews.com","Kebijakan"
"6","Pemerintah bantu jaminan kesehatan nasional 96,8 juta masyarakat","antaranews.com","antaranews.com","2025-07-15T18:57:14+07:00","Menteri Kesehatan (Menkes) Budi Gunadi Sadikin menyatakan pemerintah telah membantu jaminan kesehatan nasional (JKN) 96,8 juta masyarakat kategori miskin ...","Jakarta (ANTARA) - Menteri Kesehatan (Menkes) Budi Gunadi Sadikin menyatakan pemerintah telah membantu jaminan kesehatan nasional (JKN) 96,8 juta masyarakat kategori miskin melalui skema Penerima Bantuan Iuran (PBI). ""Sebanyak 96,8 juta orang di- cover iuran BPJS Kesehatannya oleh pemerintah, masuk kategori PBI. Ini adalah orang-orang termiskin desil 1-4 (kelompok masyarakat dengan tingkat kesejahteraan terendah secara nasional),"" katanya dalam rapat dengar pendapat bersama Komisi IX DPR RI yang dipantau secara daring di Jakarta, Selasa. Menkes juga memaparkan, penerimaan iuran segmen PBI mendominasi penerimaan JKN, sebesar 29 persen pada tahun 2024, dan peserta segmen PBI menduduki angka kunjungan tertinggi kedua di fasilitas kesehatan sampai dengan Mei 2025. ""Dalam setahun, ada 14,02 juta kunjungan dari penerima PBI yang besarnya sekitar 96 juta. 14,02 juta ini mengunjungi Fasilitas Kesehatan Rujukan Tingkat Lanjutan (FKRTL), 12,18 juta rawat jalan, dan 1,84 juta rawat inap,"" ujar dia. Ia melanjutkan, hingga Juni 2025, realisasi anggaran iuran PBI JKN sebesar 49,8 persen, atau Rp23,15 triliun. Jumlah peserta per Juni 2025 ada 96.282.139 jiwa, dengan jumlah pembayaran Rp3,84 miliar (berdasarkan Data Tunggal Sosial Ekonomi Nasional atau DTSEN). Sementara pagu anggaran iuran PBI JKN tahun anggaran 2025 yakni sebesar Rp46,4 triliun. Baca juga: Menkes tegaskan data PBI JKN yang valid hanya bersumber dari DTSEN Berdasarkan DTSEN, realisasi pembayaran iuran PBI JKN per Juni telah diberikan pada 96.283.048 jiwa. Angka tersebut belum mencapai kuota 96,8 juta per bulan dikarenakan ada bayi yang lahir dan belum memiliki Nomor Induk Kependudukan (NIK) sebanyak 116.952 jiwa, kemudian terdapat reaktivasi kuota PBI JKN sebesar 400 ribu. ""Ini (kuota reaktivasi) mesti digunakan Kementerian Sosial untuk diskusi dengan pemerintah daerah (pemda), yang penting ada by name by address (berdasarkan nama dan alamat) dan ada NIK-nya. Ada selisih sekitar 400 ribuan karena ada rekonsiliasi data itu, saat ini sedang dibersihkan oleh BPS. Jatahnya tetap diberikan, pemda bisa memasukkan nama-nama ke situ,"" paparnya. Budi juga menegaskan, data yang valid untuk PBI JKN hanya bersumber dari DTSEN. ""Sekarang kita sedang proses finalisasi, namun kita sudah setuju data itu ada di BPS, DTSEN. Kita boleh melakukan pemutakhiran data, tetapi begitu data sudah dimutakhirkan, harus kembali ke BPS. Hanya data BPS satu-satunya yang valid untuk PBI,"" ucapnya. Menkes mengakui bahwa data PBI JKN selama puluhan tahun tidak pernah sinkron, sehingga pemerintah seringkali kesulitan menentukan mana data yang benar dan yang tidak. ""Data PBI selama ini kita tidak pernah tahu mana yang benar atau enggak, antara Kemensos, Kemenkes, dan Dukcapil tidak pernah sama puluhan tahun. Kita berniat untuk membereskan ini, karena setiap tahun selalu diaudit Badan Pemeriksa Keuangan,"" ujar Budi. Ia menegaskan, seluruh data yang kini sedang dirapikan di BPS tersebut bertujuan untuk menghindari mereka yang berpenghasilan tinggi tetapi BPJS Kesehatannya masih dibayar oleh negara. Baca juga: Menkes: Siswa Sekolah Rakyat dapat fasilitas kacamata gratis Pewarta: Lintang Budiyanti Prameswari Editor: Triono Subagyo Copyright © ANTARA 2025 Dilarang keras mengambil konten, melakukan crawling atau pengindeksan otomatis untuk AI di situs web ini tanpa izin tertulis dari Kantor Berita ANTARA. Kirim Komentar menjadi tanggung-jawab Anda sesuai UU ITE.","https://www.antaranews.com/berita/4968377/pemerintah-bantu-jaminan-kesehatan-nasional-968-juta-masyarakat","Positif","antaranews.com","Ekonomi"
"7","Ramai peserta PBI dinonaktifkan, ini tanggapan BPJS Kesehatan","ANTARA News Agency","sumbar.antaranews.com","Tue, 14 Apr 2026 09:08:39 +0700","Belum lama ini, beredar informasi bahwa terdapat sejumlah peserta Program Jaminan Kesehatan Nasional (JKN) segmen Penerima Bantuan Iuran Jaminan Kesehatan (PBI JK) yang ANTARA News sumbar 21 ...","Jakarta (ANTARA) - Belum lama ini, beredar informasi bahwa terdapat sejumlah peserta Program Jaminan Kesehatan Nasional (JKN) segmen Penerima Bantuan Iuran Jaminan Kesehatan (PBI JK) yang dinonaktifkan. Menanggapi hal tersebut, Kepala Humas BPJS Kesehatan, Rizzky Anugerah menjelaskan bahwa penonaktifan tersebut dilandasi oleh Surat Keputusan Menteri Sosial Nomor 3/HUK/2026 yang berlaku per 1 Februari 2026. “Dalam SK tersebut, telah dilakukan penyesuaian di mana sejumlah peserta PBI JK yang dinonaktifkan, digantikan dengan peserta baru. Jadi, secara jumlah total peserta PBI JK sama dengan jumlah peserta PBI JK pada bulan sebelumnya. Pembaruan data PBI JK dilakukan secara berkala oleh Kementerian Sosial supaya data peserta PBI JK tepat sasaran. Peserta JKN yang dinonaktifkan tersebut bisa mengaktifkan kembali status kepesertaan JKN-nya jika yang bersangkutan memenuhi beberapa kriteria,” ujar Rizzky pada Rabu (04/02). Kriteria peserta PBI JK yang bisa mengaktifkan kembali yaitu pertama, peserta tersebut termasuk dalam daftar peserta PBI JK yang dinonaktifkan pada bulan Januari 2026. Kedua, jika berdasarkan verifikasi di lapangan, peserta termasuk kategori masyarakat miskin dan rentan miskin. Ketiga, jika peserta termasuk peserta yang mengidap penyakit kronis, atau dalam kondisi darurat medis yang mengancam keselamatan jiwanya. “Peserta PBI JK yang dinonaktifkan tersebut bisa melapor ke Dinas Sosial setempat dengan membawa Surat Keterangan Membutuhkan Layanan Kesehatan. Selanjutnya, Dinas Sosial akan mengusulkan peserta tersebut ke Kementerian Sosial, dan Kementerian Sosial akan melakukan verifikasi terhadap peserta yang diusulkan. Jika peserta lolos verifikasi, maka BPJS Kesehatan akan mengaktifkan kembali status JKN peserta tersebut, sehingga peserta yang bersangkutan dapat kembali mengakses layanan kesehatan,” kata Rizzky. Rizzky juga menerangkan, untuk mengecek apakah status kepesertaan JKN masih aktif atau tidak, peserta yang bersangkutan dapat menghubungi Pelayanan Administrasi melalui Whatsapp (PANDAWA) di nomor 08118165165, BPJS Kesehatan Care Center 165, Aplikasi Mobile JKN, atau melalui Kantor BPJS Kesehatan terdekat. Bagi peserta JKN yang sedang berobat di rumah sakit, jika perlu informasi atau butuh bantuan, juga bisa menghubungi petugas BPJS SATU. Nama, foto dan nomor kontak petugas BPJS SATU! terpampang pada ruang publik di rumah sakit tersebut. Masyarakat juga dapat menghubungi petugas Pemberi Informasi dan Penanganan Pengaduan (PIPP) yang secara khusus disediakan rumah sakit untuk melayani kebutuhan informasi dan menangani pengaduan pasien. “Sekali lagi kami imbau kepada masyarakat, selagi masih sehat harap meluangkan waktu mengecek status kepesertaan JKN-nya. Jika ternyata masuk ke dalam peserta yang dinonaktifkan, supaya bisa segera melakukan pengaktifan kembali. Jadi harapannya tidak terkendala jika mendadak perlu JKN untuk berobat,” ungkap Rizzky. Pewarta: Rilis Uploader: Laras Robert COPYRIGHT © ANTARA 2026","https://sumbar.antaranews.com/berita/757472/ramai-peserta-pbi-dinonaktifkan-ini-tanggapan-bpjs-kesehatan","Netral","sumbar.antaranews.com","Kebijakan"
